{
  "24.02.2022": {
    "date": "24.02.2022",
    "message": "Продолжается проведение специальной военной операции.\n\nГруппировки войск Донецкой и Луганской народных республик прорвали хорошо оборудованную эшелонированную оборону ВСУ, продвинулись на 6-8 километров в глубину. Это стало возможным благодаря огневой поддержке российской артиллерии и армейской авиации.\n\nВсе поставленные перед группировками войск Вооруженных Сил Российской Федерации на день задачи выполнены успешно.\n\nСовместным использованием рейдовых отрядов и воздушного десанта на крымском направлении обеспечен выход российских войск к городу Херсон. Это позволило разблокировать Северо-Крымский канал и восстановить подачу воды на полуостров Крым.\n\nВсего в результате ударов российских Вооруженных Сил выведены из строя 83 наземных объекта военной инфраструктуры Украины.\n\nС начала проведения специальной военной операции сбиты два Су-27, два Су-24, один вертолет и четыре ударных беспилотных летательных аппарата «Байрактар ТБ-2» вооруженных сил Украины.",
    "url": "https://z.mil.ru/spec_mil_oper/brief/briefings/more.htm?id=12410680@egNews",
    "destroyed": {
      "ИНФРАСТРУКТУРА": 83,
      "АЭРОДРОМЫ": 11,
      "КОМАНДНЫЕ ПУНКТЫ": 3,
      "РАДИОЛОКАТОРЫ": 18
    }
  },
  "25.02.2022": {
    "date": "25.02.2022",
    "message": "Группировки войск ДНР и ЛНР продолжают наступательные действия на позиции ВСУ при огневой поддержке Вооруженных Сил Российской Федерации.\n\nГруппировка войск Луганской Народной Республики продвинулась на глубину до 21 километра и овладела населенным пунктом Трехизбенка.\n\nСоединения и воинские части Донецкой Народной Республики, прорвав подготовленную оборону националистических батальонов, продвинулись до 25 километров и вышли к Волновахе.\n\nВ ходе боевых действий захвачено большое количество вооружений, поставленных западными странами на Украину за последние несколько месяцев.\n\nСреди трофеев американские противотанковые ракетные комплексы Javelin и британские NLAW.\n\nПодразделения Вооруженных Сил Российской Федерации блокировали в городах Сумы и Конотоп и принимают меры по обеспечению безопасности гражданского населения как в этих городах, так и в окрестных населенных пунктах.\n\nВсего российскими Вооруженными Силами выведено из строя 211 военных объектов инфраструктуры вооруженных сил Украины.\n\nСреди них: 17 пунктов управления и узлов связи ВСУ, 19 зенитных ракетных комплексов ПВО С-300 и «Оса», 39 радиолокационных станций.\n\nСбито: 6 боевых самолетов, 1 вертолет, 5 беспилотных летательных аппаратов.\n\nУничтожено 67 танков и других боевых бронированных машин, 16 реактивных систем залпового огня, 87 единиц специальной военной автомобильной техники.",
    "url": "https://z.mil.ru/spec_mil_oper/brief/briefings/more.htm?id=12410829@egNews",
    "destroyed": {
      "САМОЛЕТЫ": 6,
      "ВЕРТОЛЕТЫ": 1,
      "БЕСПИЛОТНИКИ": 5,
      "ЗЕНИТКИ": 19,
      "ТАНКИ И БМ": 67,
      "РСЗО": 16,
      "АВТОМОБИЛЬНАЯ ТЕХНИКА": 87,
      "КАТЕРА": 5,
      "ИНФРАСТРУКТУРА": 211,
      "АЭРОДРОМЫ": 11,
      "КОМАНДНЫЕ ПУНКТЫ": 17,
      "РАДИОЛОКАТОРЫ": 39
    }
  },
  "26.02.2022": {
    "date": "26.02.2022",
    "message": "Продолжается проведение специальной военной операции.\n\nГруппировки войск ДНР и ЛНР при огневой поддержке Вооруженных Сил России за сутки расширили участки прорыва в обороне противника и продолжают развивать успех наступления.\n\nГруппировка войск Луганской Народной республики продвинулась на глубину до 30 километров и овладела населенными пунктами Бахмутовка и Гречишкино.\n\nСоединения и воинские части Донецкой Народной республики, наступая в направлении Новомайское, продвинулись еще на 6 километров.\n\nНационалистические батальоны, отходя, взрывают за собой электроподстанции и мосты через реки.\n\nПодразделениями российских вооруженных сил установлен полный контроль над городом Мелитополь. Российские военнослужащие предпринимают все меры для обеспечения безопасности мирных жителей и исключения провокаций со стороны украинских спецслужб и националистов.\n\nВ течение ночи Вооруженные Силы Российской Федерации нанесли удар высокоточным оружием большой дальности с использованием крылатых ракет воздушного и морского базирования по объектам военной инфраструктуры Украины.\n\nЕще раз подчеркну, что огонь ведется только по объектам военной инфраструктуры ВСУ, исключая нанесение ущерба жилой и социальной инфраструктуре.\n\nВсего российскими Вооруженными Силами поражен 821 объект военной инфраструктуры Украины.\n\nСреди них: 14 военных аэродромов, 19 пунктов управления и узлов связи, 24 зенитных ракетных комплексов ПВО С-300 и «Оса», 48 радиолокационных станций.\n\nСбито: 7 боевых самолетов, 7 вертолетов, 9 беспилотных летательных аппаратов.\n\nУничтожено 87 танков и других боевых бронированных машин, 28 реактивных систем залпового огня, 118 единиц специальной военной автомобильной техники.\n\nСилами Военно-морского флота России уничтожено 8 военных катеров украинских военно-морских сил.",
    "url": "https://z.mil.ru/spec_mil_oper/brief/briefings/more.htm?id=12410862@egNews",
    "destroyed": {
      "САМОЛЕТЫ": 7,
      "ВЕРТОЛЕТЫ": 7,
      "БЕСПИЛОТНИКИ": 9,
      "ЗЕНИТКИ": 24,
      "ТАНКИ И БМ": 87,
      "РСЗО": 28,
      "АВТОМОБИЛЬНАЯ ТЕХНИКА": 118,
      "КАТЕРА": 8,
      "ИНФРАСТРУКТУРА": 821,
      "АЭРОДРОМЫ": 14,
      "КОМАНДНЫЕ ПУНКТЫ": 19,
      "РАДИОЛОКАТОРЫ": 48
    }
  },
  "27.02.2022": {
    "date": "27.02.2022",
    "message": "В течение прошедших суток группировка войск Луганской народной республики при огневой поддержке российских Вооруженных Сил провела успешные наступательные действия и установила контроль над населенными пунктами НОВОАХТЫРКА, СМОЛЯНИНОВО, СТАНИЧНО-ЛУГАНСКОЕ. Глубина продвижения вглубь обороны с начала наступательной операции составила 52 километра.\n\nГруппировка войск Донецкой Народной Республики, продолжила наступление в направлении ПЕТРОВСКОЕ, продвинувшись вперед еще на 12 километров. Взяты под контроль ПАВЛОПОЛЬ и ПИЩЕВИК.\n\nЗа прошедшие сутки Вооруженными Силами Российской Федерации были полностью блокированы города ХЕРСОН и БЕРДЯНСК. Также взяты под контроль город ГЕНИЧЕВСК и аэродром ЧЕРНОБАЕВКА под ХЕРСОНОМ.\n\nВ ходе проведения специальной военной операции продолжается процесс массового отказа украинских военнослужащих от продолжения боевых действий.\n\nВчера в Харьковской области 302-й зенитный ракетный полк ВСУ, оснащенный комплексами ПВО «Бук М-1», добровольно сложил оружие и сдался. Задержан 471 украинский военнослужащий. Всем украинским военнослужащим оказывается уважительное отношение и помощь. После оформления документов они будут отправлены к своим семьям.\n\n26 февраля с 16.00 до 16.20 украинские националисты из батальона «Азов» нанесли удары реактивными системами залпового огня «Град» по жилым кварталам населенного пункта САРТАНА в пригороде МАРИУПОЛЯ и по школе №8 города МАРИУПОЛЬ. В результате есть разрушения жилых домов и имеются погибшие среди мирного населения. Минобороны России предупреждало о подготовке украинскими националистами подобных провокаций.\n\nВооруженные Силы Российской Федерации ударов по городам и населенным пунктам не наносят, принимают все меры для сохранения жизни мирных граждан.\n\n26 февраля Вооруженные Силы Российской Федерации нанесли еще один удар высокоточным оружием большой дальности с использованием крылатых ракет воздушного и морского базирования по объектам военной инфраструктуры Украины.\n\nК настоящему времени Российскими Вооруженными Силами поражены 975 объектов военной инфраструктуры Украины.\n\nСреди них: 23 пункта управления и узлы связи ВСУ, 3 радиолокационных поста, 31 зенитный ракетный комплекс ПВО С-300, «Бук М-1» и «Оса», 48 радиолокационных станций.\n\nСбиты: 8 боевых самолетов и 7 вертолетов, 11 беспилотных летательных аппаратов, две тактические ракеты «Точка-У».\n\nУничтожено 223 танка и другие боевые бронированные машины, 28 самолетов (на земле), 39 реактивных систем залпового огня, 86 орудий полевой артиллерии и минометов, 143 единицы специальной военной автомобильной техники.",
    "url": "https://z.mil.ru/spec_mil_oper/brief/briefings/more.htm?id=12410963@egNews",
    "destroyed": {
      "САМОЛЕТЫ": 8,
      "ВЕРТОЛЕТЫ": 7,
      "БЕСПИЛОТНИКИ": 11,
      "ЗЕНИТКИ": 31,
      "ТАНКИ И БМ": 223,
      "РСЗО": 39,
      "АРТИЛЛЕРИЯ И МИНОМЕТЫ": 86,
      "АВТОМОБИЛЬНАЯ ТЕХНИКА": 143,
      "ИНФРАСТРУКТУРА": 975,
      "КОМАНДНЫЕ ПУНКТЫ": 23,
      "РАДИОЛОКАТОРЫ": 3
    }
  },
  "28.02.2022": {
    "date": "28.02.2022",
    "message": "Группировка войск Луганской Народной Республики в течение дня продолжила ведение наступательных действий в направлении населенного пункта Кременное, продвинувшись вперед еще на 3 километра.\n\nПодразделения вооруженных сил Донецкой Народной Республики продвинулись за сутки на 16 километров и овладели населенным пунктом Заможное.\n\nС начала проведения специальной операции российскими Вооруженными Силами поражены 1146 объектов военной инфраструктуры Украины.\n\nСреди них: 31 пункт управления и узел связи ВСУ, 81 зенитный ракетный комплекс ПВО С-300, «Бук М-1» и «Оса», а также 75 радиолокационных станций.\n\nОперативно тактической авиацией ВКС России поражено 6 колонн бронетехники украинских вооруженных сил.\n\nУничтожено 311 танков и других боевых бронированных машин, 42 самолета и вертолета (в том числе на земле), 51 реактивная система залпового огня, 147 орудий полевой артиллерии и минометов, 263 единицы специальной военной автомобильной техники.\n\nЗа последние сутки добровольно сложили оружие ещё 110 украинских военнослужащих.",
    "url": "https://z.mil.ru/spec_mil_oper/brief/briefings/more.htm?id=12411110@egNews",
    "destroyed": {
      "ТАНКИ И БМ": 311,
      "РСЗО": 51,
      "АРТИЛЛЕРИЯ И МИНОМЕТЫ": 147,
      "АВТОМОБИЛЬНАЯ ТЕХНИКА": 263,
      "ИНФРАСТРУКТУРА": 1146,
      "КОМАНДНЫЕ ПУНКТЫ": 31,
      "САМОЛЕТЫ": 42,
      "ЗЕНИТКИ": 81,
      "РАДИОЛОКАТОРЫ": 75
    }
  },
  "01.03.2022": {
    "date": "01.03.2022",
    "message": "Группировка войск Луганской Народной Республики при огневой поддержке Вооруженных Сил Российской Федерации продвинулась с начала проведения операции на глубину до 61 километра и блокировала населенный пункт СВАТОВО. Под контроль взяты населенные пункты НОВОБОРОВОЕ, БАРЫКИНО, КЛИМОВКА, БУЛГАКОВКА, ГОЛУБОВКА.\n\nВойска Донецкой Народной Республики вели успешные наступательные действия, взяв под контроль населенные пункты ИВАНОВКА, ТАЛАКОВКА, СТАРОДУБОВКА, БЕРЕСТОВОЕ, БЕЛОЦЕРКОВКА. Глубина продвижения группировки за прошедшие сутки составила 19 километров.\n\nПередовые отряды Народной милиции ДНР вышли на административную границу Донецкой области и соединились с воинскими частями Вооруженных Сил Российской Федерации, которые брали под контроль районы Украины вдоль побережья Азовского моря.\n\nС сегодняшнего дня выход подразделений ВСУ к Азовскому морю полностью заблокирован.\n\n1 марта Вооруженными Силами Российской Федерации нанесен удар высокоточным оружием большой дальности воздушного и морского базирования. Поражены два аэродрома и три радиолокационных поста ПВО. Удары исключали поражение гражданской инфраструктуры и жилых домов.\n\nВсего Вооруженными Силами Российской Федерации поражены 1325 объектов военной инфраструктуры Украины.\n\nИз них: 43 пункта управления и узла связи украинских вооруженных сил.\n\nУничтожено 395 танков и других боевых бронированных машин, 59 реактивных систем залпового огня, 179 орудий полевой артиллерии и минометов, 286 единиц специальной военной автомобильной техники.",
    "url": "https://z.mil.ru/spec_mil_oper/brief/briefings/more.htm?id=12411194@egNews",
    "destroyed": {
      "ТАНКИ И БМ": 395,
      "РСЗО": 59,
      "АРТИЛЛЕРИЯ И МИНОМЕТЫ": 179,
      "АВТОМОБИЛЬНАЯ ТЕХНИКА": 286,
      "ИНФРАСТРУКТУРА": 1325,
      "КОМАНДНЫЕ ПУНКТЫ": 43
    }
  },
  "02.03.2022": {
    "date": "02.03.2022",
    "message": "Группировка войск Луганской Народной Республики при огневой поддержке российских Вооруженных Сил продолжает успешные наступательные действия. Установлен контроль над населенными пунктами Красный лиман, Торское, Кременная, Варваровка, Боровеньки.\n\nГруппировка войск Донецкой Народной Республики сомкнула кольцо блокирования вокруг города Мариуполь и взяла под контроль населенные пункты Приморское, Приазовское, Шевченко и Бердянское.\n\nВооруженными Силами Российской Федерации взяты под контроль населенные пункты Попово, Новгоровка, Новомихайловка, Любимовка.\n\nВооруженные Силы Российской Федерации принимают меры по обеспечению безопасности мирного населения Украины.\n\nНационалистические батальоны, разместившие бронетехнику и артиллерию, включая реактивные системы залпового огня, в жилых кварталах, готовят провокации, прикрываясь мирными жителями.\n\nВ городе Мариуполь боевики нацбатальона «Азов» в ночное время заминировали производственные цеха завода «Азовсталь». Жители города продолжает работать на предприятии, не зная, что националисты готовят подрыв завода с людьми в случае прорыва обороны города.\n\nНационалистами минируются и другие объекты социальной инфраструктуры Мариуполя.\n\nОбращаю внимание, что все мирные жители, желающие покинуть Мариуполь, в целях безопасности могут выходить в восточном направлении по дороге Мариуполь – Широкино.\n\nВсе это касается и жителей Киева, которые могут покинуть город в направлении Василькова. Никаких препятствий для выхода мирного населения российские военнослужащие не оказывают.\n\nТакой же коридор безопасности создан на юго-западе Харькова в направлении на Люботин.\n\nПо имеющимся у нас данным, в Харькове украинские власти насильно удерживают большую группу индийских студентов, которые желают покинуть украинскую территорию и выехать в Белгород.\n\nПо сути дела, их удерживают в качестве заложников и предлагают покинуть территорию Украины через украинско-польскую границу. Предлагают ехать через территорию, где ведутся активные боевые действия.\n\nВооруженные силы готовы принять все необходимые меры в целях безопасной эвакуации граждан Индии. И отправить их домой с территории России своими военно-транспортными самолетами или самолетами Индии, как это предложила сделать индийская сторона.\n\nВчера в районе населенного пункта Бародянка, западнее Киева, подразделениями Вооруженных Сил Российской Федерации уничтожены 3 так называемых «джихад-мобиля», начиненных взрывчаткой большой мощности. Два вблизи населенного пункта Бародянка и один в районе населенного пункта Макаров на Житомирском шоссе.\n\nТеррористы направляли автомобили на боевые порядки российских подразделений. Один из боевиков выпрыгнул из машины. Огнем российского противотанкового ракетного комплекса (ПТРК) и крупнокалиберного пулемета «джихад-мобили» и боевики были уничтожены.\n\nВооруженные Силы Российской Федерации продолжают наносить удары по объектам военной инфраструктуры Украины.\n\nВсего за время операции поражено 1533 объекта, среди них: 54 пункта управления и узла связи ВСУ, 39 зенитных ракетных комплексов ПВО С-300, «Бук М-1» и «Оса», 52 радиолокационная станция.\n\nКроме того, уничтожено 47 самолетов на земле и 13 самолетов в воздухе, 484 танка и других боевых бронированных машин, 63 реактивных системы залпового огня, 217 орудий полевой артиллерии и минометов, 336 единиц специальной военной автомобильной техники, 47 беспилотных летательных аппаратов.\n\nСреди националистов и военнослужащих силовых структур Украины потери составляют: более 2870 убитыми и около 3700 ранеными. Только по подтвержденным данным количество пленных военнослужащих силовых ведомств Украины составляет 572 человека.\n\nК сожалению, среди наших товарищей, участвующих в специальной военной операции, имеются потери.\n\n498 российских военнослужащих погибли при исполнении воинского долга. Семьям погибших оказывается вся возможная помощь.\n\n1597 наших товарищей получили ранения.\n\nХочу еще раз подчеркнуть, ни военнослужащие срочной службы, ни курсанты учебных заведений Минобороны России в специальной операции не участвуют.\n\nРаспространяемая многими западными и отдельными российским СМИ информация о якобы «неисчислимых» потерях российской группировки, - это целенаправленная дезинформация.\n\nРоссийские солдаты и офицеры проявляют мужество, отвагу и героизм в ходе специальной военной операции.\n\nЭкипаж одного из российских танков под командованием старшего сержанта Нимченко, находясь на передовом рубеже, в течение 40 минут метким огнем уничтожил 9 единиц бронетехники (6 танков и 3 БТР-80), а также более 90 националистов.\n\nДругой танковый экипаж под командованием командира танковой роты старшего лейтенанта Старостина, отражая атаку со значительно превосходящими силами противника, уничтожил 8 единиц бронетехники (БТР-80) и более 100 националистов, не допустив их прорыва к переправе.\n\nВ ходе боя российский танк был атакован американским ПТУР «Джавелин». Экипаж получил контузию, однако из боя не вышел. Убедившись в исправности техники, метким огнем были уничтожены еще 2 танка противника.\n\nМы и дальше будем регулярно доводить информацию о подвигах и героизме российских военнослужащих.\n\nРоссийские военнослужащие, российская армия с честью выполняет задачу. Она устраняет реальную угрозу России, исходившую до недавнего времени с территории Украины. С территории, на которой вопреки воле украинского народа в ближайшее время должны были появиться натовские базы, ядерное оружие, средства его доставки.\n\nРодина будет защищена.",
    "url": "https://z.mil.ru/spec_mil_oper/brief/briefings/more.htm?id=12411360@egNews",
    "destroyed": {
      "САМОЛЕТЫ": 60,
      "БЕСПИЛОТНИКИ": 47,
      "ЗЕНИТКИ": 39,
      "ТАНКИ И БМ": 484,
      "РСЗО": 63,
      "АРТИЛЛЕРИЯ И МИНОМЕТЫ": 217,
      "АВТОМОБИЛЬНАЯ ТЕХНИКА": 336,
      "ИНФРАСТРУКТУРА": 1502,
      "КОМАНДНЫЕ ПУНКТЫ": 54,
      "РАДИОЛОКАТОРЫ": 52
    }
  },
  "03.03.2022": {
    "date": "03.03.2022",
    "message": "Группировка войск Луганской Народной Республики при огневой поддержке российских Вооруженных Сил продолжила наступательные действия и вышла на рубеж Красный Лиман – Приволье – северная окраина Северодонецка. Продвижение составило четыре километра.\n\nПодразделения вооруженных сил Донецкой Народной Республики сузили кольцо окружения города Мариуполь, а также взяли под контроль населенные пункты Виноградное, Сартака и Водяное.\n\nВооруженные Силы Российской Федерации, продолжая успешные наступательные действия, взяли под контроль Чистополье, Новополтавку, Жовтневое и выровняли передний край с подразделениями Донецкой Народной Республики.\n\nОсвобожден от националистических батальонов город Балаклея.\n\nРоссийской армией принимаются меры по обеспечению безопасности мирного населения Украины.\n\nВ Бородянке, где подразделения украинских националистов размещены вместе с техникой в жилых кварталах, мирные жители могут безопасно покинуть населенный пункт через специально выделенный коридор в направлении Берестянки. Никаких препятствий для выхода мирных жителей в данном направлении российские военнослужащие не оказывают.\n\nВооруженные Силы Российской Федерации продолжают наносить удары по объектам военной инфраструктуры Украины.\n\nВ результате нанесения удара высокоточным оружием большой дальности выведен из строя резервный технологический радиотелевизионный центр в районе Лысая Гора в Киеве, использовавшийся СБУ для психологических операций против России. Жертв и разрушений жилых домов нет.\n\nВсего за время операции поражено 1612 объектов. Среди них: 62 пункта управления и узла связи вооруженных сил Украины, 39 зенитных ракетных комплексов ПВО С-300, «Бук М-1» и «Оса», 52 радиолокационных станций.\n\nТакже уничтожено 49 самолетов на земле и 13 самолетов в воздухе, 606 танков и других боевых бронированных машин, 67 реактивных систем залпового огня, 227 орудий полевой артиллерии и минометов, 405 единиц специальной военной автомобильной техники, а также 53 беспилотных летательных аппарата.",
    "url": "https://z.mil.ru/spec_mil_oper/brief/briefings/more.htm?id=12411412@egNews",
    "destroyed": {
      "САМОЛЕТЫ": 62,
      "БЕСПИЛОТНИКИ": 53,
      "ЗЕНИТКИ": 39,
      "ТАНКИ И БМ": 606,
      "РСЗО": 67,
      "АРТИЛЛЕРИЯ И МИНОМЕТЫ": 227,
      "АВТОМОБИЛЬНАЯ ТЕХНИКА": 405,
      "КОМАНДНЫЕ ПУНКТЫ": 62,
      "РАДИОЛОКАТОРЫ": 52
    }
  },
  "04.03.2022": {
    "date": "04.03.2022",
    "message": "Группировка войск Луганской Народной Республики при огневой поддержке российских Вооруженных Сил продолжила наступательные действия и вышла на рубеж Красный Лиман, Ямполь, Приволье. Продолжается наступление в направлении на Краматорск.\n\nПодразделения вооруженных сил Донецкой Народной Республики провели успешные наступательные действия и за ночь продвинулись до 8 километров. Взяты под контроль населенные пункты Назаровка, Куйбышево, Калинино, Новогригоровка.\n\nГруппировка войск ДНР продолжила сжимать кольцо окружения вокруг города Мариуполь и взяла под контроль завод имени Ленина.\n\nВооруженные Силы Российской Федерации, продолжили наступление, действуя смежными флангами с подразделениями ДНР, взяли под контроль Верхняя Криница, Комсомольское, Чистополье, Новополтавка, Камыш Заря, Тружнево.\n\n28 февраля Вооруженными Силами России был взят под контроль город Энергодар, Запорожская АЭС и прилегающая к ней территория. Охранявшие электростанцию военнослужащие украинской нацгвардии еще до прихода российских подразделений покинули объект и скрылись в неизвестном направлении.\n\nОбъекты станции и прилегающая территория были взяты под охрану российскими военнослужащими.\n\nВ течение пяти прошедших дней персонал Запорожской АЭС продолжал плановую работу по обслуживанию объектов и контролю радиоактивной обстановки в обычном режиме.\n\nОднако прошедшей ночью на прилегающей к электростанции территории киевским националистическим режимом была предпринята попытка реализации чудовищной провокации.\n\n4 марта около 2 часов ночи в ходе патрулирования охраняемой территории, прилегающей к Запорожской атомной электростанции, мобильный патруль Росгвардии подвергся нападению со стороны украинской диверсионной группы.\n\nДля провоцирования ответного огня по зданию, из окон нескольких этажей учебного-тренировочного комплекса, расположенного за пределами электростанции, по военнослужащим Росгвардии был открыт шквальный огонь из стрелкового оружия.\n\nОтветным огнем российского патруля из стрелкового оружия огневые точки украинских диверсантов в здании учебно-тренировочного комплекса были подавлены. Покидая здание, украинская диверсионная группа совершила поджог учебно-тренировочного корпуса.\n\nПрибывшими к корпусу пожарными расчетами возгорание помещений было ликвидировано. В момент провокации никого из штатных сотрудников электростанции в учебно-тренировочном корпусе не было.\n\nВ настоящее время персонал Запорожской АЭС продолжает работать в штатном режиме, обслуживает объекты АЭС и отслеживает радиоактивную обстановку. Радиоактивный фон в районе электростанции в норме.\n\nОперативно последовавшие заявления Зеленского о якобы угрозе атомной электростанции и его переговоры с Вашингтоном и Лондоном не оставляют никаких сомнений. Целью провокации киевского режима на атомном объекте является попытка обвинить Россию в создании очага радиоактивного заражения.\n\nВсе это свидетельствует о преступном замысле киевского режима или о полной утрате Зеленским контроля за действиями украинских диверсионных групп с участием иностранных наемников.\n\nВооруженные Силы Российской Федерации продолжают наносить удары по объектам военной инфраструктуры Украины.\n\nВсего за время операции поражено 1812 объектов, среди них: 65 пунктов управления и узлов связи ВСУ, 56 зенитных ракетных комплексов ПВО С-300, «Бук М-1» и «Оса», 59 радиолокационных станций.\n\nТакже уничтожено 49 самолетов на земле и 13 самолетов в воздухе, 635 танков и других боевых бронированных машин, 67 реактивных систем залпового огня, 252 орудия полевой артиллерии и миномета, 442 единицы специальной военной автомобильной техники, а также 54 беспилотных летательных аппарата.",
    "url": "https://z.mil.ru/spec_mil_oper/brief/briefings/more.htm?id=12411526@egNews",
    "destroyed": {
      "САМОЛЕТЫ": 62,
      "БЕСПИЛОТНИКИ": 54,
      "ЗЕНИТКИ": 56,
      "ТАНКИ И БМ": 635,
      "РСЗО": 67,
      "АРТИЛЛЕРИЯ И МИНОМЕТЫ": 252,
      "АВТОМОБИЛЬНАЯ ТЕХНИКА": 442,
      "КОМАНДНЫЕ ПУНКТЫ": 65,
      "РАДИОЛОКАТОРЫ": 59
    }
  },
  "05.03.2022": {
    "date": "05.03.2022",
    "message": "Группировка войск Луганской Народной Республики продолжила наступательные действия и овладела пунктами Голиково, Невское и Катериновка.\n\nПодразделения вооруженных сил Донецкой Народной Республики взяли под контроль населенные пункты Зачатовка, Хлебодаровка, Новотатаровка, Затишье и Мирное. Продвижение составило 7 километров.\n\nСегодня с 10.00 московского времени, по просьбе украинской стороны, в районе городов Мариуполь и Волноваха вводился «режим тишины» с полной остановкой боевых действий для обеспечения эвакуации мирного населения.\n\nПо объявленным коридорам безопасности из Мариуполя и Волновахи не смог выйти ни один мирный житель. Население этих городов удерживается националистическими формированиями в качестве «живого щита».\n\nНационалистические батальоны воспользовались «режимом тишины» для перегруппировки и укрепления занимаемых позиций.\n\nВ связи с нежеланием украинской стороны воздействовать на националистов или продлевать «режим тишины» наступательные действия с 18 часов московского времени возобновлены.\n\nПодразделения российских Вооруженных Сил наступают широким фронтом и взяли под контроль населенные пункты Малая Токмачка, Марфополь, Ремовка, Новокарловка, Орлинское, Володино и Малиновка.\n\nСегодня продолжено нанесение ударов по объектам военной инфраструктуры Украины.\n\nТолько за 5 марта уничтожены: 5 радиолокационных станций, 2 зенитных ракетных комплекса ПВО «Бук М-1», в воздушном бою в районе Житомира сбито 4 самолета Су-27 ВСУ и средствами ПВО в районе Нежина сбит 1 Су-25.\n\nТакже войсками ПВО уничтожен вертолет Ми-8 ВВС Украины и беспилотный летательный аппарат «Байрактар ТБ-2».\n\nВсего за время операции поражено 2119 объектов военной инфраструктуры Украины. Среди них:\n\n74 пункта управления и узла связи украинских вооруженных сил;\n\n108 зенитных ракетных комплексов ПВО С-300, «Бук М-1» и «Оса», а также 68 радиолокационных станций.\n\nУничтожены: 69 самолетов на земле и 21 самолет в воздухе, 748 танков и других боевых бронированных машин, 76 реактивных систем залпового огня, 274 орудия полевой артиллерии и минометов, 532 единицы специальной военной автомобильной техники, а также 59 беспилотных летательных аппарата.",
    "url": "https://z.mil.ru/spec_mil_oper/brief/briefings/more.htm?id=12411720@egNews",
    "destroyed": {
      "САМОЛЕТЫ": 90,
      "БЕСПИЛОТНИКИ": 59,
      "ЗЕНИТКИ": 108,
      "ТАНКИ И БМ": 748,
      "РСЗО": 76,
      "АРТИЛЛЕРИЯ И МИНОМЕТЫ": 274,
      "АВТОМОБИЛЬНАЯ ТЕХНИКА": 532,
      "ИНФРАСТРУКТУРА": 2119,
      "КОМАНДНЫЕ ПУНКТЫ": 74,
      "РАДИОЛОКАТОРЫ": 68
    }
  },
  "06.03.2022": {
    "date": "06.03.2022",
    "message": "Группировка войск Луганской Народной Республики, продолжая наступательные действия, взяла под контроль населенные пункты Рубцы, Карповка, Макеевка, Новолобовка, Липовое, Среднее, Зеленая Долина, Закаблуховка.\n\nПодразделения вооруженных сил Донецкой Народной Республики установили контроль над населенными пунктами Передовое, Карьерное и Ровнополь.\n\nПодразделения народной милиции Донецкой Республики ведут успешные наступательные действия на западной и северо-западной окраинах города Мариуполя. Взят под контроль жилой квартал Старый Крым.\n\nПодразделения российских Вооруженных Сил в ходе наступательных действий взяли под контроль населенные пункты Приютное, Завитне-Бажання, Старомлыновка, Октябрьское и Новомайское. Продвижение вперед составило 11 км.\n\nВооруженные Силы Российской Федерации продолжают наносить удары по объектам военной инфраструктуры Украины.\n\nВечером 5 марта нанесен массированный удар, в результате которого поражен 61 объект военной инфраструктуры ВСУ, в том числе: 22 единицы вооружения и военной техники в подземном укрытии, пункт управления бригады, девять складов боеприпасов и материально-технических средств и три радиолокационных поста.\n\nУтром 6 марта нанесен удар высокоточным оружием большой дальности. Выведен из строя аэродром военно-воздушных сил Украины в Староконстантинове.\n\nЗа прошедшие сутки истребительной авиацией и ПВО ВКС России сбито четыре самолета Су-27 и один МиГ-29 в районе Житомира, Су-27 и Су-25 в районе Радомышля, один Су-25 в районе Нежина, два вертолета Ми-8 в районе Киева, шесть беспилотных летательных аппаратов, в том числе «Байрактар ТБ-2».\n\nБомбардировочной и штурмовой авиацией поражены три зенитных ракетных комплекса «Бук М1» и три радиолокационных станции ВСУ.\n\nРакетными войсками уничтожен зенитный ракетный комплекс ПВО С-300.\n\nВсего за время операции поражено 2203 объекта военной инфраструктуры Украины. Среди них: 76 пунктов управления и узлов связи украинских вооруженных сил, 111 зенитных ракетных комплексов ПВО С-300, «Бук М-1» и «Оса», а также 71 радиолокационная станция.\n\nУничтожены: 69 самолетов на земле и 24 самолета в воздухе, 778 танков и других боевых бронированных машин, 77 реактивных систем залпового огня, 279 орудий полевой артиллерии и минометов, 553 единицы специальной военной автомобильной техники, а также 62 беспилотных летательных аппарата.",
    "url": "https://z.mil.ru/spec_mil_oper/brief/briefings/more.htm?id=12411766@egNews",
    "destroyed": {
      "САМОЛЕТЫ": 93,
      "БЕСПИЛОТНИКИ": 62,
      "ЗЕНИТКИ": 111,
      "ТАНКИ И БМ": 778,
      "РСЗО": 77,
      "АРТИЛЛЕРИЯ И МИНОМЕТЫ": 279,
      "АВТОМОБИЛЬНАЯ ТЕХНИКА": 553,
      "ИНФРАСТРУКТУРА": 2203,
      "КОМАНДНЫЕ ПУНКТЫ": 76,
      "РАДИОЛОКАТОРЫ": 71
    }
  },
  "07.03.2022": {
    "date": "07.03.2022",
    "message": "Группировка войск Луганской Народной Республики, продолжая наступательные действия, взяла под контроль населенные пункты Смоляниново, Воеводовка, Кременная, Кудряшовка, Боровеньки, Пурдовка, Замуловка. Продвижение составило шесть километров.\n\nПодразделения вооруженных сил Донецкой Народной Республики установили контроль над населенными пунктами Азов, Новотатаровка, Мирное. Подразделения Народной милиции Донецкой Республики вели наступательные действия в Мариуполе. Основные боестолкновения велись на западе города – в Новоселовке, поселке Моряков, Осавиахиме и на востоке – в Найденовке и Азов-Кольцо.\n\nВчера, около 17 часов московского времени, на проспекте Победы Мариуполя военнослужащие ДНР столкнулись с подразделением украинских вооруженных националистов. Боевики гнали впереди себя более 150 человек мирных жителей, прикрываясь ими в качестве «живого щита».\n\nОбнаружив бойцов Народной милиции, украинские националисты открыли по ним огонь из-за спин мирных граждан. В результате стрельбы украинскими нацистами было убито четыре и ранено пять мирных граждан.\n\nБойцами Народной милиции ДНР освобожденные мирные жители были выведены через район Виноградное из Мариуполя на подконтрольную территорию. Всем им оказана необходимая помощь.\n\nПодразделения российских Вооруженных Сил взяли под контроль населенные пункты Урожайное, Новодонецкое, Новомайорское, Дорожнянка, Загорное и Чаривное.\n\nВчера вечером истребительной авиацией ВКС России и войсковой ПВО были сбиты еще три Су-27 военно-воздушных сил Украины в районе Полтавы, один Су-25 в районе Гостомеля, два вертолета Ми-24 в районе Макарова и восемь беспилотных летательных аппаратов, в том числе «Байрактар ТБ-2».\n\nБомбардировочной и штурмовой авиацией поражены три зенитных ракетных комплекса «Бук М1» и две радиолокационных станции ВСУ. Всего за время операции уничтожено 2396 объектов военной инфраструктуры Украины. Среди них: 82 пункта управления и узла связи украинских вооруженных сил, 119 зенитных ракетных комплексов ПВО С-300, «Бук М-1» и «Оса», а также 76 радиолокационных станции.\n\nУничтожены: 827 танков и других боевых бронированных машин, 84 реактивные системы залпового огня, 304 орудия полевой артиллерии и миномета, 603 единицы специальной военной автомобильной техники, а также 78 беспилотных летательных аппаратов.\n\nСегодня с 10 утра московского времени объявлен «режим тишины» и открываются шесть гуманитарных коридоров: один из Киева в Гомель; два из Мариуполя – в Запорожье и в Ростов-на-Дону; один из Харькова в Белгород; два из Сум в Белгород и в Полтаву.\n\nДетальная информация о гуманитарных коридорах заблаговременно доведена до украинской стороны, а также до профильных структур ООН, ОБСЕ и Международного Комитета Красного Креста.\n\nНа период открытия гуманитарных коридоров Вооруженные Силы Российской Федерации будут осуществлять непрерывный объективный контроль проведения эвакуации с применением беспилотных летательных аппаратов.",
    "url": "https://z.mil.ru/spec_mil_oper/brief/briefings/more.htm?id=12412001@egNews",
    "destroyed": {
      "БЕСПИЛОТНИКИ": 78,
      "ЗЕНИТКИ": 119,
      "ТАНКИ И БМ": 827,
      "РСЗО": 84,
      "АРТИЛЛЕРИЯ И МИНОМЕТЫ": 304,
      "АВТОМОБИЛЬНАЯ ТЕХНИКА": 603,
      "ИНФРАСТРУКТУРА": 2396,
      "КОМАНДНЫЕ ПУНКТЫ": 82,
      "РАДИОЛОКАТОРЫ": 76
    }
  },
  "08.03.2022": {
    "date": "08.03.2022",
    "message": "Группировка войск Луганской Народной Республики, продолжая наступательные действия, взяла под контроль населенные пункты Борсонино, Кременная, Песчанное, Варваровка, Пшеничное, Епифановка, Новодружеск, Белогоровка. Продвижение составило девять километров.\n\nПодразделения Народной милиции Донецкой Народной Республики установили контроль над кварталом Осавиахим в Мариуполе.\n\nВ течение прошедших суток бомбардировочной и штурмовой авиацией ВКС России уничтожены 158 военных объектов на территории Украины.\n\n7 марта высокоточным оружием большой дальности выведен из строя аэродром военно-воздушных сил Украины Озерное в районе Житомира.\n\nИстребительной авиацией ВКС России в воздухе сбито два МиГ-29 и один Су-27 военно-воздушных сил Украины.\n\nТакже выведены из строя: два украинских дивизиона зенитного ракетного комплекса ПВО С-300, три самоходных огневых установки «Бук М-1», четыре пункта управления, две радиолокационных станции, девять складов боеприпасов и 11 районов сосредоточения вооружения и военной техники.\n\nВсего за время операции уничтожено 2482 объекта военной инфраструктуры Украины. Среди них: 87 пунктов управления и узлов связи украинских вооруженных сил, 124 зенитных ракетных комплекса ПВО С-300, «Бук М-1» и «Оса», а также 79 радиолокационных станций.\n\nУничтожены: 866 танков и других боевых бронированных машин, 91 реактивная система залпового огня, 317 орудий полевой артиллерии и минометов, 634 единицы специальной военной автомобильной техники, а также 81 беспилотный летательный аппарат.\n\nВ целях безопасной эвакуации мирных граждан из населенных пунктов сегодня с 10 часов московского времени вводится «режим тишины» и открываются гуманитарные коридоры из Киева, Чернигова, Сум, Харькова и Мариуполя.",
    "url": "https://z.mil.ru/spec_mil_oper/brief/briefings/more.htm?id=12412103@egNews",
    "destroyed": {
      "БЕСПИЛОТНИКИ": 81,
      "ЗЕНИТКИ": 124,
      "ТАНКИ И БМ": 866,
      "РСЗО": 91,
      "АРТИЛЛЕРИЯ И МИНОМЕТЫ": 317,
      "АВТОМОБИЛЬНАЯ ТЕХНИКА": 634,
      "ИНФРАСТРУКТУРА": 2482,
      "КОМАНДНЫЕ ПУНКТЫ": 87,
      "РАДИОЛОКАТОРЫ": 79
    }
  },
  "09.03.2022": {
    "date": "09.03.2022",
    "message": "В течение дня группировка войск Луганской Народной Республики взяла под контроль населенные пункты Затишное, Песчанка, и Суровцевка.\n\nПродолжается нанесение ударов по объектам военной инфраструктуры Украины.\n\nС начала проведения операции уничтожено 2814 объектов украинской военной инфраструктуры.\n\nСреди них: 139 зенитных ракетных комплексов ПВО С-300,\n\n«Бук М-1» и С-125, 84 радиолокационных поста украинских ПВО, 974 танка и других боевых бронированных машин, 104 реактивных систем залпового огня, 359 орудий полевой артиллерии и минометов, 727 единиц специальной военной автомобильной техники, а также 97 беспилотных летательных аппаратов.\n\nНочью 9 марта в населенный пункт Золочев северо-западнее Харькова украинскими националистами завезено около 80 тонн аммиака. По словам покинувших Золочев жителей, националисты учат их как правильно действовать при химической атаке.\n\nВсе это свидетельствует о подготовке украинскими националистами провокации с использованием отравляющих веществ для обвинения России в якобы применении химического оружия.",
    "url": "https://z.mil.ru/spec_mil_oper/brief/briefings/more.htm?id=12412334@egNews",
    "destroyed": {
      "САМОЛЕТЫ": 89,
      "ВЕРТОЛЕТЫ": 57,
      "БЕСПИЛОТНИКИ": 97,
      "ЗЕНИТКИ": 139,
      "ТАНКИ И БМ": 974,
      "РСЗО": 104,
      "АРТИЛЛЕРИЯ И МИНОМЕТЫ": 359,
      "АВТОМОБИЛЬНАЯ ТЕХНИКА": 727,
      "ИНФРАСТРУКТУРА": 2814,
      "АЭРОДРОМЫ": 90,
      "РАДИОЛОКАТОРЫ": 84
    }
  },
  "10.03.2022": {
    "date": "10.03.2022",
    "message": "Группировкой войск Донецкой Народной Республики взяты под контроль населенные пункты Марьяновка, Лазаревка, Лесное.\n\nВооруженные Силы Российской Федерации продвинулись на глубину 10 километров и взяли под контроль населенные пункты Степное, Крапивницкое, Малый Кременьчик, Новопетриковка и Ялынское.\n\nВ результате нанесения ударов по объектам военной инфраструктуры Украины уничтожено 2998 военных объектов.\n\nЗа сутки оперативно-тактической авиацией поражено 68 объектов, в том числе: 2 объекта системы управления украинских вооруженных сил, 12 объектов материально-технического обеспечения, 3 зенитных ракетных комплекса «Оса».\n\nРоссийскими средствами ПВО в воздухе уничтожен один МиГ-29, три беспилотных летательных аппарата «Байрактар ТБ-2» и одна тактическая ракета «Точка-У».\n\nВсего с начала операции потери силовых структур Украины составили: 98 самолетов, 110 беспилотных летательных аппаратов, 144 зенитных ракетных комплекса ПВО, 88 радиолокационных постов, 1007 танков и других боевых бронированных машин, 109 реактивных систем залпового огня, 374 орудия полевой артиллерии и минометов, 793 единицы специальной военной автомобильной техники.\n\nПодразделения Народной милиции ДНР продвинулись на 1 километр внутри Мариуполя с северного направления.\n\nОстановлюсь отдельно на информационной провокации киевского режима с якобы нанесением вчера российской авиацией «удара» по мариупольской больнице № 3.\n\nПрежде всего, отмечу, - Минобороны России вчера объявило «режим тишины» для безопасной эвакуации мирных жителей города.\n\nАбсолютно никаких задач по поражению целей на земле российская авиация в районе Мариуполя не выполняла.\n\nПроведенный анализ заявлений представителей киевского националистического режима, фотоматериалов из больницы, не оставляет никаких сомнений.\n\nЯкобы имевший место «авиаудар» – полностью режиссированная провокация, для поддержания антироссийского ажиотажа у западной аудитории.\n\nМы неоднократно ранее заявляли, что лечебные учреждения Мариуполя, включая больницу № 3, прекратили свою штатную работу еще в конце февраля. Весь персонал и пациенты разогнаны националистами.\n\nЗдание больницы, из-за выгодного тактического расположения близко к центру города, переоборудовано в опорный пункт нацбатальона «Азов».\n\nОб этом массово сообщают жители города, перебравшиеся как в подконтрольный Киев, так и контролируемые Донецкой народной республикой районы.\n\nФотоснимки территории больницы содержат свидетельства двух отдельных постановочных взрывов рядом с больницей. Заглубленного подземного и еще одного небольшой мощности, направленного в корпус больницы.\n\nХарактер внешних и внутренних повреждений здания может ввести в заблуждение массовую непрофессиональную аудиторию Европы и США. Для которой и делалась эта постановка.\n\nНо не экспертов. Фугасный авиационный боеприпас, даже меньшей мощности, просто ничего бы не оставил от внешних стен здания.\n\nПодчеркну, что все эти и другие военные преступления в Мариуполе совершаются запертыми в городе карателями. Мы неоднократно предупреждали, что по мере сжатия кольца количество провокаций нацистов будет нарастать. Бежать им оттуда уже некуда.\n\nИменно эти нацисты батальона «Азов» восемь лет осознанно и с особой жестокостью уничтожали мирное население в Донецкой и Луганской республиках.\n\nВ течение последних дней участились нападения украинских националистов и прибывших на Украину из США, Великобритании и Европы наемников на российских медиков и медицинские специальные автомобили.\n\nНацисты намеренно атакуют из засад медицинский транспорт с нанесенной символикой, - красным крестом.\n\nСнайперским огнем ведут огонь с больших дистанций по медикам, эвакуирующим раненых российских военнослужащих в районах боевых действий. Даже по медикам, оказывающим помощь местным жителям в населенных пунктах.\n\nВсе это еще раз подтверждает нацистскую сущность киевского режима, публично призывающего в нарушение международного гуманитарного права к убийствам любых русских без исключения.",
    "url": "https://z.mil.ru/spec_mil_oper/brief/briefings/more.htm?id=12412460@egNews",
    "destroyed": {
      "САМОЛЕТЫ": 98,
      "БЕСПИЛОТНИКИ": 110,
      "ЗЕНИТКИ": 144,
      "ТАНКИ И БМ": 1007,
      "РСЗО": 109,
      "АРТИЛЛЕРИЯ И МИНОМЕТЫ": 374,
      "АВТОМОБИЛЬНАЯ ТЕХНИКА": 793,
      "ИНФРАСТРУКТУРА": 2911,
      "РАДИОЛОКАТОРЫ": 88
    }
  },
  "11.03.2022": {
    "date": "11.03.2022",
    "message": "Группировкой войск Донецкой Народной Республики освобожден город ВОЛНОВАХА.\n\nТакже взяты под контроль населенные пункты ОЛЬГИНКА, ВЕЛИКА-АНАДОЛЬ, ЗЕЛЕНЫЙ ГАЙ. Продвижение в глубину составило до 6 километров.\n\nПодразделения народной милиции Донецкой Республики продолжали сжимать кольцо окружения в МАРИУПОЛЕ. Общее продвижение с восточного, северного и западного направлений составило до 800 метров.\n\nПодразделения российских Вооруженных Сил, продолжая наступательные действия, вышли на рубеж ПЕТРОВСКОЕ- ЕВГЕНОВКА-ОКТЯБРЬСКАЯ. Продвижение вперед составило 17 километров.\n\nУтром 11 марта высокоточным оружием большой дальности нанесен удар по объектам военной инфраструктуры Украины.\n\nВыведены из строя военные аэродромы в ЛУЦКЕ и ИВАНО-ФРАНКОВСКЕ.\n\nЗа сутки истребительной авиацией и войсковой ПВО сбито три украинских вертолета Ми-24, восемь беспилотных летательных аппаратов, в том числе пять «Байрактар ТБ-2».\n\nОперативно-тактической и армейской авиацией поражено 107 объектов украинских вооруженных сил.\n\nВ том числе: шесть пунктов управления и узлов связи, 14 складов боеприпасов и ГСМ, 11 мест скопления боевой техники.\n\nВсего за время проведения операции выведено из строя 3213 объектов военной инфраструктуры Украины.\n\nУничтожены: 98 самолетов, 118 беспилотных летательных аппаратов, 1041 танк и других боевых бронированных машин, 113 реактивных систем залпового огня, 389 орудий полевой артиллерии и минометов, 843 единицы специальной военной автомобильной техники.",
    "url": "https://z.mil.ru/spec_mil_oper/brief/briefings/more.htm?id=12412543@egNews",
    "destroyed": {
      "САМОЛЕТЫ": 98,
      "БЕСПИЛОТНИКИ": 118,
      "ТАНКИ И БМ": 1041,
      "РСЗО": 113,
      "АРТИЛЛЕРИЯ И МИНОМЕТЫ": 389,
      "АВТОМОБИЛЬНАЯ ТЕХНИКА": 843,
      "ИНФРАСТРУКТУРА": 3213
    }
  },
  "12.03.2022": {
    "date": "12.03.2022",
    "message": "Вооруженные Силы Российской Федерации, продолжая наступление на широком фронте установили контроль над населенными пунктами НОВОАНДРЕЕВКА, КИРИЛОВКА и вышли на рубеж НОВОМАЙОРСКОЕ – ПАВЛОВКА - НИКОЛЬСКОЕ - ВЛАДИМИРОВКА - БЛАГОДАТНОЕ.\n\nКарта оперативной обстановки\n\nПродвижение за день составило 12 километров.\n\nГруппировка войск Луганской Народной Республики взяла под контроль населенные пункты МОЛОДЕЖНОЕ, ВОЗГОРЬЕ и овладела южной и центральной частью населенного пункта ПОПАСНАЯ.\n\nПередовые отряды Луганской народной милиции вышли на окраины города СЕВЕРОДОНЕЦК.\n\nЗа день авиацией и ПВО ВКС России сбиты в воздухе: один вертолет Ми-24 украинских военно-воздушных сил и три беспилотных летательных аппарата, в том числе один – «Байрактар ТБ-2».\n\nОперативно-тактической, армейской и беспилотной авиацией поражены 79 объектов военной инфраструктуры Украины, в том числе: четыре пункта управления и узла связи, два зенитных ракетных комплекса, три установки РСЗО, одна станция РЭБ, шесть складов боеприпасов и ГСМ и 54 мест скопления боевой техники.\n\nВсего за время операции выведено из строя 3593 объекта военной инфраструктуры Украины.\n\nУничтожены: 61 вертолет, 126 беспилотных летательных аппаратов, 1159 танков и других боевых бронированных машин, 118 реактивных систем залпового огня, 436 орудий полевой артиллерии и минометов и 973 единицы специальной военной автомобильной техники.",
    "url": "https://z.mil.ru/spec_mil_oper/brief/briefings/more.htm?id=12412725@egNews",
    "destroyed": {
      "БЕСПИЛОТНИКИ": 126,
      "ТАНКИ И БМ": 1159,
      "РСЗО": 118,
      "АРТИЛЛЕРИЯ И МИНОМЕТЫ": 436,
      "АВТОМОБИЛЬНАЯ ТЕХНИКА": 973,
      "ИНФРАСТРУКТУРА": 3593,
      "ВЕРТОЛЕТЫ": 61
    }
  },
  "13.03.2022": {
    "date": "13.03.2022",
    "message": "Вооруженные Силы Российской Федерации в ходе наступательных действий установили полный контроль над населенными пунктами Павловка, Никольское, Благодатное, Водяновка и Владимировка.\n\nПродвижение за день составило до 9 километров.\n\nГруппировка войск Луганской Народной Республики, продолжая наступательные действия, освободила от националистов город Попасная.\n\nУтром 13 марта высокоточным оружием большой дальности нанесен удар по учебным центрам вооруженных сил Украины в населенном пункте СТАРИЧИ и на военном полигоне Яворовский.\n\nНа данных объектах Киевским режимом были развернуты: пункт подготовки и боевого слаживания иностранных наемников перед отправкой в районы боевых действий против российских военнослужащих, а также база хранения поступающего от зарубежных стран вооружения и военной техники.\n\nВ результате удара уничтожены до 180 иностранных наемников и крупная партия иностранных вооружений.\n\nУничтожение прибывших на территорию Украины иностранных наемников будет продолжено.\n\nДнем 13 марта авиацией и ПВО ВКС России сбиты в воздухе: один самолет Су-24 украинских военно-воздушных сил в районе населенного пункта НОВЫЙ БЫКОВ, а также 11 беспилотных летательных аппаратов, в том числе два «Байрактар ТБ-2».\n\nОперативно-тактической, армейской и беспилотной авиацией поражены 46 объектов украинских вооруженных сил, в том числе: три пункта управления, один зенитный ракетный комплекс, два склада боеприпасов и 33 района скопления боевой техники.\n\nВсего за время операции выведены из строя 3736 объектов военной инфраструктуры Украины. Уничтожены: 100 самолетов, 139 беспилотных летательных аппаратов, 1234 танка и других боевых бронированных машин, 122 реактивные системы залпового огня, 452 орудия полевой артиллерии и миномета, 1013 единиц специальной военной автомобильной техники.",
    "url": "https://z.mil.ru/spec_mil_oper/brief/briefings/more.htm?id=12412840@egNews",
    "destroyed": {
      "САМОЛЕТЫ": 100,
      "БЕСПИЛОТНИКИ": 139,
      "ТАНКИ И БМ": 1234,
      "РСЗО": 122,
      "АРТИЛЛЕРИЯ И МИНОМЕТЫ": 452,
      "АВТОМОБИЛЬНАЯ ТЕХНИКА": 1013,
      "ИНФРАСТРУКТУРА": 3736
    }
  },
  "14.03.2022": {
    "date": "14.03.2022",
    "message": "Подразделения российских Вооруженных Сил, продолжая наступление, овладели населенным пунктом Степное.\n\nГруппировка войск Луганской Народной Республики ведет наступательные действия в северо-восточных районах города Северодонецк.\n\nУтром 14 марта высокоточным оружием большой дальности нанесен удар по объектам военной инфраструктуры Украины.\n\nВ результате удара выведены из строя узлы связи, ретрансляции и коммутации в населенных пунктах Федоровка, Винаровка, Антополь. Кроме того, на территории завода «Антонов» вблизи Киева уничтожен крупный склад боеприпасов к реактивным системам залпового огня, с площадок которого велся огонь по подразделениям российских войск.\n\nДнем 14 марта средствами противовоздушной обороны Воздушно-космических сил России сбиты два украинских беспилотных летательных аппарата, в том числе один «Байрактар ТБ-2».\n\nОперативно-тактической, армейской и беспилотной авиацией поражены 86 объектов ВСУ, в том числе: четыре пункта управления и узла связи, три зенитных ракетных комплекса, одна радиолокационная станция, одна станция РЭБ, три склада боеприпасов и горюче-смазочных материалов, 68 мест скопления боевой техники.\n\nВсего за время операции уничтожено 145 беспилотных летательных аппаратов, 1298 танков и других боевых бронированных машин, 124 реактивные системы залпового огня, 469 орудий полевой артиллерии и минометов, а также 1047 единиц специальной военной автомобильной техники вооруженных сил Украины.\n\nКиевский режим продолжает применять тактику террора, используя наиболее разрушительные виды оружия против мирного населения и гражданской инфраструктуры.\n\nРанее мы довели информацию о последствиях сегодняшнего удара украинской тактической ракеты «Точка-У» с кассетным боеприпасом по густонаселенному кварталу города Донецк.\n\nВ ответ на эти действия Вооруженные Силы Российской Федерации примут оперативные меры по выводу из строя предприятий оборонно-промышленного комплекса Украины, осуществляющих производство, ремонт и восстановление вооружений, которые националисты используют для совершения военных преступлений.\n\nПризываем граждан Украины, работающих на данных предприятиях, а также жителей близлежащих жилых домов покинуть потенциально опасные зоны.\n\nРяд западных стран на государственном уровне поощряют участие своих граждан в качестве наемников Украины в боевых действиях против подразделений российских войск. Вся дальнейшая ответственность за гибель этой категории иностранных граждан на Украине лежит только на руководстве этих стран.\n\nВсе места нахождения иностранных наемников на Украине нам известны. По ним и впредь будут наноситься точечные удары, подобные уничтожению 13 марта учебных центров в населенном пункте Старичи и на военном полигоне Яворовский.\n\nХочу повторно предупредить, — никакой пощады наемникам не будет, где бы на территории Украины они не находились.",
    "url": "https://z.mil.ru/spec_mil_oper/brief/briefings/more.htm?id=12412999@egNews",
    "destroyed": {
      "БЕСПИЛОТНИКИ": 145,
      "ТАНКИ И БМ": 1298,
      "РСЗО": 124,
      "АРТИЛЛЕРИЯ И МИНОМЕТЫ": 469,
      "АВТОМОБИЛЬНАЯ ТЕХНИКА": 1047,
      "ИНФРАСТРУКТУРА": 3920
    }
  },
  "15.03.2022": {
    "date": "15.03.2022",
    "message": "Вооруженными Силами Российской Федерации взята под полный контроль вся территория Херсонской области.\n\nГруппировка войск Донецкой Народной Республики, продолжая наступательные действия, прорвала оборону украинских националистов, взяла под контроль населенный пункт Пантелеймоновка и вышла на рубеж Верхнеторецкое – Новоселовка-2.\n\nВсего за прошедшие сутки авиацией и средствами противовоздушной обороны Воздушно-космических сил России сбито 16 воздушных целей: по одному самолету Су-24 и Су-25 военно-воздушных сил Украины, один вертолет Ми-8 и 13 украинских беспилотных летательных аппаратов, в том числе шесть «Байрактар ТБ-2».\n\nОперативно-тактической, армейской и беспилотной авиацией поражены 136 военных объектов Украины, в том числе: семь пунктов управления и узлов связи, четыре зенитных ракетных комплекса, три реактивные установки залпового огня, четыре радиолокационные станции разведки, подсветки целей и наведения зенитного ракетного комплекса С-300, одна станция РЭБ, четыре склада боеприпасов и 72 места скопления боевой техники.\n\nНа военном аэродроме под Краматорском уничтожены три ангара, в которых находились четыре украинских штурмовика Су-25, один вертолет Ми-24 и пять вертолетов Ми-8.\n\nВсего с начала проведения специальной военной операции уничтожено: 156 беспилотных летательных аппаратов, 1306 танков и других боевых бронированных машин, 127 реактивных систем залпового огня, 471 орудие полевой артиллерии и миномет, а также 1054 единицы специальной военной автомобильной техники.\n\nВечером 14 марта в районе населенного пункта Гута-Межигорская подразделениями российских воздушно-десантных войск захвачен опорный пункт националистов и иностранных наемников.\n\nРоссийскими десантниками изъято 10 противотанковых ракетных комплексов американского производства Javelin и ряд других образцов вооружения, поставленных западными странами на Украину. Все захваченные противотанковые комплексы Javelin и другое иностранное вооружение передаются подразделениям народной милиции Донецкой и Луганской народных республик.",
    "url": "https://z.mil.ru/spec_mil_oper/brief/briefings/more.htm?id=12413061@egNews",
    "destroyed": {
      "БЕСПИЛОТНИКИ": 156,
      "ТАНКИ И БМ": 1306,
      "РСЗО": 127,
      "АРТИЛЛЕРИЯ И МИНОМЕТЫ": 471,
      "АВТОМОБИЛЬНАЯ ТЕХНИКА": 1054
    }
  },
  "16.03.2022": {
    "date": "16.03.2022",
    "message": "Группировка войск Луганской Народной Республики, развивая наступление, продвигаются вперед с нескольких направлений внутри города Северодонецк.\n\nПодразделения Донецкой Народной Республики ведут бой за овладение населенным пунктом Марьинка. Продвижение вперед за день составило 2 километра.\n\nУтром 16 марта высокоточным оружием большой дальности нанесен удар по объектам военной инфраструктуры Украины. В результате выведены из строя узлы связи, разведки, ретрансляции и коммутации в населенном пункте Винница.\n\nВ течение дня авиацией и средствами противовоздушной обороны ВКС России сбит в воздухе один украинский вертолет Ми-24 в районе населенного пункта Сараны, а также шесть беспилотных летательных аппаратов.\n\nОперативно-тактической, армейской и беспилотной авиацией поражены 34 военных объекта Украины.\n\nИз них одна установка реактивной системы залпового огня, три командных пункта, одна станция радиоэлектронной борьбы, семь складов боеприпасов и 19 мест скопления боевой техники.\n\nВсего с начала проведения специальной военной операции уничтожено: 180 самолетов и вертолетов, 166 беспилотных летательных аппаратов, 1367 танков и других боевых бронированных машин, 132 реактивных систем залпового огня, 502 орудия полевой артиллерии и миномета, а также 1156 единиц специальной военной автомобильной техники.\n\nНам достоверно известно, что при поддержке западных стран, СБУ готовится провокация с применением ядовитых веществ против мирных жителей.\n\nЦелью провокации является обвинение России в применении химического оружия против населения Украины.\n\nХочу официально заявить, в подразделениях российских Вооруженных Сил, задействованных в специальной военной операции, нет и не может быть химических боеприпасов.\n\nРоссийская Федерация, в отличие от США, давно выполнила взятые на себя международные обязательства, полностью уничтожив все запасы химического оружия.\n\nДля пресечения любых провокаций украинских националистов с отравляющими веществами, российские военнослужащие на освобожденной территории берут опасные объекты под контроль и обеспечивают их безопасность.\n\nДобавлю, что среди захваченной нами в 4-й бригаде украинской национальной гвардии боевой документации имеется подробная карта территории Украины с нанесенными на ней объектами и типами хранящихся ядовитых веществ. Поэтому любая попытка провокации СБУ с использование отравляющих веществ неминуемо будет раскрыта.\n\nМы неоднократно приводили факты о зверствах националистов, терроризирующих мирных жителей за любое неподчинение или попытки покинуть населенные пункты.\n\nСегодня, одновременно на всех пропагандистских ресурсах киевского режима были распространены видеокадры погибших в Чернигове мирных жителей, которые якобы были «расстреляны российскими военнослужащими». Указывалось, что все погибшие якобы стояли в очереди за хлебом.\n\nХочу подчеркнуть, - в Чернигове российских военнослужащих не было и нет.\n\nВсе подразделения российских вооруженных сил находятся за пределами Чернигова, блокируя дороги, и никаких наступательных действий на город не ведут.\n\nНа видеокадрах, тиражируемых украинскими пропагандистами, нет никаких следов от разрывов боеприпасов. Все окна в близлежащих зданиях целые. Никаких повреждений стен, других следов взрыва на земле нет.\n\nТаким образом, все погибшие люди, - жертвы террора украинских националистов или данные видеокадры, - очередная постановка СБУ.\n\nХотим обратить внимание, что одновременно с украинскими Интернет-ресурсами, данный фейк без какой-либо проверки и получения доказательств был опубликован на официальных страницах посольства США на Украине в социальных сетях.\n\nПри этом само посольство, как известно, давно находится даже не в Киеве, а во Львове. И в упор не замечает, как российские военнослужащие доставляют и раздают жителям Черниговской области сотни тонн гуманитарной помощи в населенных пунктах, освобожденных от националистов.",
    "url": "https://z.mil.ru/spec_mil_oper/brief/briefings/more.htm?id=12413257@egNews",
    "destroyed": {
      "ВЕРТОЛЕТЫ": 68,
      "БЕСПИЛОТНИКИ": 166,
      "ЗЕНИТКИ": 159,
      "ТАНКИ И БМ": 1367,
      "РСЗО": 132,
      "АРТИЛЛЕРИЯ И МИНОМЕТЫ": 502,
      "АВТОМОБИЛЬНАЯ ТЕХНИКА": 1156,
      "САМОЛЕТЫ": 180
    }
  },
  "17.03.2022": {
    "date": "17.03.2022",
    "message": "Вооруженные Силы Российской Федерации, продолжая успешное наступление, взяли под контроль населенные пункты НОВОМАЙОРСКОЕ, ПРЕЧИСТОВКА. Продвижение за день составило 10 километров.\n\nВ течение дня авиацией и средствами противовоздушной обороны воздушно-космических сил России сбит в воздухе: один украинский вертолет Ми-24 в районе населенного пункта БЕЛКИ, а также пять украинских беспилотных летательных аппаратов, в том числе один «Байрактар ТБ-2».\n\nОперативно-тактической, армейской и беспилотной авиацией поражены 29 военных объектов Украины.\n\nСреди них: одна установка реактивной системы залпового огня, три командных пункта, включая один полевой подвижный пункт управления бригады, шесть складов боеприпасов и 14 мест скопления боевой техники.\n\nВсего с начала проведения специальной военной операции уничтожены: 182 украинских самолета и вертолета, 177 беспилотных летательных аппаратов, 1393 танка и других боевых бронированных машин, 134 реактивные системы залпового огня, 523 орудия полевой артиллерии и миномета, а также 1182 единицы специальной военной автомобильной техники.",
    "url": "https://z.mil.ru/spec_mil_oper/brief/briefings/more.htm?id=12413390@egNews",
    "destroyed": {
      "БЕСПИЛОТНИКИ": 177,
      "ЗЕНИТКИ": 170,
      "ТАНКИ И БМ": 1393,
      "РСЗО": 134,
      "АРТИЛЛЕРИЯ И МИНОМЕТЫ": 523,
      "АВТОМОБИЛЬНАЯ ТЕХНИКА": 1182
    }
  },
  "18.03.2022": {
    "date": "18.03.2022",
    "message": "Вооруженные Силы Российской Федерации, продолжая успешное наступление, за день продвинулись на глубину до шести километров и вышли на рубеж Новоукраинка, Шахтерское.\n\nПодразделения Народной милиции Луганской Республики, развивая наступление в восточных кварталах Северодонецка, вклинились в оборону противника на два километра.\n\nУтром 18 марта высокоточным оружием большой дальности нанесен удар по объектам военной инфраструктуры Украины.\n\nВ результате удара уничтожены стоянка с украинскими боевыми самолетами на авиаремонтном заводе города Львов, а также склады боеприпасов и украинской военной техники в пригородах Николаева и Вознесенска.\n\nВ течение дня российскими средствами противовоздушной обороны сбит в воздухе один украинский беспилотный летательный аппарат.\n\nОперативно-тактической, армейской и беспилотной авиацией поражены 54 военных объекта Украины. Среди них: три командных пункта, четыре установки реактивных систем залпового огня, четыре склада боеприпасов и 44 места скопления боевой техники.\n\nВсего с начала проведения специальной военной операции уничтожены: 184 беспилотных летательных аппарата, 1412 танков и других боевых бронированных машин, 142 установки реактивной системы залпового огня, 542 орудия полевой артиллерии и миномета, а также 1211 единиц специальной военной автомобильной техники.\n\nПо имеющейся у нас достоверной информации, в Днепропетровске сотрудники Службы безопасности Украины, эвакуировав персонал и медицинских пациентов, заминировали один из корпусов городской больницы № 2 на улице Нигояна.\n\nПодрыв заминированного здания больницы спланировано осуществить во время пролета над Днепропетровском, подчеркиваю, любого российского самолета.\n\nОбращаю внимание, прежде всего, прибывших в Днепропетровск представителей западных СМИ. Никаких боевых задач по поражению здания больницы, других зданий в Днепропетровске у российской авиации не было и нет.\n\nОчередная попытка киевского националистического режима использовать вас для совершения крупной провокации обречена на провал.",
    "url": "https://z.mil.ru/spec_mil_oper/brief/briefings/more.htm?id=12413536@egNews",
    "destroyed": {
      "БЕСПИЛОТНИКИ": 184,
      "ТАНКИ И БМ": 1412,
      "РСЗО": 142,
      "АРТИЛЛЕРИЯ И МИНОМЕТЫ": 542,
      "АВТОМОБИЛЬНАЯ ТЕХНИКА": 1211
    }
  },
  "19.03.2022": {
    "date": "19.03.2022",
    "message": "Подразделения российских вооруженных сил, форсировав реку КАШЛАГАЧ, прорвали оборону батальона «Айдар» и продвинувшись на 5 километров, вышли на рубеж ШАХТЕРСКОЕ-НОВОУКРАИНКА.\n\nУничтожено до 30 боевиков, один танк, одна БМП и четыре автомобиля повышенной проходимости. В настоящее время ведут бой с подразделениями 54 отдельной механизированной бригады вооруженных сил Украины, действующей во втором эшелоне.\n\nГруппировка Народной Милиции Донецкой Республики уничтожила до роты из состава 53 отдельной механизированной бригады ВСУ, полностью взяла под контроль населенный пункт ТАРАМЧУК и преследует отступающего противника.\n\nГруппировка войск Луганской Народной Республики вышла к северной окраине города ЛИСИЧАНСК и осуществляет уничтожение разрозненных групп националистов, отступивших из города РУБЕЖНОЕ.\n \nЗа день оперативно-тактической, армейской авиацией поражены 59 военных объектов Украины. Среди них: три командных пункта, две установки реактивных систем залпового огня и две радиолокационные станции в районе города БОГОДУХОВ, два склада ракетно-артиллерийского вооружения, а также 51 место скопления боевой техники.\n\nБеспилотным летательным аппаратом «Форпост-РУ» уничтожен один радиолокатор подсветки и наведения зенитного ракетного комплекса С-300 в районе населенного пункта ВЫПОЛЗОВ, 60 км севернее КИЕВА.\n\nКроме того, российскими средствами ПВО  сбиты в воздухе пять украинских беспилотных летательных аппаратов, в том числе один «Байрактар ТБ-2» в районе МАЛОВОРОНЦОВКИ.\n\nВсего с начала проведения специальной военной операции уничтожены: 201 беспилотный летательный аппарат, 1443 танка и других боевых бронированных машин, 147 установок реактивной системы залпового огня, 564 орудия полевой артиллерии и миномета, а также 1248 единиц специальной военной автомобильной техники.\n\nВ ходе проведения специальной военной операции российским военнослужащим добровольно сдался сотрудник главного управления СБУ по Донецкой и Луганской областям.\n\nДанный офицер принимал непосредственное участие в организации подготовки диверсионно-террористических групп для работы в освобожденных от националистов районах. \nОфицер СБУ передал подробные сведения в отношении всех лиц, привлеченных к ведению диверсионной деятельности на территории Донбасса.\n\nДовожу до сведения всех завербованных СБУ лиц, что добровольный отказ от преступной деятельности и своевременное сообщение о ней правоохранительным органам освобождает от уголовной ответственности.\n\nКроме того, офицер СБУ сообщил о спланированных боевиками националистического батальона «Азов» террористических актах во ЛЬВОВЕ против сотрудников и объектов дипломатических представительств США и других западных стран.\n\nХочу подчеркнуть, что руководство киевского режима осведомлено о планах националистов, но никаких действий по недопущению их реализации не принимает.\n\nКиевский националистический режим планирует представить нападения на дипломатические объекты США и западных стран, как якобы «целенаправленную атаку российских вооруженных сил». \nГлавная цель провокации - усилить давление на страны НАТО по введению над Украиной «бесполетной зоны» и предоставления дополнительного вооружения.",
    "url": "https://z.mil.ru/spec_mil_oper/brief/briefings/more.htm?id=12413681@egNews",
    "destroyed": {
      "БЕСПИЛОТНИКИ": 201,
      "ТАНКИ И БМ": 1443,
      "РСЗО": 147,
      "АРТИЛЛЕРИЯ И МИНОМЕТЫ": 564,
      "АВТОМОБИЛЬНАЯ ТЕХНИКА": 1248
    }
  },
  "20.03.2022": {
    "date": "20.03.2022",
    "message": "Подразделения российских Вооруженных Сил завершают разгром националистического батальона «Донбасс». В течение дня продвинулись на 12 километров, вышли на рубеж НИКОЛЬСКОЕ и во взаимодействии с подразделениями Донецкой Республики блокировали с трех сторон населенный пункт СЛАДКОЕ.\n\nУничтожено до 60 боевиков, два танка, три БМП, шесть орудий полевой артиллерии и минометов националистов. В настоящее время ведут бой с остатками боевиков и подразделениями 54-й отдельной механизированной бригады украинских войск за овладение населенными пунктами СЛАДКОЕ, НОВОУКРАИНКА и ШАХТЕРСКОЕ.\n\nГруппировка войск Донецкой Народной Республики продолжала преследование отступающих подразделений 53-й механизированной бригады украинских вооруженных сил, развивая наступление в направлении населенного пункта НОВОМИХАЙЛОВКА.\n\nУничтожено до 20 человек личного состава, 1 танк, 1 БМП и 3 автомобиля повышенной проходимости. На направлении НОВОСЕЛОВКА ВТОРАЯ – подразделения Донецкой Республики вклинились в оборону 25-й воздушно-десантной бригады украинских вооруженных сил и сейчас ведут бой за овладение населенными пунктами КАМЕНКА и НОВОСЕЛОВКА ВТОРАЯ.\n\nЗа день оперативно-тактической и армейской авиацией поражены 89 военных объектов Украины. Среди них: четыре командных пункта, две установки реактивных систем залпового огня, девять артиллерийских орудий, пять складов ракетно-артиллерийского вооружения и боеприпасов, а также 65 мест скопления боевой техники.\n\nРоссийскими средствами ПВО сбиты в воздухе семь украинских беспилотных летательных аппаратов.\n\nВсего с начала проведения специальной военной операции уничтожены: 214 беспилотных летательных аппаратов, 1483 танка и других боевых бронированных машин, 150 установок реактивной системы залпового огня, 584 орудия полевой артиллерии и миномета, а также 1279 единиц специальной военной автомобильной техники.",
    "url": "https://z.mil.ru/spec_mil_oper/brief/briefings/more.htm?id=12414037@egNews",
    "destroyed": {
      "БЕСПИЛОТНИКИ": 214,
      "ТАНКИ И БМ": 1483,
      "РСЗО": 150,
      "АРТИЛЛЕРИЯ И МИНОМЕТЫ": 584,
      "АВТОМОБИЛЬНАЯ ТЕХНИКА": 1279
    }
  },
  "21.03.2022": {
    "date": "21.03.2022",
    "message": "Подразделения российских Вооруженных Сил за ночь продвинулись еще на четыре километра и полностью взяли под контроль населенный пункт Сладкое. В настоящее время уничтожают разрозненные группы националистического батальона «Донбасс».\n\nГруппировка войск Донецкой Народной Республики завершает разгром остатков 53-й механизированной бригады украинских вооруженных сил, развивая наступление в направлении населенного пункта Новомихайловка. Всего за ночь в данном районе уничтожено до 50 боевиков, три танка, четыре БМП, два орудия полевой артиллерии и четыре автомобиля повышенной проходимости.\n\nКроме того, подразделениями Донецкой Республики ведутся бои с подразделениями 25-й воздушно-десантной бригады украинских вооруженных сил и завершается овладение населенным пунктом Верхнеторецкое.\n\nВ населенном пункте Николаевка, в пригороде Киева, российскими военнослужащими был взят под контроль защищенный заглубленный командный пункт вооруженных сил Украины. Добровольно сдались в плен 61 украинский военнослужащий пункта управления, из которых больше половины – старшие офицеры вооруженных сил Украины.\n\nНочью 21 марта высокоточными крылатыми ракетами воздушного базирования нанесен удар по центру подготовки иностранных наемников и украинских националистических формирований на общевойсковом полигоне Новая Любомирка в Ровенской области. Уничтожено более 80 наемников и националистов.\n\nТакже высокоточными крылатыми ракетами воздушного базирования уничтожен склад боеприпасов и штаб механизированной бригады в районе населенного пункта Селец.\n\nГруппой «ночных охотников», состоящей из вертолетов Ка-52 и Ми-28Н, в ходе ночных ударов уничтожено восемь танков, четыре БМП и три БТР.\n\nЗа ночь оперативно-тактической и армейской авиацией поражены 44 военных объекта Украины. Среди них: четыре командных пункта, две установки реактивных систем залпового огня в районах населенных пунктов Наливайковка и Золочева, шесть зенитных ракетных комплексов «Бук М-1», три артиллерийских орудия «Мста-Б» в районе Вышгород, четыре склада ракетно-артиллерийского вооружения и боеприпасов, а также 23 места скопления боевой техники.\n\nРоссийскими средствами ПВО сбиты в воздухе над населенными пунктами Чернобаевка и Циркуны еще два украинских беспилотных летательных аппарата.\n\nВсего с начала проведения специальной военной операции уничтожены: 216 беспилотных летательных аппаратов, 180 зенитных ракетных комплексов, 1506 танков и других боевых бронированных машин, 152 установки реактивной системы залпового огня, 592 орудия полевой артиллерии и миномета, а также 1284 единицы специальной военной автомобильной техники.\n\nВ городе Сумы ночью была реализована спланированная провокация украинских националистов, о которой несколько дней назад официально предупреждало Минобороны России. По заявлению главы Сумской областной администрации, на заводе «Сумыхимпром» произошла утечка аммиака. Угрозы для жителей Сум нет, так как воздушные массы двигались не в сторону города.\n\nНапомню, что еще 19 марта мы официально предупредили о минировании данного предприятия украинскими националистами для совершения провокации с целью обвинений России в якобы применении «химического оружия». Хочу в очередной раз подчеркнуть – Вооруженные Силы Российской Федерации не планировали и не наносят никаких ударов по украинским объектам хранения или выработки ядовитых веществ. Координаты всех подобных объектов и данные о хранящихся там ядовитых веществах на территории Украины получены нами при захвате боевой документации 4-й бригады украинской национальной гвардии. За любые возможные инциденты с украинскими объектами хранения ядовитых веществ несет прямую ответственность киевский националистический режим.",
    "url": "https://z.mil.ru/spec_mil_oper/brief/briefings/more.htm?id=12414112@egNews",
    "destroyed": {
      "БЕСПИЛОТНИКИ": 216,
      "ЗЕНИТКИ": 180,
      "ТАНКИ И БМ": 1506,
      "РСЗО": 152,
      "АРТИЛЛЕРИЯ И МИНОМЕТЫ": 592,
      "АВТОМОБИЛЬНАЯ ТЕХНИКА": 1284
    }
  },
  "22.03.2022": {
    "date": "22.03.2022",
    "message": "Подразделения российских вооруженных сил, преследуя отступающие подразделения 54-й отдельной механизированной бригады украинских вооруженных сил, за день продвинулись еще на 4 километра и подошли к населенному пункту НОВОМИХАЙЛОВКА.\n\nГруппировка войск Донецкой Народной Республики взяла под контроль населенный пункт ВЕРХНЕТОРЕЦКОЕ и продолжает наступление на подразделения 25-й воздушно-десантной бригады вооруженных сил Украины. Уничтожены два танка, пять БМП, три орудия полевой артиллерии и семь автомобилей повышенной проходимости.\n\n22 марта нанесены удары высокоточным оружием большой дальности воздушного и морского базирования по военным объектам Украины. Уничтожены крупные склады горюче-смазочных материалов украинских войск в населенных пунктах ЛИСИЧАНСК и КРАМАТОРСК, склад ракетно-артиллерийского вооружения в ДРУЖКОВКЕ и склады с боеприпасами в НАДЕЖДИНКЕ и НОВОАЛЕКСАНДРОВКЕ.\n\nОперативно-тактической и армейской авиацией поражены 83 военных объекта Украины.\n\nСреди них: четыре командных пункта, четыре зенитных ракетных комплекса, три склада ракетно-артиллерийского вооружения и боеприпасов, а также 68 мест скопления боевой техники.\n\nРоссийскими средствами ПВО сбиты в воздухе 6 украинских беспилотных летательных аппаратов, в том числе один «Байрактар ТБ-2» в районе населенного пункта МЕРЕФА Харьковской области.\n\nВсего с начала проведения специальной военной операции уничтожены: 236 беспилотных летательных аппаратов, 185 зенитных ракетных комплексов, 1547 танков и других боевых бронированных машин, 154 установки реактивной системы залпового огня, 612 орудий полевой артиллерии и миномета, а также 1343 единицы специальной военной автомобильной техники.",
    "url": "https://z.mil.ru/spec_mil_oper/brief/briefings/more.htm?id=12414291@egNews",
    "destroyed": {
      "БЕСПИЛОТНИКИ": 236,
      "ЗЕНИТКИ": 185,
      "ТАНКИ И БМ": 1547,
      "РСЗО": 154,
      "АРТИЛЛЕРИЯ И МИНОМЕТЫ": 612,
      "АВТОМОБИЛЬНАЯ ТЕХНИКА": 1343
    }
  },
  "23.03.2022": {
    "date": "23.03.2022",
    "message": "Подразделения российских вооруженных сил, за день продвинулись еще на 2 километра и ведут бой против подразделений 54-й отдельной механизированной бригады вооруженных сил Украины на южных и юго-восточных окраинах населенного пункта Новомихайловка.\n\nГруппировка войск Донецкой Народной Республики наносит огневое поражение подразделениям 25-й воздушно-десантной бригады ВСУ и ведет бой за овладение населенными пунктами Каменка и Новобахмутовка.\n\nОперативно-тактической и армейской авиацией поражены 86 военных объектов Украины. Среди них: 6 командных пунктов, две реактивных системы залпового огня, 8 орудий полевой артиллерии, три склада с боеприпасами, 49 районов скопления вооружения и военной техники ВСУ.\n\nРоссийскими средствами ПВО уничтожены 9 украинских беспилотных летательных аппаратов в районах населенных пунктов Изюм, Киев, Сумы, Харьков, Чернигов.\n\nВсего с начала проведения специальной военной операции уничтожены: 255 беспилотных летательных аппаратов, 189 зенитных ракетных комплексов, 1564 танка и других боевых бронированных машин, 158 установок реактивной системы залпового огня, 627 орудий полевой артиллерии и минометов, а также 1367 единиц специальной военной автомобильной техники.",
    "url": "https://z.mil.ru/spec_mil_oper/brief/briefings/more.htm?id=12414489@egNews",
    "destroyed": {
      "САМОЛЕТЫ": 184,
      "БЕСПИЛОТНИКИ": 255,
      "ЗЕНИТКИ": 189,
      "ТАНКИ И БМ": 1564,
      "РСЗО": 158,
      "АРТИЛЛЕРИЯ И МИНОМЕТЫ": 627,
      "АВТОМОБИЛЬНАЯ ТЕХНИКА": 1367
    }
  },
  "24.03.2022": {
    "date": "24.03.2022",
    "message": "Вооруженные Силы Российской Федерации продолжают выполнение задач специальной военной операции.\n\nК утру 24 марта подразделениями российской армии полностью взят под контроль город Изюм Харьковской области.\n\nВечером 23 марта и ночью 24 марта по военным объектам украинских вооруженных сил нанесены удары высокоточным оружием большой дальности морского и воздушного базирования. В результате ударов уничтожены 13 пусковых установок зенитных ракетных комплексов, в том числе девять С-300 и четыре «Бук-М1» в населенном пункте Даниловка, южнее Киева; штаб соединения и склад ракетно-артиллерийского вооружения в населенном пункте Бахмут Донецкой области, а также временный пункт дислокации националистического батальона в городе Лисичанск.\n\nОперативно-тактической и армейской авиацией за ночь поражены 60 военных объектов Украины. Среди них: два командных пункта, две реактивные системы залпового огня, четыре склада с боеприпасами, 47 районов скопления вооружения и военной техники ВСУ.\n\nРоссийскими средствами ПВО уничтожены два украинских беспилотных летательных аппарата в районах населенных пунктов Старая Марковка и Харьков.\n\nВсего с начала проведения специальной военной операции уничтожены: 257 беспилотных летательных аппаратов, 202 зенитных ракетных комплекса, 1572 танка и других боевых бронированных машин, 160 установок реактивной системы залпового огня, 633 орудия полевой артиллерии и миномета, а также 1379 единиц специальной военной автомобильной техники.\n\nМинобороны России продолжает изучение полученных от сотрудников украинских биологических лабораторий документов о секретной военно-биологической деятельности США на Украине.\n\nЭкспертами российских войск радиационной, химической и биологической защиты в ходе исследования документов вскрыты новые факты, доказывающие непосредственную причастность минобороны США к разработке компонентов биологического оружия на Украине. В ближайшее время мы представим оригинальные документы демонстрирующие, что биологический проект UP-2, о котором мы уже рассказывали, разрабатывался и утверждался именно в Пентагоне.\n\nОсновной целью данного проекта было проведение молекулярного анализа особо опасных инфекций, эндемичных для Украины. Данная работа предусматривала отбор образцов патогена в старых скотомогильниках в целях получения новых штаммов сибирской язвы.\n\nВместе с тем эксперименты Пентагона не ограничивались разработкой опасных инфекций. Так, например, законтрактованная минобороны США фармацевтическая фирма, согласно полученным документам, прорабатывала с минобороны Украины проведение испытаний незарегистрированных медицинских препаратов именно на украинских военнослужащих. Об этих и других документально подтвержденных фактах в ближайшее время мы расскажем на специальном брифинге.",
    "url": "https://z.mil.ru/spec_mil_oper/brief/briefings/more.htm?id=12414538@egNews",
    "destroyed": {
      "БЕСПИЛОТНИКИ": 257,
      "ЗЕНИТКИ": 202,
      "ТАНКИ И БМ": 1572,
      "РСЗО": 160,
      "АРТИЛЛЕРИЯ И МИНОМЕТЫ": 633,
      "АВТОМОБИЛЬНАЯ ТЕХНИКА": 1379
    }
  },
  "25.03.2022": {
    "date": "25.03.2022",
    "message": "Группировка войск российских вооруженных сил за ночь продвинулась еще на 4 километра и овладела населенными пунктами Батманка, Михайловка, Красный Партизан, Ставки и Троицкое. В настоящее время развивает наступление на подразделения 25-й воздушно-десантной бригады украинских вооруженных сил.\n\nВечером, 24 марта, высокоточными крылатыми ракетами морского базирования «Калибр» нанесен удар по базе горючего в населенном пункте Калиновка под Киевом. Уничтожена крупнейшая из оставшихся у вооруженных сил Украины топливных баз, с которой осуществлялось снабжение горючим воинских частей в центральной части страны.\n\nГруппой «ночных охотников», состоящей из вертолетов Ка-52 и Ми-28н, в ходе ночных ударов уничтожено 24 единицы боевой техники, в том числе 7 танков, 5 БМП, 3 БТР.\n\nЗа ночь оперативно-тактической и армейской авиацией поражен 51 военный объект Украины.\n\nСреди них: два командных пункта, три установки реактивных систем залпового огня, два зенитных ракетных комплекса «Бук М-1» и один радиолокатор подсвета и наведения С-300 в районе Днепропетровска, три артиллерийских орудия Д-30, два склада ракетно-артиллерийского вооружения и боеприпасов, а также 26 районов сосредоточения боевой техники.\n\nРоссийскими средствами ПВО сбиты в воздухе над населенными пунктами Боромля, Борщевая, Олешня и Усоки четыре украинских беспилотных летательных аппарата.\n\nВсего с начала проведения специальной военной операции уничтожены: 261 беспилотный летательный аппарат, 204 зенитных ракетных комплекса, 1587 танков и других боевых бронированных машин, 163 установки реактивной системы залпового огня, 636 орудий полевой артиллерии и минометов, а также 1397 единиц специальной военной автомобильной техники.",
    "url": "https://z.mil.ru/spec_mil_oper/brief/briefings/more.htm?id=12414677@egNews",
    "destroyed": {
      "БЕСПИЛОТНИКИ": 261,
      "ЗЕНИТКИ": 204,
      "ТАНКИ И БМ": 1587,
      "РСЗО": 163,
      "АРТИЛЛЕРИЯ И МИНОМЕТЫ": 636,
      "АВТОМОБИЛЬНАЯ ТЕХНИКА": 1397
    }
  },
  "26.03.2022": {
    "date": "26.03.2022",
    "message": "Подразделения российских Вооруженных Сил ведут боевые действия за овладение населенным пунктом Новомихайловка.\n\nВ ходе дневных боев уничтожены более 30 военнослужащих 54 механизированной бригады украинских вооруженных сил, 6 бронеавтомобилей и батарея полевой артиллерии 46-го отдельного штурмового батальона.\n\nПродолжается наступление на хорошо укрепленные бетонными сооружениями долговременные опорные пункты в Новоселовке и Новобахмутовке. На данном направлении уничтожено до 50 украинских военнослужащих 25-й отдельной воздушно-десантной бригады.\n\nПодавлены 7 долговременных огневых точек и 5 бронеобъектов в защищенных укрытиях.   За сутки оперативно-тактической и армейской авиацией поражен 91 военный объект Украины. Среди них: два командных пункта, 11 полевых складов с вооружением и боеприпасами, две станции РЭБ, а также 20 опорных пунктов подразделений украинских вооруженных сил и 52 района сосредоточения боевой техники.\n\nРоссийскими средствами ПВО над населенным пунктом Старая Басань сбит в воздухе украинский вертолет Ми-24.\n\nВ течение дня уничтожены три украинских беспилотных летательных аппарата над Балаклеей, Киевом, Черниговом. Также уничтожен один украинский беспилотный летательный аппарат, приближавшийся к Севастополюв воздушном пространстве над Черным морем.\n\nВсего с начала проведения специальной военной операции уничтожены: 271 беспилотных летательных аппаратов, 1627 танков и других боевых бронированных машин, 167 установок реактивных систем залпового огня, 669 орудий полевой артиллерии и минометов, а также 1474 единицы специальной военной автомобильной техники.\n\nВ течение последних дней многим российским гражданам поступали фейковые телефонные звонки, в которых голос автоответчика сообщал о якобы вызове их в военный комиссариат. Хочу подчеркнуть, - все подобные звонки осуществляются с территории Украины и является провокацией украинских спецслужб.\n\nОфициально заявляю: никаких вызовов в военные комиссариаты граждан, пребывающих в запасе, Минобороны России не проводит и не планирует",
    "url": "https://z.mil.ru/spec_mil_oper/brief/briefings/more.htm?id=12414891@egNews",
    "destroyed": {
      "БЕСПИЛОТНИКИ": 271,
      "ЗЕНИТКИ": 207,
      "ТАНКИ И БМ": 1627,
      "РСЗО": 167,
      "АРТИЛЛЕРИЯ И МИНОМЕТЫ": 669,
      "АВТОМОБИЛЬНАЯ ТЕХНИКА": 1474
    }
  },
  "27.03.2022": {
    "date": "27.03.2022",
    "message": "Вооруженные Силы Российской Федерации продолжают наступательные действия в ходе проведения специальной военной операции.\n\n26 марта высокоточным оружием большой дальности воздушного базирования уничтожена крупная база горючего в районе города Львов, обеспечивавшая топливом украинские войска в западных областях Украины, а также под Киевом.\n\nКроме того, высокоточными крылатыми ракетами в городе Львов уничтожены цеха Львовского радиоремонтного завода. На данном предприятии осуществлялся капитальный ремонт и модернизация зенитных ракетных комплексов «Тор» и С-125, радиолокационных станций для военно-воздушных сил Украины, средств РЭБ и прицелов для танков.\n\nТакже высокоточным оружием большой дальности морского базирования уничтожен склад ракет к зенитным ракетным комплексам С-300 и «Бук» в населенном пункте Плесецкое, в 30 км юго-западне города Киев.\n\nЗа сутки оперативно-тактической и армейской авиацией поражены 67 военных объектов Украины. Среди них: два командных пункта, три полевых склада с вооружением и боеприпасами, 11 опорных пунктов подразделений украинских вооруженных сил и 20 районов сосредоточения боевой техники.\n\nРоссийскими средствами ПВО в течение ночи уничтожено 18 украинских беспилотных летательных аппаратов над Новой Басанью, Песками, Борисполем, Щорсом, Вишневой, Крюковкой, Петровским.\n\nВсего с начала проведения специальной военной операции уничтожены: 289 беспилотных летательных аппаратов, 1656 танков и других боевых бронированных машин, 169 установок реактивных систем залпового огня, 684 орудия полевой артиллерии и миномета, а также 1503 единицы специальной военной автомобильной техники.",
    "url": "https://z.mil.ru/spec_mil_oper/brief/briefings/more.htm?id=12414946@egNews",
    "destroyed": {
      "БЕСПИЛОТНИКИ": 289,
      "ТАНКИ И БМ": 1656,
      "РСЗО": 169,
      "АРТИЛЛЕРИЯ И МИНОМЕТЫ": 684,
      "АВТОМОБИЛЬНАЯ ТЕХНИКА": 1503
    }
  },
  "28.03.2022": {
    "date": "28.03.2022",
    "message": "Вооруженные Силы Российской Федерации продолжают специальную военную операцию на Украине.\n\nВысокоточными крылатыми ракетами морского базирования «Калибр» уничтожены крупные склады с боеприпасами в районах населенных пунктов Ушомир и Веселовка Житомирской области, с которых осуществлялось снабжение группировки украинских войск в пригороде Киева.\n\nРоссийской авиацией и средствами противовоздушной обороны в течение дня 28 марта сбиты в воздухе еще три самолета военно-воздушных сил Украины: два Су-24 — западнее населенного пункта Коростень в Житомирской области, и один Су-25 — над населенным пунктом Дружковка в Донецкой области.\n\nВ районе Мариуполя, в пяти километрах от береговой черты над Азовским морем, сбит украинский вертолет Ми-8, направлявшийся для экстренной эвакуации бросивших своих подчиненных командиров нацбатальона «Азов».\n\nКроме того, в районе населенного пункта Чернобаевка сбит один украинский беспилотный летательный аппарат.\n\nВ течение суток оперативно-тактической авиацией поражен 41 военный объект Украины. Среди них: две установки реактивной системы залпового огня, одна станция радиоэлектронной борьбы, два полевых склада боеприпасов и 24 опорных пункта и района сосредоточения украинской боевой техники.\n\nВсего с начала проведения специальной военной операции уничтожены: 123 самолета и 74 вертолета, 309 беспилотных летательных аппаратов, 1721 танк и другие боевые бронированные машины, 172 установки реактивных систем залпового огня, 721 орудие полевой артиллерии и миномет, а также 1568 единиц специальной военной автомобильной техники.",
    "url": "https://z.mil.ru/spec_mil_oper/brief/briefings/more.htm?id=12415096@egNews",
    "destroyed": {
      "БЕСПИЛОТНИКИ": 309,
      "ТАНКИ И БМ": 1721,
      "РСЗО": 172,
      "АРТИЛЛЕРИЯ И МИНОМЕТЫ": 721,
      "АВТОМОБИЛЬНАЯ ТЕХНИКА": 1568,
      "САМОЛЕТЫ": 123,
      "ВЕРТОЛЕТЫ": 74
    }
  },
  "29.03.2022": {
    "date": "29.03.2022",
    "message": "Вооруженные Силы Российской Федерации продолжают проведение специальной военной операции.\n\nВечером 28 марта высокоточными крылатыми ракетами воздушного базирования уничтожена крупная база горючего в районе населенного пункта Клевань Ровенской области. С данной базы осуществлялись поставки топлива для украинской военной техники в пригороды Киева.\n\nСредствами противовоздушной обороны российских воздушно-космических сил за ночь уничтожены 3 украинских беспилотных летательных аппарата в районе населенного пункта Чернобаевка. В течение ночи оперативно-тактической авиацией поражены 68 военных объектов Украины. Среди них: три пункта управления, четыре зенитных ракетных комплекса, в том числе три «Бук-М1» и один «Оса», одна радиолокационная станция, пять установок реактивных систем залпового огня, два склада боеприпасов, три склада горюче-смазочных материалов, и 19 районов сосредоточения украинской боевой техники и опорных пунктов.\n\nВсего с начала проведения специальной военной операции уничтожены: 123 самолета и 74 вертолета, 311 беспилотных летательных аппаратов, 1738 танков и других боевых бронированных машин, 181 установка реактивных систем залпового огня, 726 орудий полевой артиллерии и минометов, а также 1592 единицы специальной военной автомобильной техники.",
    "url": "https://z.mil.ru/spec_mil_oper/brief/briefings/more.htm?id=12415165@egNews",
    "destroyed": {
      "САМОЛЕТЫ": 123,
      "ВЕРТОЛЕТЫ": 74,
      "БЕСПИЛОТНИКИ": 311,
      "ТАНКИ И БМ": 1738,
      "РСЗО": 181,
      "АРТИЛЛЕРИЯ И МИНОМЕТЫ": 726,
      "АВТОМОБИЛЬНАЯ ТЕХНИКА": 1592
    }
  },
  "30.03.2022": {
    "date": "30.03.2022",
    "message": "Вооруженные Силы Российской Федерации, развивая наступление, прорвали хорошо укрепленную оборону противника, форсировали реку Шайтанка и ведут бой с подразделениями 53-й механизированной бригады на подступах к населенному пункту Великая Новоселка.\n\nИдет зачистка от националистических формирований населенного пункта Золотая Нива. Продвижение составило 8 километров. В данном районе уничтожено до 50 человек личного состава, три танка, 5 БМП, 8 автомобилей различного назначения.\n\nПодразделения Луганской Народной Республики продолжают наступление на Северодонецк. Ведутся бои по зачистке населенного пункта Житловка. Украинские националистические батальоны на Северодонецком направлении несут серьезные потери. В результате нарушения транспортных коммуникаций возможности по их восполнению блокированы. За день на этом направлении уничтожено свыше 50 националистов, 2 танка, 3 БМП и два полевых склада ракетно-артиллерийского вооружения.\n\nНа Киевском и Черниговском направлениях происходит плановая перегруппировка войск.\n\nНа первом этапе специальной военной операции, проводимой Вооруженными Силами России на территории Донбасса и Украины, планировалось заставить противника сконцентрировать свои силы, средства, ресурсы и боевую технику для удержания больших населенных пунктов на этих направлениях, включая Киев. Сковать их на поле боя и без штурма этих городов, во избежание потерь среди гражданского населения, нанести вооруженным формированиям киевского режима такое поражение, которое не позволило бы ему использовать эти силы на главном направлении действий наших Вооруженных Сил – на Донбассе. Все эти цели были выполнены.\n\nОдновременно Российская армия решала и другую задачу, а именно – в отсутствие притока свежих сил противника из западных и центральных регионов Украины, путем профессиональных военных действий, используя завоеванное абсолютное превосходство в воздухе, также используя современные высокоточные средства поражения, - создать все необходимые условия для проведения завершающего этапа операции по освобождению республик Донбасса. С этой целью проводилась и продолжается постоянное, целевое огневое поражение созданных киевским режимом за восемь лет долговременных оборонительных укреплений. Взяты под полный контроль все основные линии коммуникаций, снабжения и подхода резервов. Уничтожены системы ПВО Украины, аэродромная инфраструктура, крупнейшие военные склады, центры подготовки и сосредоточения наемников. Работа по ним продолжается.\n\nТаким образом, все основные задачи Вооруженных Сил России на Киевском и Черниговском направлениях выполнены. Целью перегруппировки российских Вооруженных Сил является активизация действий на приоритетных направлениях и, прежде всего, завершение операции по полному освобождению Донбасса. Средствами противовоздушной обороны российских воздушно-космических сил за сутки уничтожены 2 украинских беспилотных летательных аппарата в районах населенных пунктов Балаклея и Верхнеторецкое.\n\nВ течение дня оперативно-тактической и беспилотной авиацией поражены 69 военных объектов Украины. Среди них: три командных пункта, две установки реактивных систем залпового огня, восемь складов боеприпасов и ракетно-артиллерийского вооружения и 52 опорных пункта и района сосредоточения боевой техники. Всего с начала проведения специальной военной операции уничтожены: 124 самолета и 77 вертолетов, 214 зенитных ракетных комплексов, 323 беспилотных летательных аппарата, 1767 танков и других боевых бронированных машин, 186 установок реактивных систем залпового огня, 741 орудие полевой артиллерии и миномет, а также 1657 единиц специальной военной автомобильной техники.\n\nМинобороны России продолжает изучение полученных от сотрудников украинских биологических лабораторий документов о секретной военно-биологической деятельности США на Украине. В результате изучения новых материалов российскими экспертами войск радиационной, химической и биологической защиты выявлены конкретные должностные лица, которые принимали участие в создании компонентов биологического оружия. Это руководители подразделений и сотрудники Минобороны США, а также его основных компаний-подрядчиков.\n\nКак показывают идущие журналистские расследования в западной прессе, данные кампании были напрямую связаны с сыном действующего президента США Хантером Байденом. В результате проведения специальной военной операции прекратились исследования в ряде украинских биолабораторий, в которых по заказу Пентагона проводились работы со штаммами возбудителей особо опасных инфекций. При этом ряд полученных документов из этих лабораторий свидетельствует о сокрытии личностей испытуемых и имевшемся серьезном риске для их жизни.\n\nОсобый интерес представляют документы, свидетельствующие о планах применения киевским режимом беспилотных летательных аппаратов, способных нести и распылять смертельно-опасные вещества. Вскрытые факты доказывают, что киевский режим всерьез рассматривал возможность использования биологического оружия против населения Донбасса, и Российской Федерации. Более детально о результатах анализа полученных документов и выявленных фактах мы расскажем в ближайшее время на специальном брифинге.",
    "url": "https://z.mil.ru/spec_mil_oper/brief/briefings/more.htm?id=12415372@egNews",
    "destroyed": {
      "САМОЛЕТЫ": 124,
      "ВЕРТОЛЕТЫ": 77,
      "БЕСПИЛОТНИКИ": 323,
      "ЗЕНИТКИ": 214,
      "ТАНКИ И БМ": 1767,
      "РСЗО": 186,
      "АРТИЛЛЕРИЯ И МИНОМЕТЫ": 741,
      "АВТОМОБИЛЬНАЯ ТЕХНИКА": 1657
    }
  },
  "31.03.2022": {
    "date": "31.03.2022",
    "message": "Подразделения войск Луганской Народной Республики продолжают наступательные действия на окраинах Северодонецка, продвинувшись за день вглубь обороны 57 отдельной мотопехотной бригады на 2 километра.\n\nУничтожено свыше 40 человек личного состава украинской бригады, три БМП, три автомобиля различного назначения и два полевых склада ракетно-артиллерийского вооружения.\n\nГруппировка войск Донецкой Народной Республики, продолжая наступление, установила контроль над частью населенного пункта Новобахмутовка. Ведет бой с подразделениями 25-й украинской воздушно-десантной бригады на окраине населенного пункта Новоселовка Вторая. За день уничтожено свыше 50 человек националистов, один танк, четыре БМП, полевой склад боеприпасов, а также колонна топливозаправщиков из пяти автомобилей.\n\nВ течение дня оперативно-тактической авиацией поражены 28 военных объектов Украины. Среди них: четыре командных пункта, три полевых склада ракетно-артиллерийского вооружения, четыре хранилища топлива и 6 районов сосредоточения украинской боевой техники.\n\nСредствами противовоздушной обороны российских Воздушно-космических сил сбит в воздухе один украинский вертолет Ми-24 в 30 километрах западнее города Изюм, а также 4 украинских беспилотных летательных аппарата в районах населенных пунктов Тамарино, Лисичанск и Волноваха.\n\nУтром 31 марта киевским режимом была предпринята попытка эвакуации из города Мариуполь двумя вертолетами Ми-8 командного состава полка украинских националистов «Азов».\n\nРасчетом переносного зенитного ракетного комплекса народной милиции Донецкой Республики из трофейного американского комплекса «Стингер» один украинский вертолет Ми-8 был сбит и упал в районе населенного пункта Рыбацкое.\n\nВторой украинский Ми-8 – от попадания ракеты получил повреждения, уклонился в сторону моря, но потерпел крушение в 20 километрах от берега.\n\nВсего с начала проведения специальной военной операции уничтожены: 124 самолета и 80 вертолетов, 345 беспилотных летательных аппаратов, 1826 танков и других боевых бронированных машин, 195 установок реактивных систем залпового огня, 766 орудий полевой артиллерии и минометов, а также 1704 единицы специальной военной автомобильной техники.",
    "url": "https://z.mil.ru/spec_mil_oper/brief/briefings/more.htm?id=12415531@egNews",
    "destroyed": {
      "САМОЛЕТЫ": 124,
      "ВЕРТОЛЕТЫ": 80,
      "БЕСПИЛОТНИКИ": 345,
      "ЗЕНИТКИ": 216,
      "ТАНКИ И БМ": 1826,
      "РСЗО": 195,
      "АРТИЛЛЕРИЯ И МИНОМЕТЫ": 766,
      "АВТОМОБИЛЬНАЯ ТЕХНИКА": 1704
    }
  },
  "01.04.2022": {
    "date": "01.04.2022",
    "message": "1 апреля около 5 часов утра московского времени два украинских вертолета Ми-24 на предельно малой высоте вошли в воздушное пространство Российской Федерации.\n\nМаневрируя с использованием складок рельефа, украинские вертолеты нанесли ракетный удар по расположенному на окраине Белгорода гражданскому объекту хранения нефтепродуктов.\n\nВ результате попадания ракет отдельные резервуары были повреждены и загорелись.\n\nХочу подчеркнуть, что с данного объекта осуществлялось снабжение топливом только гражданского транспорта. Никакого отношения к российским вооруженным силам нефтебаза не имеет.\n\nВооруженные Силы Российской Федерации продолжают проведение специальной военной операции на Украине.\n\nПодразделения российских вооруженных сил завершили зачистку от националистов населенного пункта Урожайное и ведут бой с украинской 54 отдельной механизированной бригадой за овладение совхозом Октябрь.\n\nГлубина продвижения за день составила 8 километров. Уничтожена украинская мотопехотная рота, усиленная танковым взводом.\n\nВысокоточными крылатыми ракетами «Оникс» берегового ракетного комплекса «Бастион» уничтожен штаб группировки украинских войск в районе населенного пункта Шахтерское. Уничтожено до 40 человек личного состава, 5 единиц бронетехники и автомобили различного назначения.\n\nВ течение дня оперативно-тактической авиацией поражены 40 военных объектов Украины.\n\nСреди них: два зенитных ракетных комплекса, в том числе один ЗРК «Бук-М1» в районе Мурахово и одна пусковая установка «Оса» в районе Великие Новоселки, а также 32 района сосредоточения боевой техники ВСУ.\n\nСредствами противовоздушной обороны российских Воздушно-космических сил сбиты в воздухе один вертолет Ми-24 в районе Гуляй Поле и 4 украинских беспилотных летательных аппарата в районах Новомихайловка, Изюм и Харьков.\n\nВсего с начала проведения специальной военной операции уничтожены: 124 самолета и 82 вертолета, 357 беспилотных летательных аппаратов, 1854 танка и других боевых бронированных машин, 202 установки реактивных систем залпового огня, 777 орудий полевой артиллерии и минометов, а также 1722 единицы специальной военной автомобильной техники.",
    "url": "https://z.mil.ru/spec_mil_oper/brief/briefings/more.htm?id=12415699@egNews",
    "destroyed": {
      "САМОЛЕТЫ": 124,
      "ВЕРТОЛЕТЫ": 82,
      "БЕСПИЛОТНИКИ": 357,
      "ТАНКИ И БМ": 1854,
      "РСЗО": 202,
      "АРТИЛЛЕРИЯ И МИНОМЕТЫ": 777,
      "АВТОМОБИЛЬНАЯ ТЕХНИКА": 1722
    }
  },
  "02.04.2022": {
    "date": "02.04.2022",
    "message": "Подразделения Луганской Народной Республики развивая наступление на позиции украинской 57 мотопехотной бригады, блокируют с востока и юга населенный пункт Боровское. Уничтожено до 30 украинских националистов и пять единиц бронетехники.\n\nДнем 2 апреля высокоточными ракетами воздушного базирования в районах железнодорожных станций Лозовая и Павлоград уничтожены: бронетанковая техника, боеприпасы и цистерны с топливом, направляемые для усиления группировки украинских войск на Донбассе. Также выведен из строя военный аэродром Миргород в Полтавской области и уничтожены обнаруженные на его замаскированных стоянках несколько украинских боевых вертолетов и самолет, а также хранилища с топливом и авиационными средствами поражения.\n\nВ результате нанесенного в четверг, 31 марта, высокоточного удара оперативно-тактическим комплексом «Искандер» по штабу обороны в городе Харьков, подтверждено уничтожение более 100 националистов и наемников из западных стран. В течение дня оперативно-тактической авиацией ВКС России поражены 28 военных объектов Украины.\n\nСреди них: два склада ракетно-артиллерийского вооружения и боеприпасов, а также 23 района сосредоточения боевой техники ВСУ. Всего с начала проведения специальной военной операции уничтожены: 125 самолетов и 88 вертолетов, 381 беспилотный летательный аппарат, 1888 танков и других боевых бронированных машин, 205 установок реактивных систем залпового огня, 793 орудия полевой артиллерии и миномета, а также 1771 единица специальной военной автомобильной техники.",
    "url": "https://z.mil.ru/spec_mil_oper/brief/briefings/more.htm?id=12415827@egNews",
    "destroyed": {
      "САМОЛЕТЫ": 125,
      "ВЕРТОЛЕТЫ": 88,
      "БЕСПИЛОТНИКИ": 381,
      "ТАНКИ И БМ": 1888,
      "РСЗО": 205,
      "АРТИЛЛЕРИЯ И МИНОМЕТЫ": 793,
      "АВТОМОБИЛЬНАЯ ТЕХНИКА": 1771
    }
  },
  "03.04.2022": {
    "date": "03.04.2022",
    "message": "Подразделения войск Донецкой Народной Республики, продолжая наступление, ведут бои в районе Новобахмутовки и Троицкого.\n\nВ районе Новоселовки отступающие подразделения украинской 25-й воздушно-десантной бригады в результате артиллерийского удара понесли крупные потери. Уничтожено более 40 человек личного состава и 7 единиц бронетехники.\n\nВооруженные Силы Российской Федерации продолжали нанесение ударов по объектам военной инфраструктуры Украины.\n\nВысокоточными ракетами воздушного базирования уничтожены крупные топливные хранилища в Константиновке Николаевской области, Славуте Ровенской области и Тернополе. С данных объектов осуществлялись поставки топлива для группировок украинских войск на Николаевском и Донецком направлениях.\n\nВ результате удара по аэродрому Баловное, в пригороде Николаева, уничтожена стоянка авиационной техники и топливное хранилище.\n\nУдаром по военному аэродрому Васильков в Киевской области выведен из строя Центр оповещения и управления авиацией и противовоздушной обороной воздушных сил Украины.\n\nВ течение дня оперативно-тактической и армейской авиацией ВКС России поражено 42 военных объекта Украины.\n\nСреди них: три пусковые установки зенитных ракетных комплексов, в том числе одна «Бук-М1» и две «Оса-АКМ», одна артиллерийская батарея, две установки реактивных систем залпового огня, два полевых склада ракетно-артиллерийского вооружения и боеприпасов, а также 8 опорных пунктов и районов сосредоточения боевой техники ВСУ.\n\nРоссийскими средствами противовоздушной обороны сбиты в воздухе три беспилотных летательных аппарата в районах населенных пунктов Красногорка и Грабовское.\n\nВсего с начала проведения специальной военной операции уничтожены: 386 беспилотных летательных аппаратов, 224 зенитных ракетных комплексов, 1918 танков и других боевых бронированных машин, 209 установок реактивной системы залпового огня, 814 орудий полевой артиллерии и минометов, а также 1789 единиц специальной военной автомобильной техники.",
    "url": "https://z.mil.ru/spec_mil_oper/brief/briefings/more.htm?id=12415929@egNews",
    "destroyed": {
      "САМОЛЕТЫ": 125,
      "ВЕРТОЛЕТЫ": 88,
      "БЕСПИЛОТНИКИ": 386,
      "ЗЕНИТКИ": 224,
      "ТАНКИ И БМ": 1918,
      "РСЗО": 209,
      "АРТИЛЛЕРИЯ И МИНОМЕТЫ": 814,
      "АВТОМОБИЛЬНАЯ ТЕХНИКА": 1789
    }
  },
  "04.04.2022": {
    "date": "04.04.2022",
    "message": "Подразделения Народной милиции Луганской Республики, продолжая наступление, за день продвинулись на два километра и блокировали населенные пункты Новотошковское, Боровское и Метелкино.\n\nВооруженные Силы Российской Федерации продолжали нанесение ударов по объектам военной инфраструктуры Украины.\n\nВ течение дня оперативно-тактической авиацией ВКС России поражены 17 военных объектов Украины. Среди них: два командных пункта и узла связи, два склада боеприпасов и одно хранилище топлива, а также 11 опорных пунктов и районов сосредоточения украинских войск.\n\nРоссийскими средствами противовоздушной обороны сбиты в воздухе два беспилотных летательных аппарата в районе населенного пункта Северодонецк.\n\nВсего с начала проведения специальной военной операции уничтожены: 125 самолетов, 91 вертолет, 394 беспилотных летательных аппарата, 226 зенитных ракетных комплексов, 1948 танков и других боевых бронированных машин, 212 установок реактивных систем залпового огня, 838 орудий полевой артиллерии и минометов, а также 1842 единицы специальной военной автомобильной техники.",
    "url": "https://z.mil.ru/spec_mil_oper/brief/briefings/more.htm?id=12416039@egNews",
    "destroyed": {
      "САМОЛЕТЫ": 125,
      "ВЕРТОЛЕТЫ": 91,
      "БЕСПИЛОТНИКИ": 394,
      "ЗЕНИТКИ": 226,
      "ТАНКИ И БМ": 1948,
      "РСЗО": 212,
      "АРТИЛЛЕРИЯ И МИНОМЕТЫ": 838,
      "АВТОМОБИЛЬНАЯ ТЕХНИКА": 1842
    }
  },
  "05.04.2022": {
    "date": "05.04.2022",
    "message": "Группировка войск Луганской Народной Республики продолжает наступление на позиции украинской 24-й отдельной механизированной бригады и ведет бой на восточной окраине населенного пункта Новотошковское.\n\nНа Северодонецком направлении подразделения Луганской Народной Республики прорвали оборону 57-го мотопехотной бригады ВСУ, уничтожив до 50 человек личного состава и 9 единиц бронетехники, и ведут бой на северной окраине населенного пункта Замуловка.\n\nВооруженные Силы Российской Федерации продолжают нанесение ударов по объектам военной инфраструктуры Украины.\n\nВысокоточными ракетами воздушного базирования в районах населенных пунктов Золочев и Чугуев уничтожен командный пункт подразделения территориальной обороны, хранилище топлива и завод по ремонту бронетанковой техники.\n\nВ течение дня оперативно-тактической авиацией ВКС России и ракетными войсками поражены 33 военных объекта Украины.\n\nСреди них – восемь пунктов управления, три склада материально-технического обеспечения, а также 21 опорный пункт и районы сосредоточения боевой техники ВСУ.\n\nРоссийскими средствами противовоздушной обороны сбиты в воздухе 5 ударных украинских беспилотных летательных аппаратов.\n\nВсего с начала проведения специальной военной операции уничтожены: 125 самолетов, 93 вертолета, 403 беспилотных летательных аппарата, 1981 танк и другие боевые бронированные машины, 854 орудия полевой артиллерии и миномета, а также 1876 единиц специальной военной автомобильной техники.\n\nУтром 5 апреля в районе Мариуполя сорвана очередная попытка киевского режима эвакуировать главарей националистического батальона «Азов». Два украинских вертолета Ми-8, пытавшихся прорваться к городу со стороны моря, были сбиты из переносных зенитных ракетных комплексов.\n\nРанее мы неоднократно и по всем доступным каналам доводили киевскому режиму наши предложения о возможности выхода добровольно сложивших оружие подразделений украинских вооруженных сил из Мариуполя. Сегодня, в очередной раз, с 6 утра московского времени украинским военнослужащим предлагалось прекратить боевые действия, сложить оружие и выйти по согласованному маршруту на подконтрольную киевскому режиму территорию.\n\nОднако данные предложения киевским режимом постоянно игнорируются. С учетом незаинтересованности Киева в сохранении жизней своих военнослужащих, Мариуполь будет освобожден от националистов подразделениями российских вооруженных сил и Донецкой народной республики.",
    "url": "https://z.mil.ru/spec_mil_oper/brief/briefings/more.htm?id=12416197@egNews",
    "destroyed": {
      "САМОЛЕТЫ": 125,
      "ВЕРТОЛЕТЫ": 93,
      "БЕСПИЛОТНИКИ": 403,
      "ЗЕНИТКИ": 226,
      "ТАНКИ И БМ": 1981,
      "РСЗО": 214,
      "АРТИЛЛЕРИЯ И МИНОМЕТЫ": 854,
      "АВТОМОБИЛЬНАЯ ТЕХНИКА": 1876
    }
  },
  "06.04.2022": {
    "date": "06.04.2022",
    "message": "Вооруженные Силы Российской Федерации продолжают специальную военную операцию на Украине.\n\nВысокоточными ракетами наземного базирования в Донецкой области уничтожены: командный пункт украинской 56 отдельной мотопехотной бригады в районе населенного пункта Новогродовка, а также база националистов в населенном пункте Гродовка.\n\nВысокоточными ракетами воздушного базирования в Харьковской области уничтожена топливная база в районе населенного пункта Чугуев, с которой осуществлялись поставки горючего для техники украинских войск.\n\nКроме того, на железнодорожной станции Лозовая в Харьковской области уничтожено скопление военной техники и вооружения зарубежного производства, поставленного для снабжения украинских вооруженных сил.\n\nВ течение дня оперативно-тактической авиацией ВКС России поражены 34 военных объекта Украины.\n\nСреди них: артиллерийская батарея, два склада материально-технического обеспечения, а также 9 опорных пунктов и районов сосредоточения боевой техники украинских вооруженных сил.\n\nРоссийскими средствами противовоздушной обороны в районе Тарановка Харьковской области сбит в воздухе беспилотный летательный аппарат «Байрактар ТБ-2».\n\nВсего с начала проведения специальной военной операции уничтожены: 125 самолетов, 93 вертолета, 408 беспилотных летательных аппаратов, 227 зенитных ракетных комплексов, 1987 танков и других боевых бронированных машин, 216 установок реактивных систем залпового огня, 862 орудия полевой артиллерии и миномета, а также 1888 единиц специальной военной автомобильной техники.\n\nПо подтвержденной информации, в городе Первомайский Харьковской области украинскими спецслужбами готовится крупная провокация с использованием отравляющих веществ.\n\nНа территории производственного объединения «Химпром» сотрудниками СБУ заминировано хранилище со 120 тоннами хлора.\n\nДанное хранилище планируется взорвать для обвинения России в якобы создании химической катастрофы, повлекшей гибель местных жителей.",
    "url": "https://z.mil.ru/spec_mil_oper/brief/briefings/more.htm?id=12416348@egNews",
    "destroyed": {
      "САМОЛЕТЫ": 125,
      "ВЕРТОЛЕТЫ": 93,
      "БЕСПИЛОТНИКИ": 408,
      "ЗЕНИТКИ": 227,
      "ТАНКИ И БМ": 1987,
      "РСЗО": 216,
      "АРТИЛЛЕРИЯ И МИНОМЕТЫ": 862,
      "АВТОМОБИЛЬНАЯ ТЕХНИКА": 1888
    }
  },
  "07.04.2022": {
    "date": "07.04.2022",
    "message": "Группировка войск российских вооруженных сил, развивая наступление, полностью блокировала населенный пункт НОВОМИХАЙЛОВКА и приступила к его зачистке от националистов.\n\nПреследуя отходящие подразделения 54-ой механизированной бригады украинских войск, подразделения российских вооруженных сил также блокировали населенный пункт УГЛЕДАР и сейчас ведут бой за его освобождение от националистов.\n\nЗа день в данном районе уничтожено до усиленной мотопехотной роты и танковый взвод украинских войск.\n\nВооруженные Силы Российской Федерации продолжают нанесение ударов по объектам военной инфраструктуры Украины.\n\nВ течение дня высокоточными ракетами воздушного базирования нанесен удар по скоплению украинской военной техники на железнодорожной станции НОВОГРАД-ВОЛЫНСКИЙ Житомирской области. В результате удара уничтожены резервы, предназначенные для переброски группировке украинских войск на Донбассе.\n\nОперативно-тактической авиацией ВКС России поражено 42 военных объекта Украины.\n\nСреди них: пункт управления, два полевых склада боеприпасов, две установки реактивных систем залпового огня, а также 12 опорных пунктов и районов сосредоточения украинской боевой техники.\n\nРоссийскими средствами противовоздушной обороны сбиты в воздухе два украинских военных вертолета: Ми-8 и Ми-24 в районе города ХЕРСОН, а также три беспилотных летательных аппарата, в том числе два – «Байрактар ТБ-2» в районах населенных пунктов КРИВОЙ РОГ и ТРУДОВОЙ.\n\nВсего с начала проведения специальной военной операции уничтожены: 125 самолетов, 95 вертолетов, 416 беспилотных летательных аппаратов, 2003 танка и других боевых бронированных машин, 220 установок реактивных систем залпового огня, 869 орудий полевой артиллерии и минометов, а также 1902 единицы специальной военной автомобильной техники.",
    "url": "https://z.mil.ru/spec_mil_oper/brief/briefings/more.htm?id=12416490@egNews",
    "destroyed": {
      "САМОЛЕТЫ": 125,
      "ВЕРТОЛЕТЫ": 95,
      "БЕСПИЛОТНИКИ": 416,
      "ТАНКИ И БМ": 2003,
      "РСЗО": 220,
      "АРТИЛЛЕРИЯ И МИНОМЕТЫ": 869,
      "АВТОМОБИЛЬНАЯ ТЕХНИКА": 1902
    }
  },
  "08.04.2022": {
    "date": "08.04.2022",
    "message": "Вооруженные Силы Российской Федерации продолжают проведение специальной военной операции на Украине.\n\nВысокоточными ракетами воздушного базирования в Донецкой области на железнодорожных станциях Покровск, Славянск, Барвенково уничтожены вооружение и военная техника прибывших на Донбасс резервов украинских войск.\n\nВысокоточными ракетами берегового ракетного комплекса «Бастион» в районе населенного пункта Красноселка северо-восточнее Одессы уничтожен Центр сбора и подготовки иностранных наемников.\n\nРоссийскими средствами противовоздушной обороны сбиты в воздухе два украинских военных вертолета Ми-8 и Ми-24 в районе населенного пункта Старая Збурьевка, а также пять беспилотных летательных аппаратов, в том числе в районе Кривого Рога два «Байрактар ТБ-2».\n\nОперативно-тактической авиацией ВКС России и ракетными войсками поражен 81 военный объект Украины. Среди них: два пункта управления, пусковая установка ЗРК «Оса», три установки реактивных систем залпового огня, а также 9 опорных пунктов и 59 районов сосредоточения украинской боевой техники.\n\nВсего с начала проведения специальной военной операции уничтожены: 97 вертолетов, 421 беспилотный летательный аппарат, 228 зенитных ракетных систем большой и средней дальности, 2019 танков и других боевых бронированных машин, 223 установки реактивных систем залпового огня, 874 орудий полевой артиллерии и минометов, а также 1917 единиц специальной военной автомобильной техники.",
    "url": "https://z.mil.ru/spec_mil_oper/brief/briefings/more.htm?id=12416568@egNews",
    "destroyed": {
      "ВЕРТОЛЕТЫ": 97,
      "БЕСПИЛОТНИКИ": 421,
      "ЗЕНИТКИ": 228,
      "ТАНКИ И БМ": 2019,
      "РСЗО": 223,
      "АРТИЛЛЕРИЯ И МИНОМЕТЫ": 874,
      "АВТОМОБИЛЬНАЯ ТЕХНИКА": 1917
    }
  },
  "09.04.2022": {
    "date": "09.04.2022",
    "message": "Вооруженные Силы Российской Федерации продолжают проведение специальной военной операции на Украине.\n\nВ течение дня оперативно-тактической авиацией ВКС России и ракетными войсками поражены 65 военных объектов Украины.\n\nСреди них: четыре командных пункта и узла связи, три склада материально-технического обеспечения, а также 41 опорный пункт и районы сосредоточения украинской боевой техники.\n\nРоссийскими средствами противовоздушной обороны сбиты в воздухе три украинских беспилотных летательных аппарата: два – в районах населенных пунктов Мариуполь и Калининское, еще один, - «Байрактар ТБ-2» - в районе населенного пункта Сахновщина Харьковской области.\n\nВсего с начала проведения специальной военной операции уничтожены: 127 самолетов, 98 вертолетов, 428 беспилотных летательных аппаратов, 2037 танков и других боевых бронированных машин, 229 установок реактивных систем залпового огня, 886 орудий полевой артиллерии и минометов, а также 1941 единица специальной военной автомобильной техники.\n\nКиевский режим не оставляет попыток эвакуировать из Мариуполя главарей националистического полка «Азов» и иностранных наемников. Предыдущие акции вывоза их по воздуху вертолетами провалились.\n\nВечером 8 апреля киевским режимом была предпринята новая безуспешная попытка эвакуации главарей украинских нацистов по морю.\n\nВ темное время суток украинский сухогруз «Апачи», приписанный к мальтийскому порту Валетта, под мальтийским флагом следовал в караване судов из Таганрогского залива к Керченскому проливу.\n\nВ 22 часа 38 минут московского времени в 30 км юго-восточнее Мариуполя сухогруз резко изменил курс следования и попытался прорваться в блокированный с моря силами Черноморского флота морской порт «Мариуполь».\n\nНа требования российских пограничных кораблей выйти по международному каналу на связь, украинский сухогруз не отвечал, продолжая движение в направлении порта Мариуполь.\n\nПредупредительная артиллерийская стрельба, выполненная двумя пограничными сторожевыми кораблями по курсу движения судна, не привела к изменению курса и замедлению скорости движения сухогруза.\n\nВо время движения к порту Мариуполь судно вело радиообмен, передавая сообщения «Я «Маньяк», иду к тебе». При этом на берегу наблюдались сигнальные костры.\n\nДля блокирования движения судна-нарушителя с 22.53 до 23.30 кораблем Черноморского Флота и пограничными сторожевыми кораблями по сухогрузу «Апачи» открывался артиллерийский огонь.\n\nВ результате прямого попадания на судне произошло возгорание в кормовой части судна.\n\nПосле этого украинский сухогруз лег в дрейф, экипаж вышел на связь с пограничными кораблями с просьбой прекратить огонь и подтвердил готовность выполнять все требования российских моряков.\n\nВ результате огневого воздействия пострадавших среди членов экипажа на судне нет. Силами судовой команды возгорание потушено самостоятельно.\n\nПосле проведенного досмотра украинский сухогруз «Апачи» с экипажем конвоируется в порт Ейск.",
    "url": "https://z.mil.ru/spec_mil_oper/brief/briefings/more.htm?id=12416784@egNews",
    "destroyed": {
      "САМОЛЕТЫ": 127,
      "ВЕРТОЛЕТЫ": 98,
      "БЕСПИЛОТНИКИ": 428,
      "ТАНКИ И БМ": 2037,
      "РСЗО": 229,
      "АРТИЛЛЕРИЯ И МИНОМЕТЫ": 886,
      "АВТОМОБИЛЬНАЯ ТЕХНИКА": 1941
    }
  },
  "10.04.2022": {
    "date": "10.04.2022",
    "message": "Вооруженные Силы Российской Федерации продолжают проведение специальной военной операции на Украине.\n\nВ течение ночи в населенном пункте ЗВОНЕЦКОЕ Днепропетровской области высокоточными ракетами морского базирования уничтожены штаб и место базирования националистического батальона «Днепр», куда на днях прибыло пополнение из иностранных наемников.\n\nВысокоточными ракетами воздушного базирования в районе населенного пункта СТАРОБОГДАНОВКА Николаевской области и на военном аэродроме ЧУГУЕВ уничтожены выявленные разведкой пусковые установки украинских зенитных ракетных комплексов С-300.\n\nРоссийскими средствами противовоздушной обороны в районах населенных пунктов ОЛЬХОВАТОВКА, НОВАЯ АСТРАХАНЬ, АВДЕЕВКА, ШАХТЕРСКОЕ, КУРАХОВО, НОВОСЕЛОВКА ВТОРАЯ, ВЕСЕЛОЕ сбиты в воздухе восемь украинских беспилотных летательных аппаратов.\n\nОперативно-тактической авиацией ВКС России поражены 86 военных объектов Украины. Среди них: два пункта управления, два склада боеприпасов, три склада горючего, три установки реактивных систем залпового огня, а также 49 опорных пунктов и районов сосредоточения украинской боевой техники.\n\nВсего с начала проведения специальной военной операции уничтожены: 127 самолетов, 98 вертолетов, 234 зенитных ракетных комплекса С-300, «Бук-М1», «Оса АКМ», 436 беспилотных летательных аппаратов, 2052 танка и других боевых бронированных машин, 232 установки реактивных систем залпового огня, 894 орудия полевой артиллерии и миномета, а также 1975 единиц специальной военной автомобильной техники.",
    "url": "https://z.mil.ru/spec_mil_oper/brief/briefings/more.htm?id=12416844@egNews",
    "destroyed": {
      "САМОЛЕТЫ": 127,
      "ВЕРТОЛЕТЫ": 98,
      "БЕСПИЛОТНИКИ": 436,
      "ЗЕНИТКИ": 234,
      "ТАНКИ И БМ": 2052,
      "РСЗО": 232,
      "АРТИЛЛЕРИЯ И МИНОМЕТЫ": 894,
      "АВТОМОБИЛЬНАЯ ТЕХНИКА": 1975
    }
  },
  "11.04.2022": {
    "date": "11.04.2022",
    "message": "Вооруженные Силы Российской Федерации продолжают проведение специальной военной операции на Украине.\n\nДнем 11 апреля в районе населенного пункта Часов Яр Донецкой области авиационным ракетным комплексом «Кинжал» уничтожен заглубленный, хорошо защищенный командный пункт группировки украинских войск на Донбассе.\n\nВысокоточными ракетами воздушного базирования в районе населенного пункта Селидово Донецкой области уничтожены: украинская пусковая установка тактического ракетного комплекса «Точка-У», две установки реактивных систем залпового огня в подземном укрытии, два замаскированных скопления военной техники и вооружения и до 40 человек украинских националистов.\n\nВ районе населенного пункта Новогродовка Донецкой области уничтожен базовый лагерь нацистов террористической организации «Правый сектор».\n\nВ течение дня высокоточными ракетами наземного базирования в районах населенных пунктов Попасная, Новозвановка и Золотое Донецкой области уничтожены: командно-наблюдательный пункт батальона, три ротных опорных пункта, две ротные тактические группы украинской 24-й механизированной бригады и бригады территориальной обороны, а также два места скопления личного состава, вооружения и военной техники.\n\nВсего в результате ударов в данных районах уничтожено до 300 украинских боевиков, свыше 50 боевых бронированных машин и до 25 автомобилей различного назначения.\n\nРоссийскими средствами противовоздушной обороны в районе населенного пункта Синельниково Днепропетровской области сбит в воздухе истребитель Су-27 украинских воздушных сил.\n\nОперативно-тактической авиацией ВКС России поражены 42 военных объекта Украины.\n\nСреди них: три командных пункта, две радиолокационных станции подсвета и наведения, склад горючего, а также 35 опорных пунктов и районов сосредоточения украинской боевой техники.\n\nВсего с начала проведения специальной военной операции уничтожены: 130 самолетов, 99 вертолетов, 243 зенитных ракетных комплекса С-300, «Бук-М1», «Оса АКМ», 441 беспилотный летательный аппарат, 2132 танка и других боевых бронированных машин, 241 установка реактивных систем залпового огня, 913 орудий полевой артиллерии и минометов, а также 2028 единиц специальной военной автомобильной техники.",
    "url": "https://z.mil.ru/spec_mil_oper/brief/briefings/more.htm?id=12416980@egNews",
    "destroyed": {
      "САМОЛЕТЫ": 130,
      "ВЕРТОЛЕТЫ": 99,
      "БЕСПИЛОТНИКИ": 441,
      "ЗЕНИТКИ": 243,
      "ТАНКИ И БМ": 2132,
      "РСЗО": 241,
      "АРТИЛЛЕРИЯ И МИНОМЕТЫ": 913,
      "АВТОМОБИЛЬНАЯ ТЕХНИКА": 2028
    }
  },
  "12.04.2022": {
    "date": "12.04.2022",
    "message": "Вооруженные Силы Российской Федерации продолжают проведение специальной военной операции на Украине.\n\nВ районе населенного пункта Попасная Луганской области российскими артиллерийскими подразделениями нанесены огневые удары по шести опорным пунктам подразделений 24-й украинской отдельной механизированной бригады.\n\nВ результате ударов уничтожено более 120 человек личного состава соединения, одиннадцать единиц бронетехники и четырнадцать автомобилей различного назначения.\n\nОперативно-тактической авиацией ВКС России поражены 38 военных объектов Украины.\n\nСреди них: склад боеприпасов Тошковка в Луганской области, а также 8 районов сосредоточения украинской боевой техники в населенных пунктах Глазуновка, Пятигорское и Пришиб Харьковской области.\n\nРоссийскими средствами противовоздушной обороны сбиты в воздухе два беспилотных летательных аппарата над населенными пунктами Очаков и Николаев.\n\nВсего с начала проведения специальной военной операции уничтожены: 130 самолетов, 99 вертолетов, 244 зенитных ракетных комплекса, 445 беспилотных летательных аппаратов, 2153 танка и других боевых бронированных машин, 241 установка реактивных систем залпового огня, 924 орудия полевой артиллерии и миномета, а также 2063 единицы специальной военной автомобильной техники.",
    "url": "https://z.mil.ru/spec_mil_oper/brief/briefings/more.htm?id=12417105@egNews",
    "destroyed": {
      "САМОЛЕТЫ": 130,
      "ВЕРТОЛЕТЫ": 99,
      "БЕСПИЛОТНИКИ": 445,
      "ЗЕНИТКИ": 244,
      "ТАНКИ И БМ": 2153,
      "РСЗО": 241,
      "АРТИЛЛЕРИЯ И МИНОМЕТЫ": 924,
      "АВТОМОБИЛЬНАЯ ТЕХНИКА": 2063
    }
  },
  "13.04.2022": {
    "date": "13.04.2022",
    "message": "Вооруженные Силы Российской Федерации продолжают проведение специальной военной операции на Украине.\n\nВ городе Мариуполь полностью освобожден от боевиков нацистского формирования «Азов» морской торговый порт.\n\nВсе заложники, удерживавшиеся нацистами на судах в порту, в том числе иностранных, освобождены.\n\nОстатки находящихся в городе подразделений украинских войск и нацистов «Азова», блокированы и лишены возможности вырваться из окружения.\n\nВ течение дня высокоточным оружием уничтожены 36 объектов противника. Среди них:\n\nв населенных пунктах Врубовка и Берестовое две ремонтные базы и два склада ракетно-артиллерийского вооружения 57-й и 24-й механизированных бригад украинских войск;\n\nв районах Попасная и Барвенково пять опорных пунктов подразделений 24-й отдельной механизированной бригады;\n\nв населенном пункте Черкасское командный пункт 15-го отдельного полка нацгвардии Украины.\n\nТакже уничтожены штаб и хранилище топлива 128-й отдельной горной штурмовой бригады в районе Гуляй-Поле.\n\nОперативно-тактической авиацией поражены 10 военных объектов Украины. Среди них: пункт управления, три склада ракетно-артиллерийского вооружения, а также 6 районов сосредоточения украинской боевой техники.\n\nВсего с начала проведения специальной военной операции уничтожены: 130 самолетов, 103 вертолета, 244 зенитных ракетных комплекса, 447 беспилотных летательных аппаратов, 2173 танка и других боевых бронированных машин, 243 установки реактивных систем залпового огня, 937 орудий полевой артиллерии и миномета, а также 2082 единицы специальной военной автомобильной техники.\n\nВидим попытки диверсий и нанесения ударов украинскими войсками по объектам на территории Российской Федерации.\n\nЕсли такие случаи продолжатся, то Вооруженными Силами Российской Федерации будут нанесены удары по центрам принятия решений, в том числе в Киеве, от чего российская армия до сих пор воздерживалась.",
    "url": "https://z.mil.ru/spec_mil_oper/brief/briefings/more.htm?id=12417276@egNews",
    "destroyed": {
      "САМОЛЕТЫ": 130,
      "ВЕРТОЛЕТЫ": 103,
      "БЕСПИЛОТНИКИ": 447,
      "ЗЕНИТКИ": 244,
      "ТАНКИ И БМ": 2173,
      "РСЗО": 243,
      "АРТИЛЛЕРИЯ И МИНОМЕТЫ": 937,
      "АВТОМОБИЛЬНАЯ ТЕХНИКА": 2082
    }
  },
  "14.04.2022": {
    "date": "14.04.2022",
    "message": "Вооруженные Силы Российской Федерации продолжают проведение специальной военной операции на Украине.\n\nВ течение дня оперативно-тактической авиацией поражены 7 военных объектов Украины.\n\nСреди них: в районе Приволье склад ракетно-артиллерийского вооружения; в районах Великая Новоселка, Теминовка, Ивановка, Краматорск и Богородичное шесть районов скопления живой силы и бронетехники украинских 54-й отдельной механизированной и 128-й горной штурмовой бригад.\n\nРакетными войсками и артиллерией поражены 132 объекта, в том числе: 8 пунктов управления, 110 опорных пунктов и районов скопления живой силы, 4 артиллерийских батареи, склад боеприпасов.\n\nВсего с начала проведения специальной военной операции уничтожены: 131 самолет, 104 вертолета, 245 зенитных ракетных комплексов, 448 беспилотных летательных аппаратов, 2188 танков и других боевых бронированных машин, 248 установок реактивных систем залпового огня, 957 орудий полевой артиллерии и минометов, а также 2088 единиц специальной военной автомобильной техники.",
    "url": "https://z.mil.ru/spec_mil_oper/brief/briefings/more.htm?id=12417395@egNews",
    "destroyed": {
      "САМОЛЕТЫ": 131,
      "ВЕРТОЛЕТЫ": 104,
      "БЕСПИЛОТНИКИ": 448,
      "ЗЕНИТКИ": 245,
      "ТАНКИ И БМ": 2188,
      "РСЗО": 248,
      "АРТИЛЛЕРИЯ И МИНОМЕТЫ": 957,
      "АВТОМОБИЛЬНАЯ ТЕХНИКА": 2088
    }
  },
  "15.04.2022": {
    "date": "15.04.2022",
    "message": "Утром 15 апреля российскими Вооруженными Силами предотвращена попытка киевского националистического режима ракетным ударом нанести поражение Каховской ГЭС имени П.С. Непорожнего.\n\nДанный критически важный объект обеспечивает регулирование стока реки Днепр, питание электроэнергией Херсонской области, а также водоснабжение сельскохозяйственных районов юга Украины и северных районов Крыма.\n\nОколо 7 часов утра московского времени дивизионом украинской 19-й отдельной ракетной бригады по Каховской ГЭС был нанесен удар двумя тактическими ракетами «Точка-У».\n\nРазрушение ударом плотины Каховской ГЭС должно было привести к неконтролируемому сбросу днепровской воды и вызвать затопление многих населенных пунктов Херсонской области вместе с людьми, чтобы сковать действия российских Вооруженных Сил.\n\nОбе ракеты сбиты в воздухе российскими средствами ПВО. Осколки одной из них упали на населенный пункт Новая Каховка Херсонской области. Получили повреждения здания детского сада и жилые дома.\n\nРанения получили женщина и ребенок, которым на месте российскими военнослужащими была оказана первая медицинская помощь. В настоящее время они доставлены в лечебное учреждение.\n\nВооруженные Силы Российской Федерации продолжают специальную военную операцию на Украине.\n\nВ течение дня высокоточными ракетами воздушного базирования поражены 10 объектов противника.\n\nСреди них уничтожены:\n\nРакетными войсками и артиллерией нанесено поражение 217 военным объектам Украины, в том числе 15 пунктам управления подразделений украинских войск, а также 201 опорному пункту и району сосредоточения живой силы противника.\n\nОперативно-тактической авиацией в течение дня уничтожены шесть украинских военных объектов. Среди них: артиллерийская батарея, две установки реактивной системы залпового огня, два склада ракетно-артиллерийского вооружения и три района сосредоточения личного состава и украинской военной техники.\n\nРоссийскими средствами противовоздушной обороны в районе населенного пункта Октябрьский сбит украинский беспилотный летательный аппарат Ту-143 «Рейс».\n\nВсего с начала проведения специальной военной операции уничтожены: 132 самолета, 105 вертолетов, 245 зенитных ракетных комплексов, 457 беспилотных летательных аппаратов, 2224 танка и других боевых бронированных машин, 251 установка реактивных систем залпового огня, 971 орудие полевой артиллерии и миномет, а также 2123 единицы специальной военной автомобильной техники.",
    "url": "https://z.mil.ru/spec_mil_oper/brief/briefings/more.htm?id=12417556@egNews",
    "destroyed": {
      "САМОЛЕТЫ": 132,
      "ВЕРТОЛЕТЫ": 105,
      "БЕСПИЛОТНИКИ": 457,
      "ЗЕНИТКИ": 245,
      "ТАНКИ И БМ": 2224,
      "РСЗО": 251,
      "АРТИЛЛЕРИЯ И МИНОМЕТЫ": 971,
      "АВТОМОБИЛЬНАЯ ТЕХНИКА": 2123
    }
  },
  "17.04.2022": {
    "date": "17.04.2022",
    "message": "Вооруженные Силы Российской Федерации продолжают специальную военную операцию на Украине.\n\nВ течение дня высокоточными ракетами воздушного базирования в районе населенных пунктов БАРВЕНКОВО и ДОБРОПОЛЬЕ уничтожены хранилища горюче-смазочных материалов и боеприпасов.\n\nОперативно-тактической авиацией уничтожены 44 военных объектов Украины. Среди них: в районе АВДЕЕВКА два командных пункта и локатор подсвета и наведения целей зенитного ракетного комплекса С-300; в районах ЗАВГОРОДНЕЕ и ПРОТОПОПОВКА уничтожено три склада ракетно-артиллерийского вооружения;  в районах КРАСНЫЙ ЛИМАН, НОВОСЕЛОВКА, РУБЕЖНОЕ, УГЛЕДАР, ПОПАСНАЯ, ПРИШИБ и ГУСАРОВКА 23 места сосредоточения личного состава и украинской военной техники.\n\nРакетными войсками и артиллерией нанесено поражение 113-ти объектам, в том числе: четырем пунктам управления, четырем артиллерийским батареям, двум складам горюче-смазочных материалов и 103-м опорным пунктам и районам сосредоточения живой силы противника.\n\nРоссийскими средствами противовоздушной обороны в районе населенных пунктов ФЕДОРОВКА и ЗАВОДЫ в Харьковской области сбиты в воздухе два украинских самолета МиГ-29; в районе населенного пункта ПРЕОБРАЖЕНСКОЕ Павлоградской области сбит украинский беспилотный летательный аппарат.\n\nВсего с начала проведения специальной военной операции уничтожены: 136 самолетов, 471 беспилотный летательный аппарат, 249 зенитных ракетных комплексов, 2308 танков и других боевых бронированных машин, 254 установки реактивных систем залпового огня, 998 орудий полевой артиллерии и минометов, а также 2171 единица специальной военной автомобильной техники.",
    "url": "https://z.mil.ru/spec_mil_oper/brief/briefings/more.htm?id=12417788@egNews",
    "destroyed": {
      "САМОЛЕТЫ": 136,
      "БЕСПИЛОТНИКИ": 471,
      "ЗЕНИТКИ": 249,
      "ТАНКИ И БМ": 2308,
      "РСЗО": 254,
      "АРТИЛЛЕРИЯ И МИНОМЕТЫ": 998,
      "АВТОМОБИЛЬНАЯ ТЕХНИКА": 2171
    }
  },
  "18.04.2022": {
    "date": "18.04.2022",
    "message": "Вооруженные Силы Российской Федерации продолжают специальную военную операцию на Украине.\n\nУтром 18 апреля высокоточными ракетами воздушного базирования ВКС России в районе Львова нанесен удар по 124-му объединенному центру обеспечения тыла командования сил логистики украинских войск. Уничтожен логистический центр и находившиеся в нем крупные партии иностранного вооружения, поступившие за последние 6 дней на Украину от США и европейских стран.\n\nКроме того, в районе населенного пункта Васильков Киевской области уничтожен крупный склад боеприпасов.\n\nВ течение дня высокоточными ракетами воздушного базирования воздушно-космических сил России уничтожены 16 военных объектов Украины.\n\nСреди них: два пункта управления, два опорных пункта подразделений украинских войск, а также места сосредоточения личного состава и военной техники противника в районах населенных пунктов Попасная, Барвенково и Красный Лиман.\n\nОперативно-тактической авиацией ВКС России нанесены удары по 84-м военным объектам Украины.\n\nУничтожены:\n\nТакже поражены 47 районов сосредоточения живой силы противника с военной техникой и 22 огневые позиции артиллерии украинских войск.\n\nРакетными войсками и артиллерией нанесены удары по 331-му военному объекту. Поражены девять пунктов управления, склад ракетно-артиллерийского вооружения, а также 315 районов сосредоточения живой силы противника в районах населенных пунктов Попасная и Новомайорское.\n\nВ результате удара в районе населенного пункта Новотошковская уничтожено до 120 националистов и 9 единиц военной техники.\n\nВсего с начала проведения специальной военной операции уничтожены: 139 самолетов, 483 беспилотных летательных аппарата, 250 зенитных ракетных комплексов, 2337 танков и других боевых бронированных машин, 254 установки реактивных систем залпового огня, 1009 орудий полевой артиллерии и минометов, а также 2196 единиц специальной военной автомобильной техники.",
    "url": "https://z.mil.ru/spec_mil_oper/brief/briefings/more.htm?id=12417905@egNews",
    "destroyed": {
      "САМОЛЕТЫ": 139,
      "БЕСПИЛОТНИКИ": 483,
      "ЗЕНИТКИ": 250,
      "ТАНКИ И БМ": 2337,
      "РСЗО": 254,
      "АРТИЛЛЕРИЯ И МИНОМЕТЫ": 1009,
      "АВТОМОБИЛЬНАЯ ТЕХНИКА": 2196
    }
  },
  "19.04.2022": {
    "date": "19.04.2022",
    "message": "Вооруженные Силы Российской Федерации продолжают специальную военную операцию на Украине.\n\nВ результате удара высокоточными ракетами воздушного базирования поражены два опорных пункта в районе Калиново-Попасное и шесть районов сосредоточения живой силы и военной техники противника в районах Мирное, Славянск и Попасное.\n\nУничтожено до 180 человек личного состава и 15 единиц бронетехники.\n\nТакже в районе населенного пункта Барвенково уничтожена пусковая установка зенитного ракетного комплекса «Бук-М1».\n\nОперативно-тактической авиацией ВКС России поражен 31 военный объект Украины.\n\nСреди них уничтожены: в районах населенных пунктов Раздольное и Новогродовка два пункта управления и 28 мест скопления живой силы и украинской военной техники, а также склад боеприпасов для реактивных систем залпового огня в районе Приволье.\n\nРоссийскими средствами противовоздушной обороны над населенными пунктами Чернобаевка, Зализное и Покровское сбиты три украинских беспилотных летательных аппарата.\n\nРакетными войсками в течение дня поражены два пункта управления подразделений украинских войск, склад боеприпасов, артиллерийская батарея, а также скопление украинской военной техники.\n\nВсего с начала проведения специальной военной операции уничтожены: 140 самолетов, 490 беспилотных летательных аппаратов, 253 зенитных ракетных комплекса, 2367 танков и других боевых бронированных машин, 256 установок реактивных систем залпового огня, 1021 орудие полевой артиллерии и миномет, а также 2225 единиц специальной военной автомобильной техники.",
    "url": "https://z.mil.ru/spec_mil_oper/brief/briefings/more.htm?id=12418046@egNews",
    "destroyed": {
      "САМОЛЕТЫ": 140,
      "БЕСПИЛОТНИКИ": 490,
      "ЗЕНИТКИ": 253,
      "ТАНКИ И БМ": 2367,
      "РСЗО": 256,
      "АРТИЛЛЕРИЯ И МИНОМЕТЫ": 1021,
      "АВТОМОБИЛЬНАЯ ТЕХНИКА": 2225
    }
  },
  "20.04.2022": {
    "date": "20.04.2022",
    "message": "Вооруженные Силы Российской Федерации продолжают специальную военную операцию на Украине.\n\nВысокоточными ракетами воздушного базирования ВКС России нанесены удары по 12 украинским военным объектам. Поражены два пункта управления украинских войск в населенных пунктах Гусаровка и Андреевка, три района сосредоточения живой силы и украинской военной техники в Архангеловке, Краматорске и Селидово, а также шесть опорных пунктов формирований националистов в районе Попасной.\n\nВ результате ударов уничтожены: более 150 националистов, 5 установок реактивной системы залпового огня и восемь единиц бронетехники. Также, в районе населенного пункта Языково уничтожен зенитный ракетный комплекс «Оса-АКМ».\n\nОперативно-тактической и армейской авиацией ВКС России в течение дня поражены 73 военных объекта Украины. Среди них: два склада ракетно-артиллерийского вооружения и боеприпасов в районах населенных пунктов Шевченко и Комар Донецкой Народной Республики.\n\nРакетными войсками в течение дня нанесены удары по 4-м пунктам управления, складу боеприпасов и местам сосредоточения живой силы противника в районах Новая Дмитровка, Высокий.\n\nРоссийскими средствами противовоздушной обороны в районе населенного пункта Коровий Яр сбит украинский вертолет Ми-8. Также над населенными пунктами Изюм и Новобогдановка сбиты два украинских беспилотных летательных аппарата.\n\nВсего с начала проведения специальной военной операции уничтожены: 140 самолетов, 106 вертолетов, 498 беспилотных летательных аппаратов, 254 зенитных ракетных комплекса, 2397 танков и других боевых бронированных машин, 261 установка реактивных систем залпового огня, 1038 орудий полевой артиллерии и минометов, а также 2244 единицы специальной военной автомобильной техники.",
    "url": "https://z.mil.ru/spec_mil_oper/brief/briefings/more.htm?id=12418183@egNews",
    "destroyed": {
      "САМОЛЕТЫ": 140,
      "БЕСПИЛОТНИКИ": 498,
      "ЗЕНИТКИ": 254,
      "ТАНКИ И БМ": 2397,
      "РСЗО": 261,
      "АРТИЛЛЕРИЯ И МИНОМЕТЫ": 1038,
      "АВТОМОБИЛЬНАЯ ТЕХНИКА": 2244,
      "ВЕРТОЛЕТЫ": 106
    }
  },
  "21.04.2022": {
    "date": "21.04.2022",
    "message": "Вооруженные Силы Российской Федерации продолжают специальную военную операцию на Украине.\n\nВ течение дня высокоточными ракетами воздушного базирования нанесены удары по 14 объектам ВСУ.\n\nВ результате ударов в районе населенного пункта Попасная поражены: пункт управления, два склада боеприпасов, два района сосредоточения живой силы и украинской военной техники, а также два опорных пункта националистов.\n\nВ населенных пунктах Шнурки и Славянск уничтожены склады боеприпасов, а также нанесено поражение живой силе и технике ВСУ в районах Черкасское и Александровка.\n\nУничтожено до 120 националистов, а также более 30 единиц бронетехники и автомобилей.\n\nОперативно-тактической авиацией ВКС России в течение дня поражены 64 военных объекта Украины. Среди них: 17 районов сосредоточения живой силы и украинской военной техники в районах Красный Лиман и Дробышево, а также два склада ракетно-артиллерийского вооружения в районе города Запорожье.\n\nРакетными войсками и артиллерией в течение дня поражено 450 объектов противника. В том числе: 14 пунктов управления, а также 429 опорных пунктов и мест скопления живой силы и техники в населенных пунктах Великая Камышеваха, Червоное, Пашково, Новая Дмитровка Харьковской области.\n\nРоссийскими средствами противовоздушной обороны в районе населенного пункта Ясное Донецкой Народной Республики уничтожен украинский беспилотный летательный аппарат.\n\nВсего с начала проведения специальной военной операции уничтожены: 140 самолетов, 106 вертолетов, 512 беспилотных летательных аппаратов, 254 зенитных ракетных комплекса, 2422 танка и других боевых бронированных машин, 266 установки реактивных систем залпового огня, 1051 орудие полевой артиллерии и миномет, а также 2274 единицы специальной военной автомобильной техники.",
    "url": "https://z.mil.ru/spec_mil_oper/brief/briefings/more.htm?id=12418309@egNews",
    "destroyed": {
      "САМОЛЕТЫ": 140,
      "ВЕРТОЛЕТЫ": 106,
      "БЕСПИЛОТНИКИ": 512,
      "ЗЕНИТКИ": 254,
      "ТАНКИ И БМ": 2422,
      "РСЗО": 266,
      "АРТИЛЛЕРИЯ И МИНОМЕТЫ": 1051,
      "АВТОМОБИЛЬНАЯ ТЕХНИКА": 2274
    }
  },
  "22.04.2022": {
    "date": "22.04.2022",
    "message": "Вооруженные Силы Российской Федерации продолжают специальную военную операцию на Украине.\n\nВ течение дня высокоточными ракетами воздушного базирования ВКС России поражены 13 военных объектов Украины. В том числе два пункта управления, 11 опорных пунктов и мест сосредоточения живой силы и украинской военной техники.\n\nВ результате ударов уничтожено до двух рот националистов, а также 27 единиц украинской бронетехники и автомобилей. Кроме того, в населенном пункте Червонное уничтожен склад ракет для зенитных ракетных комплексов «Оса-АКМ».\n\nОперативно-тактической и армейской авиацией ВКС России поражены 26 военных объектов Украины. Среди них: два командных пункта и 21 район сосредоточения живой силы и военной техники. В районах населенных пунктов Торецкий, Комар и Богатырь уничтожены три склада ракетно-артиллерийского вооружения.\n\nРакетными войсками в течение дня поражены: пункт управления, пять районов сосредоточения живой силы и военной техники, а также артиллерийская батарея. В районе населенного пункта Барвенково уничтожены на полевом аэродроме: украинский вертолет Ми-8, зенитный ракетный комплекс «Бук-М1», а также станция радиоэлектронной борьбы.\n\nРоссийскими средствами противовоздушной обороны уничтожены три украинских беспилотных летательных аппарата в районах населенных пунктов Большие Проходы, Шуровка Харьковской области и Спартак Донецкой Народной Республики.\n\nВсего с начала проведения специальной военной операции уничтожены: 140 самолетов, 107 вертолетов, 523 беспилотных летательных аппарата, 258 зенитных ракетных комплексов, 2458 танков и других боевых бронированных машин, 272 установки реактивных систем залпового огня, 1069 орудий полевой артиллерии и минометов, а также 2305 единиц специальной военной автомобильной техники.\n\nВ Мариуполе обстановка нормализовалась. Жители города получили возможность свободно передвигаться по улицам, не прячась от обстрелов украинских нацистов.\n\nДоставляется гуманитарная помощь: продукты, вода и предметы первой необходимости. Властями Донецкой народной республики организуется расчистка улиц от завалов и вывоз пораженной украинской военной техники.\n\nВсе остатки украинских нацистов «Азова» вместе с иностранными наемниками из США и европейских стран надёжно заблокированы на территории комбината «Азовсталь».\n\nНаши требования освободить якобы находящихся с ними женщин и детей для свободного выезда в любом направлении, нацисты игнорируют.\n\nПорядок выхода гражданских лиц, если они там есть, с территории «Азовстали» для последующей эвакуации доводится нацистам ежечасно. Данная информация также доводится и представителям киевского режима через вице-премьера Верещук.\n\nУдержание нацистами «Азова» и иностранными наёмниками заложников из числа гражданских лиц, если они там есть, доказывает, что они не «защитники», а конченые террористы.\n\nВ этой связи натужные попытки спикера Госдепартамента США привычно врать о якобы сохранении нацистским отребьем контроля над Мариуполем – фейк и прямое пособничество террористам на высоком государственном уровне.\n\nГосдеп привычно дезинформирует своих собственных граждан, да и всех остальных.\n\nСама же Украина, её жители в Мариуполе и других городах, Вашингтон интересуют только в разрезе прибылей от поставок туда оружия и борьбы с Россией хоть «до последнего украинца», как с подачи Госдепа повторяют и все его сателлиты.",
    "url": "https://z.mil.ru/spec_mil_oper/brief/briefings/more.htm?id=12418478@egNews",
    "destroyed": {
      "САМОЛЕТЫ": 140,
      "ВЕРТОЛЕТЫ": 107,
      "БЕСПИЛОТНИКИ": 523,
      "ЗЕНИТКИ": 258,
      "ТАНКИ И БМ": 2458,
      "РСЗО": 272,
      "АРТИЛЛЕРИЯ И МИНОМЕТЫ": 1069,
      "АВТОМОБИЛЬНАЯ ТЕХНИКА": 2305
    }
  },
  "23.04.2022": {
    "date": "23.04.2022",
    "message": "Вооруженные Силы Российской Федерации продолжают специальную военную операцию на Украине. Сегодня днем высокоточными ракетами большой дальности воздушного базирования ВКС России выведен из строя логистический терминал на военном аэродроме в районе Одессы, на котором хранилась крупная партия поступившего от США и европейских стран иностранного вооружения.\n\nВ течение дня высокоточными ракетами воздушного базирования ВКС России поражены 22 военных объекта Украины. В том числе: два командно-наблюдательных пункта батальона и один пункт управления бригады, 11 опорных пунктов, а также мест сосредоточения живой силы и военной техники ВСУ. Потери националистов составили до 200 человек личного состава и более 30 единиц бронетехники и автомобилей.\n\nВ районах Ильичевка и Краматорск уничтожены три склада вооружения, военной техники и боеприпасов. В районе населенного пункта Новая Дмитровка в результате удара уничтожен зенитный ракетный комплекс «Бук М1» и три радиолокационные станции.\n\nВ течение дня оперативно-тактической и армейской авиацией ВКС России поражены 79 военных объектов Украины. Среди них: шесть командных пунктов, 52 района сосредоточения живой силы и украинской военной техники, а также 16 складов ракетно-артиллерийского вооружения, боеприпасов и горючего. Уничтожены четыре зенитных ракетных комплексов: три «Бук-М1» в районе населенных пунктов Кураховка и Романовка, а также один зенитный ракетный комплекс «Тор» в районе Сергеевки.\n\nРоссийскими средствами противовоздушной обороны в районах населенных пунктов Изюм и Херсон уничтожены три украинских беспилотных летательных аппарата, в том числе один «Байрактар ТБ-2» над населенным пунктом Лозовая Харьковской области. Ракетными войсками и артиллерией в течение дня выполнены 102 огневые задачи. Уничтожены: 6 пунктов управления, 84 опорных пунктов и районов скопления живой силы и военной техники, а также 10 артиллерийских батарей.\n\nВсего с начала проведения специальной военной операции уничтожены: 141 самолет, 110 вертолетов, 541 беспилотный летательный аппарат, 264 зенитных ракетных комплекса, 2479 танков и других боевых бронированных машин, 278 установки реактивных систем залпового огня, 1081 орудие полевой артиллерии и миномет, а также 2321 единиц специальной военной автомобильной техники.",
    "url": "https://z.mil.ru/spec_mil_oper/brief/briefings/more.htm?id=12418580@egNews",
    "destroyed": {
      "САМОЛЕТЫ": 141,
      "ВЕРТОЛЕТЫ": 110,
      "БЕСПИЛОТНИКИ": 541,
      "ЗЕНИТКИ": 264,
      "ТАНКИ И БМ": 2479,
      "РСЗО": 278,
      "АРТИЛЛЕРИЯ И МИНОМЕТЫ": 1081,
      "АВТОМОБИЛЬНАЯ ТЕХНИКА": 2321
    }
  },
  "24.04.2022": {
    "date": "24.04.2022",
    "message": "Вооруженные Силы Российской Федерации продолжают специальную военную операцию на Украине.\n\nВысокоточными ракетами наземного базирования в районе Павлограда уничтожены цеха предприятия по производству взрывчатых веществ и порохов для украинских вооруженных сил.\n\nВысокоточными ракетами воздушного базирования ВКС России поражены девять военных объектов Украины.\n\nВ том числе один пункт управления бригады ВСУ, четыре опорных пункта и мест сосредоточения живой силы и военной техники, а также четыре склада ракетно-артиллерийского вооружения в районах Барвенково, Новая Дмитровка и Ивановка Харьковской области.\n\nОперативно-тактической и армейской авиацией ВКС России поражены 26 военных объектов Украины. Среди них уничтожены: командно-наблюдательный пункт батальона, а также 25 районов сосредоточения живой силы и украинской военной техники. Уничтожено до 150 националистов и до 40 единиц бронетехники и автомобилей.\n\nРакетными войсками и артиллерией в ночное время выполнено 423 огневые задачи. В результате ударов поражены: 26 пунктов управления, 367 опорных пунктов и районов скопления живой силы и военной техники, а также 25 позиций артиллерийских батарей. Уничтожены 4 склада ракетно-артиллерийского вооружения и боеприпасов в районах Гусаровка и Великая Камышеваха.\n\nРоссийскими средствами противовоздушной обороны в районах населенных пунктов Барвинок, Васильевка, Красногоровка, Кременная, Новый Первомайск, Полтавка, Томарино, Федоровка, Ясиноватое уничтожены 10 украинских беспилотных летательных аппаратов.\n\nВсего с начала проведения специальной военной операции уничтожены: 141 самолет, 110 вертолетов, 551 беспилотный летательный аппарат, 264 зенитных ракетных комплекса, 2496 танков и других боевых бронированных машин, 282 установки реактивных систем залпового огня, 1093 орудия полевой артиллерии и миномета, а также 2343 единицы специальной военной автомобильной техники.",
    "url": "https://z.mil.ru/spec_mil_oper/brief/briefings/more.htm?id=12418626@egNews",
    "destroyed": {
      "САМОЛЕТЫ": 141,
      "ВЕРТОЛЕТЫ": 110,
      "БЕСПИЛОТНИКИ": 551,
      "ЗЕНИТКИ": 264,
      "ТАНКИ И БМ": 2496,
      "РСЗО": 282,
      "АРТИЛЛЕРИЯ И МИНОМЕТЫ": 1093,
      "АВТОМОБИЛЬНАЯ ТЕХНИКА": 2343
    }
  },
  "25.04.2022": {
    "date": "25.04.2022",
    "message": "Вооруженные Силы Российской Федерации продолжают специальную военную операцию на Украине.\n\nВысокоточным оружием большой дальности уничтожены шесть тяговых подстанций в районах железнодорожных станций КРАСНОЕ, ЗДОЛБУНОВ, ЖМЕРИНКА, БЕРДИЧЕВ, КОВЕЛЬ и КОРОСТЕНЬ, через которые осуществляется поставка иностранного вооружения и военной техники украинской группировки войск на Донбассе.\n\nВ течение дня высокоточными ракетами воздушного базирования поражены 27 военных объектов Украины.\n\nВ том числе уничтожены: четыре пункта управления, склад боеприпасов в районе СЛАВЯНСКА Донецкой Народной Республики, штаб террористической группировки «Правый сектор» в НОВОГРОДОВКЕ, а также 16 опорных пунктов и мест сосредоточения живой силы и военной техники.\n\nОперативно-тактической и армейской авиацией ВКС России в течение дня поражены 82 военных объекта Украины.\n\nСреди них: 4 командных пункта, 76 районов сосредоточения живой силы и военной техники противника, а также два склада горючего.\n\nРакетными войсками нанесено 15 ударов.\n\nПоражены: стартовая позиция тактического ракетного комплекса «Точка-У», три пункта управления, артиллерийская батарея и 10 районов сосредоточения живой силы и военной техники.\n\nУничтожено до 40 человек личного состава и 17 единиц бронетехники и автомобилей ВСУ.\n\nРоссийскими средствами противовоздушной обороны за день сбиты четыре украинских беспилотных летательных аппарата в районах населенных пунктов ИЗЮМ, ДОНЕЦК и ХАРЬКОВ.\n\nВсего с начала проведения специальной военной операции уничтожены: 141 самолет, 110 вертолетов, 570 беспилотных летательных аппаратов, 265 зенитных ракетных комплексов, 2554 танка и других боевых бронированных машин, 283 установки реактивных систем залпового огня, 1104 орудия полевой артиллерии и миномета, а также 2380 единиц специальной военной автомобильной техники.",
    "url": "https://z.mil.ru/spec_mil_oper/brief/briefings/more.htm?id=12418795@egNews",
    "destroyed": {
      "САМОЛЕТЫ": 141,
      "ВЕРТОЛЕТЫ": 110,
      "БЕСПИЛОТНИКИ": 570,
      "ЗЕНИТКИ": 265,
      "ТАНКИ И БМ": 2554,
      "РСЗО": 283,
      "АРТИЛЛЕРИЯ И МИНОМЕТЫ": 1104,
      "АВТОМОБИЛЬНАЯ ТЕХНИКА": 2380
    }
  },
  "26.04.2022": {
    "date": "26.04.2022",
    "message": "Вооруженные Силы Российской Федерации продолжают специальную военную операцию на Украине.\n\nВ течение дня высокоточными ракетами воздушного базирования ВКС России поражены 32 военных объекта Украины. Среди них: 20 районов сосредоточения живой силы и украинской военной техники, четыре склада ракетно-артиллерийского вооружения в районах Славянска и Дружковка Донецкой Народной Республики, командно-наблюдательный пункт 105-го батальона территориальной обороны, а также две артиллерийские батареи.\n\nОперативно-тактической и армейской авиацией ВКС России поражены 33 военных объекта Украины, в том числе 23 района сосредоточения живой силы и военной техники противника. В результате ударов уничтожены до 200 националистов и более 40 единиц бронетехники, артиллерийских орудий и автомобилей.\n\nТакже уничтожен зенитный ракетный комплекс «Бук-М1» в районе Славянска и три склада боеприпасов и горючего в районах населенных пунктов Вольное Поле и Червонное.\n\nРакетными войсками и артиллерией в течение дня выполнены 100 огневых задач. Поражены: 5 пунктов управления украинских войск, 81 район сосредоточения живой силы противника и военной техники, а также 8 артиллерийских батарей.\n\nУничтожены две установки реактивной системы залпового огня в районе населенного пункта Березовка, а также зенитный ракетный комплекс «Бук-М1» в районе населенного пункта Комар.\n\nРоссийскими средствами противовоздушной обороны сбиты 6 украинских беспилотных летательных аппаратов в районах населенных пунктов Бражковка, Колесниковка, Комиссаровка, Козинка, Лозовая и Ленина.\n\nВсего с начала проведения специальной военной операции уничтожены: 141 самолет, 110 вертолетов, 589 беспилотных летательных аппаратов, 272 зенитных ракетных комплекса, 2588 танков и других боевых бронированных машин, 292 установки реактивных систем залпового огня, 1124 орудий полевой артиллерии и минометов, а также 2403 единицы специальной военной автомобильной техники.",
    "url": "https://z.mil.ru/spec_mil_oper/brief/briefings/more.htm?id=12418919@egNews",
    "destroyed": {
      "САМОЛЕТЫ": 141,
      "ВЕРТОЛЕТЫ": 110,
      "БЕСПИЛОТНИКИ": 589,
      "ЗЕНИТКИ": 272,
      "ТАНКИ И БМ": 2588,
      "РСЗО": 292,
      "АРТИЛЛЕРИЯ И МИНОМЕТЫ": 1124,
      "АВТОМОБИЛЬНАЯ ТЕХНИКА": 2403
    }
  },
  "27.04.2022": {
    "date": "27.04.2022",
    "message": "Вооруженные Силы Российской Федерации продолжают специальную военную операцию на Украине.\n\nВысокоточными ракетами воздушного базирования ВКС России нанесено поражение 17 военным объектам Украины. Среди них уничтожены: два командных пункта подразделений украинских войск, а также 15 районов сосредоточения живой силы и военной техники.\n \nОперативно-тактической и армейской авиацией ВКС России поражены 38 военных объектов Украины. Среди них: семь пунктов управления, два зенитных ракетных комплекса, один С-300 в районе Николаевки и один «Оса АКМ» в районе Великая Камышеваха, два укрепрайона, а также 27 мест сосредоточения живой силы и украинской военной техники. Уничтожены свыше 210 националистов и 43 единицы бронетехники и автомобилей.\n\nПодразделениями артиллерии в течение дня выполнены 309 огневых задач. Поражены: 14 пунктов управления, 292 района сосредоточения живой силы и военной техники ВСУ, а также три склада боеприпасов в районах Червоное и Ильичевка Харьковской области.\n \nРоссийскими средствами противовоздушной обороны в районе Черкасская Лозовая Харьковской области сбит вертолет Ми-24 украинских воздушных сил. Также в районах населенных пунктов Пески-Радьковские и Борщевка уничтожены два украинских беспилотных летательных аппарата.\n \nВсего с начала проведения специальной военной операции уничтожены: 141 самолет, 111 вертолетов, 609 беспилотных летательных аппаратов, 275 зенитных ракетных комплексов, 2616 танков и других боевых бронированных машин, 297 установок реактивных систем залпового огня, 1139 орудий полевой артиллерии и минометов, а также 2426 единиц специальной военной автомобильной техники.",
    "url": "https://z.mil.ru/spec_mil_oper/brief/briefings/more.htm?id=12419082@egNews",
    "destroyed": {
      "САМОЛЕТЫ": 141,
      "ВЕРТОЛЕТЫ": 111,
      "БЕСПИЛОТНИКИ": 609,
      "ЗЕНИТКИ": 275,
      "ТАНКИ И БМ": 2616,
      "РСЗО": 297,
      "АРТИЛЛЕРИЯ И МИНОМЕТЫ": 1139,
      "АВТОМОБИЛЬНАЯ ТЕХНИКА": 2426
    }
  },
  "28.04.2022": {
    "date": "28.04.2022",
    "message": "Вооруженные Силы Российской Федерации продолжают специальную военную операцию на Украине.\n\nВысокоточными ракетами воздушного базирования ВКС России нанесено поражение 38 военным объектам Украины.\n\nУничтожены три пункта управления, 22 опорных пункта формирований украинских националистов, семь районов сосредоточения живой силы и военной техники, а также шесть складов ракетно-артиллерийского вооружения, боеприпасов и горючего в районах населенных пунктов Александровка, Гусаровка, Долгенькое и Барвенково.\n\nОперативно-тактической и армейской авиацией ВКС России поражены 76 военных объектов Украины. Среди них: два склада ракетно-артиллерийского вооружения в населенных пунктах Покровское и Гороховское, командный пункт, а также 73 района сосредоточения живой силы и украинской военной техники. В результате ударов уничтожены свыше 320 человек личного состава и 35 единиц бронетехники и автомобилей.\n\nРакетными войсками в течение дня уничтожена украинская пусковая установка тактического ракетного комплекса «Точка-У», нанесено поражение двум районам сосредоточения живой силы и военной техники.\n\nРоссийскими средствами противовоздушной обороны над населенным пунктами Букино, Топольское, Русские Тишки Харьковской области, Редкодуб и Марьевка Донецкой Народной Республики, Наугольное Луганской Народной Республики и Чернобаевка Херсонской области уничтожены семь украинских беспилотных летательных аппаратов. Также в течение дня в районах населенных пунктов Петрополье и Малая Камышеваха сбиты три украинские баллистические ракеты «Точка-У».\n\nВсего с начала проведения специальной военной операции уничтожены: 142 самолета, 111 вертолетов, 621 беспилотный летательный аппарат, 277 зенитных ракетных комплексов, 2629 танков и других боевых бронированных машин, 302 установки реактивных систем залпового огня, 1154 орудия полевой артиллерии и миномета, а также 2445 единиц специальной военной автомобильной техники.",
    "url": "https://z.mil.ru/spec_mil_oper/brief/briefings/more.htm?id=12419235@egNews",
    "destroyed": {
      "САМОЛЕТЫ": 142,
      "ВЕРТОЛЕТЫ": 111,
      "БЕСПИЛОТНИКИ": 621,
      "ЗЕНИТКИ": 277,
      "ТАНКИ И БМ": 2629,
      "РСЗО": 302,
      "АРТИЛЛЕРИЯ И МИНОМЕТЫ": 1154,
      "АВТОМОБИЛЬНАЯ ТЕХНИКА": 2445
    }
  },
  "29.04.2022": {
    "date": "29.04.2022",
    "message": "Вооруженные Силы Российской Федерации продолжают специальную военную операцию на Украине.\n\nВысокоточными ракетами воздушного базирования в течение дня нанесено поражение 38 военным объектам Украины. Среди них: 20 взводных опорных пунктов, 11 районов сосредоточения живой силы и военной техники, склад горючего в районе населенного пункта Вольное Поле, радиолокационная станция в районе Печенеги.\n\nОперативно-тактической и армейской авиацией ВКС России поражены 22 военных объекта Украины. В том числе: пять взводных опорных пунктов, 13 районов сосредоточения живой силы и военной техники, а также четыре склада ракетно-артиллерийского вооружения и горючего в населенных пунктах Северодонецк, Червонное и Белогорье.\n\nРакетными войсками в течение дня поражены три военных объекта Украины. Уничтожены: в районе Адамовка пусковая установка зенитного ракетного комплекса «Бук-М1», а также вертолет Ми-24 воздушных сил Украины на площадке в районе Чугуева.\n\nАртиллерийскими подразделениями поражены пять пунктов управления, 13 опорных пунктов, 64 района сосредоточения живой силы и военной техники, а также семь позиций артиллерии.\n\nВ результате ударов уничтожены свыше 200 националистов и 32 единицы бронетехники и автомобилей различного назначения.\n\nРоссийскими средствами противовоздушной обороны уничтожено шесть украинских беспилотных летательных аппаратов над населенными пунктами Заводы, Семеновка, Рубежное, Червонный Оскол, Сухая Каменка и Любимовка.\n\nВ течение дня в воздухе сбиты три украинские ракеты «Точка-У» над Изюмом, Новой Дмитровкой, Сухой Каменкой, а также реактивные снаряды системы залпового огня «Смерч» в районе населенного пункта Топольское.\n\nВсего с начала проведения специальной военной операции уничтожены: 142 самолета, 112 вертолетов, 640 беспилотных летательных аппаратов, 279 зенитных ракетных комплексов, 2646 танков и других боевых бронированных машин, 305 установки реактивных систем залпового огня, 1184 орудия полевой артиллерии и миномета, а также 2475 единиц специальной военной автомобильной техники.",
    "url": "https://z.mil.ru/spec_mil_oper/brief/briefings/more.htm?id=12419336@egNews",
    "destroyed": {
      "САМОЛЕТЫ": 142,
      "ВЕРТОЛЕТЫ": 112,
      "БЕСПИЛОТНИКИ": 640,
      "ЗЕНИТКИ": 279,
      "ТАНКИ И БМ": 2646,
      "РСЗО": 305,
      "АРТИЛЛЕРИЯ И МИНОМЕТЫ": 1184,
      "АВТОМОБИЛЬНАЯ ТЕХНИКА": 2475
    }
  },
  "30.04.2022": {
    "date": "30.04.2022",
    "message": "Вооруженные Силы Российской Федерации продолжают специальную военную операцию на Украине.\n\nВысокоточными ракетами воздушного базирования в течение дня нанесено поражение 17-ти военным объектам Украины. Среди них: восемь районов сосредоточения живой силы и военной техники, пять огневых позиций артиллерии и установок реактивных систем залпового огня, а также два опорных пункта. Также уничтожены: командный пункт и склад ракетно-артиллерийского вооружения в районе населенного пункта Покровское Днепропетровской области.\n\nОперативно-тактической авиацией ВКС России в течение дня поражены два пункта управления, девять опорных пунктов и районов сосредоточения живой силы и техники, а также пять складов боеприпасов и горючего. В результате ударов уничтожены свыше 200 националистов и 23 единицы бронетехники.\n\nРакетными войсками и артиллерией поражены 319 районов сосредоточения живой силы и военной техники, 12 пунктов управления и два склада ракетно-артиллерийского вооружения.\n\nРоссийскими средствами противовоздушной обороны в районе населенного пункта Червоный Яр Херсонской области сбит в воздухе Су-25 воздушных сил Украины. Также над населенным пунктом Владимировка уничтожены два украинских беспилотных летательных аппарата и перехвачены 12 реактивных снарядов системы залпового огня «Смерч» в районе Каменки Донецкой Народной Республики.\n\nВсего с начала проведения специальной военной операции уничтожены: 143 самолета, 112 вертолетов, 660 беспилотных летательных аппаратов, 279 зенитных ракетных комплексов, 2678 танков и других боевых бронированных машин, 308 установок реактивных систем залпового огня, 1196 орудий полевой артиллерии и минометов, а также 2503 единицы специальной военной автомобильной техники.",
    "url": "https://z.mil.ru/spec_mil_oper/brief/briefings/more.htm?id=12419507@egNews",
    "destroyed": {
      "САМОЛЕТЫ": 143,
      "ВЕРТОЛЕТЫ": 112,
      "БЕСПИЛОТНИКИ": 660,
      "ЗЕНИТКИ": 279,
      "ТАНКИ И БМ": 2678,
      "РСЗО": 308,
      "АРТИЛЛЕРИЯ И МИНОМЕТЫ": 1196,
      "АВТОМОБИЛЬНАЯ ТЕХНИКА": 2503
    }
  },
  "02.05.2022": {
    "date": "02.05.2022",
    "message": "Вооруженные Силы Российской Федерации продолжают специальную военную операцию на Украине.\n\nВысокоточными ракетами воздушного базирования в течении дня поражены 36 военных объектов Украины. Среди них: пять пунктов управления, в том числе командно наблюдательные пункты батальонов 95-й десантно-штурмовой и 81-й аэромобильной бригад; 25 опорных пунктов, районов сосредоточения живой силы и военной техники ВСУ, в том числе в районе Александровки нацистского формирования «Айдар»; В Днепропетровской области в районе населенного пункта Покровское уничтожен склад ракетно-артиллерийского вооружения и боеприпасов. Также в районе населенного пункта Межевая уничтожены четыре пусковые установки ЗРК «С-300» и радиолокационная станция разведки и наведения.\n\nОперативно-тактической и армейской авиацией ВКС России поражены 13 опорных пунктов и районов сосредоточения живой силы и военной техники ВСУ.\n\nРакетными войсками в течении дня поражены четыре района сосредоточения живой силы и военной техники ВСУ, а также два пункта управления, в том числе в районе Подаловка командный пункт украинской 93-й механизированной бригады.\n\nАртиллерийскими подразделениями поражены два пункта управления, восемь артиллерийских батарей, 12 опорных пунктов и 28 районов сосредоточения живой силы и военной техники. Уничтожено до 170 националистов, а также 36 единиц вооружения и военной техники ВСУ.\n\nРоссийскими средствами противовоздушной обороны в районе острова Змеиный уничтожены три беспилотных летательных аппарата «Байрактар-ТБ2». Также сбиты четыре украинских беспилотных летательных аппарата в районах населенных пунктов Червоный Оскол и Невское Харьковской области, а также Веселое Донецкой Народной Республики.\n\nКроме того, в районах Изюм, Топольское и Малая Камышеваха перехвачены пять реактивных снарядов «Смерч».\n\nВсего с начала проведения специальной военной операции уничтожены: 146 самолетов, 112 вертолетов, 690 беспилотных летательных аппаратов, 285 зенитных ракетных комплексов,  2760 танков и других боевых бронированных машин, 316 установок реактивных систем залпового огня, 1246 орудий полевой артиллерии и минометов, а также 2578 единиц специальной военной автомобильной техники.",
    "url": "https://z.mil.ru/spec_mil_oper/brief/briefings/more.htm?id=12419699@egNews",
    "destroyed": {
      "САМОЛЕТЫ": 146,
      "ВЕРТОЛЕТЫ": 112,
      "БЕСПИЛОТНИКИ": 690,
      "ЗЕНИТКИ": 285,
      "ТАНКИ И БМ": 2760,
      "РСЗО": 316,
      "АРТИЛЛЕРИЯ И МИНОМЕТЫ": 1246,
      "АВТОМОБИЛЬНАЯ ТЕХНИКА": 2578
    }
  },
  "03.05.2022": {
    "date": "03.05.2022",
    "message": "Вооруженные Силы Российской Федерации продолжают специальную военную операцию на Украине.\n\nВысокоточными ракетами воздушного базирования в течение дня ВКС России в районах населенных пунктов Николаевка, Волчеяровка и Лисичанск уничтожены три украинских радиолокационных станции подсвета и наведения зенитных ракетных комплексов С-300, тактический ракетный комплекс «Точка-У», зенитный ракетный комплекс «ОСА-АКМ» и три установки реактивных систем залпового огня БМ-21 «Град».\n\nКроме того, в районах населенных пунктов Красный Лиман, Краматорск и Камышеваха уничтожены четыре радиолокационных станции обнаружения воздушных целей, шесть складов боеприпасов и ракетно-артиллерийского вооружения, а также радиолокационная станция контрбатарейной борьбы производства США.\n\nОперативно-тактической и армейской авиацией ВКС России поражены 39 военных объектов Украины. Среди них: два пункта управления и 36 районов сосредоточения живой силы и военной техники ВСУ.\n\nАртиллерийскими подразделениями поражены 11 пунктов управления, 54 огневых позиций украинских артиллерийских подразделений, два склада горюче-смазочных материалов, а также 342 опорных пункта, районов сосредоточения живой силы и военной техники ВСУ.\n\nУничтожено до 190 националистов и 31 единица вооружения и военной техники ВСУ.\n\nРоссийскими средствами противовоздушной обороны в районе населенного пункта Рудня Черниговской области сбит украинский беспилотный летательный аппарат.\n\nКроме того, в районе Новая Дмитровка сбита в воздухе украинская баллистическая ракета «Точка-У» и перехвачены девять реактивных снарядов систем залпового огня «Смерч» в районах населенных пунктов Александровское, Каменка Донецкой Народной Республики, а также Семеновское, Донецкое, Малая Камышеваха, Червоный Шахтер Харьковской области.\n\nВсего с начала проведения специальной военной операции уничтожены: 146 самолетов, 112 вертолетов, 697 беспилотных летательных аппаратов, 287 зенитных ракетных комплексов, 2793 танка и других боевых бронированные машины, 319 установок реактивных систем залпового огня, 1267 орудий полевой артиллерии и минометов, а также 2598 единиц специальной военной автомобильной техники.",
    "url": "https://z.mil.ru/spec_mil_oper/brief/briefings/more.htm?id=12419783@egNews",
    "destroyed": {
      "САМОЛЕТЫ": 146,
      "ВЕРТОЛЕТЫ": 112,
      "БЕСПИЛОТНИКИ": 697,
      "ЗЕНИТКИ": 287,
      "ТАНКИ И БМ": 2793,
      "РСЗО": 319,
      "АРТИЛЛЕРИЯ И МИНОМЕТЫ": 1267,
      "АВТОМОБИЛЬНАЯ ТЕХНИКА": 2598
    }
  },
  "04.05.2022": {
    "date": "04.05.2022",
    "message": "Вооруженные Силы Российской Федерации продолжают специальную военную операцию на Украине.\n\nВысокоточными ракетами воздушного базирования ВКС России в течение дня уничтожены: четыре артиллерийских батареи на огневых позициях, три склада боеприпасов в районах МИРНАЯ ДОЛИНА, БАХМУТСКАЯ и ТАШКОВКА, 20 районов сосредоточения живой силы и военной техники, а также в районе населенного пункта ПОПАСНАЯ радиолокационная станция контрбатарейной борьбы производства США.\n\nОперативно-тактической и армейской авиацией ВКС России поражены 77 районов сосредоточения живой силы и военной техники.\n\nУничтожено до 310 националистов и 36 единиц вооружения и военной техники.\n\nРакетными войсками и артиллерией поражена на огневых позициях украинская батарея реактивных систем залпового огня БМ-21 «Град», а также 83 района сосредоточения живой силы и военной техники.\n\nРоссийскими средствами противовоздушной обороны в течение дня уничтожены шесть украинских беспилотных летательных аппаратов в районах населенных пунктов АВДЕЕВКА, СЕВЕРОДОНЕЦК, ВЕСЕЛАЯ ГОРА Луганской Народной Республики, а также над островом ЗМЕИНЫЙ.\n\nКроме того, в районе ШПАКОВКИ Харьковской области сбиты в воздухе два реактивных снаряда систем залпового огня «Смерч».\n\nВсего с начала проведения специальной военной операции уничтожены: 146 самолетов, 112 вертолетов, 712 беспилотных летательных аппаратов, 287 зенитных ракетных комплексов, 2817 танков и других боевых бронированные машин, 323 установки реактивных систем залпового огня, 1292 орудия полевой артиллерии и миномета, а также 2624 единицы специальной военной автомобильной техники.",
    "url": "https://z.mil.ru/spec_mil_oper/brief/briefings/more.htm?id=12419924@egNews",
    "destroyed": {
      "САМОЛЕТЫ": 146,
      "ВЕРТОЛЕТЫ": 112,
      "БЕСПИЛОТНИКИ": 712,
      "ЗЕНИТКИ": 287,
      "ТАНКИ И БМ": 2817,
      "РСЗО": 323,
      "АРТИЛЛЕРИЯ И МИНОМЕТЫ": 1292,
      "АВТОМОБИЛЬНАЯ ТЕХНИКА": 2624
    }
  },
  "05.05.2022": {
    "date": "05.05.2022",
    "message": "Вооруженные Силы Российской Федерации продолжают специальную военную операцию на Украине.\n\nВысокоточными ракетами воздушного базирования ВКС России поражен пункт управления 24-й отдельной механизированной бригады ВСУ в районе населенного пункта Лоскутовка, два склада боеприпасов националистов в районе Северск, а также 28 районов сосредоточения живой силы и военной техники.\n\nОперативно-тактической и армейской авиацией ВКС России в течение дня поражены сорок пять военных объектов Украины.\n\nСреди них: два командных пункта, 41 район сосредоточения живой силы и украинской военной техники, а также склад ракетно-артиллерийского вооружения в районе Воеводовки Луганской Народной Республики.\n\nРакетными войсками поражена артиллерийская батарея на огневых позициях в районе населенного пункта Зарожное, батарея реактивных систем залпового огня «Ураган» в районе Николаева и четыре района сосредоточения живой силы и военной техники.\n\nАртиллерийскими подразделениями поражены 6 пунктов управления, два склада боеприпасов, 152 опорных пунктов, районов сосредоточения живой силы и военной техники, а также 38 артиллерийских подразделений ВСУ на огневых позициях.\n\nУничтожено до 190 человек личного состава, 43 единицы вооружения и военной техники.\n\nРоссийскими средствами противовоздушной обороны в течение дня сбиты три украинских беспилотных летательных аппарата над населенными пунктами Малая Камышеваха Харьковской области и Северск Луганской Народной Республики, в том числе беспилотный летательный аппарат «Байрактар ТБ-2» в районе острова Змеиный.\n\nВсего с начала проведения специальной военной операции уничтожены: 149 самолетов, 112 вертолетов, 729 беспилотных летательных аппаратов, 288 зенитных ракетных комплексов, 2846 танков и других боевых бронированных машин, 327 установок реактивных систем залпового огня, 1323 орудия полевой артиллерии и миномета, а также 2662 единицы специальной военной автомобильной техники.",
    "url": "https://z.mil.ru/spec_mil_oper/brief/briefings/more.htm?id=12420043@egNews",
    "destroyed": {
      "САМОЛЕТЫ": 149,
      "ВЕРТОЛЕТЫ": 112,
      "БЕСПИЛОТНИКИ": 729,
      "ЗЕНИТКИ": 288,
      "ТАНКИ И БМ": 2846,
      "РСЗО": 327,
      "АРТИЛЛЕРИЯ И МИНОМЕТЫ": 1323,
      "АВТОМОБИЛЬНАЯ ТЕХНИКА": 2662
    }
  },
  "06.05.2022": {
    "date": "06.05.2022",
    "message": "Вооруженные Силы Российской Федерации продолжают специальную военную операцию на Украине.\n\nВысокоточными ракетами воздушного базирования ВКС России поражен 31 район сосредоточения живой силы и военной техники ВСУ, а также склад боеприпасов в районе Попасная.\n\nОперативно-тактической и армейской авиацией ВКС России поражены 27 военных объектов Украины. Среди них: три склада боеприпасов в районах Кузьминовка, Звановка и Северск Донецкой Народной Республики, а также семь ротных опорных пунктов и 16 районов сосредоточения живой силы и военной техники. В результате ударов уничтожено до 310 человек личного состава, 27 единиц вооружения и военной техники, а также украинский зенитный ракетный комплекс «Оса-АКМ» в районе населенного пункта Северск Донецкой Народной Республики.\n\nРакетными войсками и артиллерией в течение дня поражены 22 пункта управления, 207 опорных пунктов, районов сосредоточения живой силы и военной техники, а также три склада боеприпасов.\n\nРоссийскими средствами противовоздушной обороны сбит самолет Су-27 воздушных сил Украины в районе населенного пункта Платоновка Луганской Народной Республики. Кроме того, уничтожены: семь украинских беспилотных летательных аппаратов над населёнными пунктами Липцы Харьковской области, Сладкое, Землянка Донецкой Народной Республики, Третьяковка, Варваровка Луганской Народной Республики и в районе острова Змеиный. Также в районе города Изюм перехвачены два реактивных снаряда системы залпового огня «Смерч».\n\nВсего с начала проведения специальной военной операции уничтожены: 152 самолета, 112 вертолетов, 749 беспилотных летательных аппаратов, 291 зенитный ракетный комплекс, 2867 танков и других боевых бронированных машин, 331 установка реактивных систем залпового огня, 1345 орудий полевой артиллерии и минометов, а также 2698 единиц специальной военной автомобильной техники.",
    "url": "https://z.mil.ru/spec_mil_oper/brief/briefings/more.htm?id=12420172@egNews",
    "destroyed": {
      "САМОЛЕТЫ": 152,
      "ВЕРТОЛЕТЫ": 112,
      "БЕСПИЛОТНИКИ": 749,
      "ЗЕНИТКИ": 291,
      "ТАНКИ И БМ": 2867,
      "РСЗО": 331,
      "АРТИЛЛЕРИЯ И МИНОМЕТЫ": 1345,
      "АВТОМОБИЛЬНАЯ ТЕХНИКА": 2698
    }
  },
  "07.05.2022": {
    "date": "07.05.2022",
    "message": "Вооруженные Силы Российской Федерации продолжают специальную военную операцию на Украине.\n\nВысокоточным оружием большой дальности воздушного и морского базирования на военных аэродромах в районах населенных пунктов АРЦИЗ, ОДЕССА и ВОЗНЕСЕНСК уничтожены авиационная техника воздушных сил Украины, в том числе беспилотные летательные аппараты, а также авиационные средства поражения.\n\nОперативно-тактическими ракетными комплексами «Искандер» в районах железнодорожных станций КРАСНОГРАД и КАРЛОВКА Харьковской области уничтожены крупные скопления вооружения и военной техники, доставленной из США и западных стран, а также личный состав подразделений 58 мотопехотной бригады ВСУ.\n\nВысокоточными ракетами воздушного базирования ВКС России поражено 42 района сосредоточения живой силы и украинской военной техники в районе населенного пункта ВОЛЧЕЯРОВКА Луганской Народной Республики, а также два склада боеприпасов в районе населенного пункта СЕВЕРСК Донецкой Народной Республики.\n\nОперативно-тактической и армейской авиацией в течение дня поражены 26 военных объектов Украины. Среди них: два пункта управления, 21 район сосредоточения личного состава и военной техники, два склада боеприпасов и артиллерийская батарея на огневых позициях.\n\nВ результате ударов уничтожены до 210 националистов, выведены из строя 39 единиц вооружения и военной техники.\n\nВ районе острова ЗМЕИНЫЙ сбиты в воздухе: украинский бомбардировщик Су-24, истребитель Су-27, три вертолета Ми-8 с десантом и два беспилотных летательных аппарата «Байрактар-ТБ2». Также уничтожен украинский десантно-штурмовой катер «Станислав».\n\nРакетными войсками и артиллерией в течение дня поражен 31 пункт управления и 245 опорных пунктов, районов сосредоточения живой силы и военной техники ВСУ.\n\nВсего с начала проведения специальной военной операции уничтожены: 154 самолета, 115 вертолетов, 764 беспилотных летательных аппарата, 296 зенитных ракетных комплексов, 2902 танка и других боевых бронированных машин, 333 установки реактивных систем залпового огня, 1378 орудий полевой артиллерии и минометов, а также 2728 единиц специальной военной автомобильной техники.",
    "url": "https://z.mil.ru/spec_mil_oper/brief/briefings/more.htm?id=12420352@egNews",
    "destroyed": {
      "САМОЛЕТЫ": 154,
      "ВЕРТОЛЕТЫ": 115,
      "БЕСПИЛОТНИКИ": 764,
      "ЗЕНИТКИ": 296,
      "ТАНКИ И БМ": 2902,
      "РСЗО": 333,
      "АРТИЛЛЕРИЯ И МИНОМЕТЫ": 1378,
      "АВТОМОБИЛЬНАЯ ТЕХНИКА": 2728
    }
  },
  "08.05.2022": {
    "date": "08.05.2022",
    "message": "Вооруженные Силы Российской Федерации продолжают специальную военную операцию на Украине.\n\nВысокоточными ракетами воздушного базирования ВКС России в районе населенного пункта Соледар уничтожено доставленное на железнодорожную станцию СОЛЬ вооружение и военная техника из США и западных стран, а также личный состав подразделений резерва ВСУ.\n\nКроме того, поражены 19 районов сосредоточения живой силы и военной техники, уничтожена понтонная переправа украинских войск в районе Чугуев и шесть складов ракетно-артиллерийского вооружения в районах Красная Гора, Верхнекаменка, Маяки Донецкой Народной Республики, Новодружевск Луганской Народной Республики, Резниково и Николаевка Харьковской области.\n\nОперативно-тактической и армейской авиацией поражены 54 района сосредоточения личного состава и военной техники.\n\nВ результате ударов уничтожены до 380 националистов, выведены из строя 38 единиц военной техники.\n\nРакетными войсками уничтожена пусковая установка зенитного ракетного комплекса «Оса-АКМ» в районе Николаева, установка реактивной системы залпового огня «Смерч» в районе Соледара, а также радиолокационная станция обнаружения воздушных целей в районе населенного пункта Великая Корениха Николаевской области.\n\nПодразделениями артиллерии поражены шесть пунктов управления, 28 украинских артиллерийских подразделений на огневых позициях, 179 районов сосредоточения живой силы и военной техники ВСУ, а также два склада боеприпасов.\n\nРоссийскими средствами противовоздушной обороны в районе острова Змеиный уничтожен один беспилотный летательный аппарат «Байрактар-ТБ2».\n\nВ районе населенного пункта Погоновка Харьковской области сбит самолет Су-25 воздушных сил Украины.\n\nКроме того, два украинских беспилотных летательных аппарата уничтожены над населенными пунктами Мандрыкино Донецкой Народной Республики и Переможное Луганской Народной Республики.\n\nВсего с начала проведения специальной военной операции уничтожены: 157 самолетов, 116 вертолетов, 768 беспилотных летательных аппаратов, 298 зенитных ракетных комплексов,\n\n2933 танка и других боевых бронированных машин, 336 установок реактивных систем залпового огня, 1411 орудий полевой артиллерии и минометов, а также 2758 единиц специальной военной автомобильной техники.",
    "url": "https://z.mil.ru/spec_mil_oper/brief/briefings/more.htm?id=12420465@egNews",
    "destroyed": {
      "САМОЛЕТЫ": 157,
      "ВЕРТОЛЕТЫ": 116,
      "БЕСПИЛОТНИКИ": 768,
      "ЗЕНИТКИ": 298,
      "ТАНКИ И БМ": 2933,
      "РСЗО": 336,
      "АРТИЛЛЕРИЯ И МИНОМЕТЫ": 1411,
      "АВТОМОБИЛЬНАЯ ТЕХНИКА": 2758
    }
  },
  "09.05.2022": {
    "date": "09.05.2022",
    "message": "Вооруженные Силы Российской Федерации продолжают специальную военную операцию на Украине.\n\nВысокоточными ракетами воздушного базирования ВКС России поражены 11 районов сосредоточения живой силы и военной техники, четыре ротных опорных пункта, восемь складов боеприпасов украинских войск в районах Константиновки, Антоновки, Елизаветовки, Долина и Лисичанска, а также две радиолокационные станции обнаружения воздушных целей в районах Краматорска и Крестище.\n\nПо уточненным данным, ночью в районе населенного пункта Арциз Одесской области в районе военного аэродрома «Червоноглинское» высокоточными ракетами «Оникс» берегового ракетного комплекса «Бастион» были уничтожены шесть вертолетов Ми-8 и Ми-24.\n\nОперативно-тактической и армейской авиацией поражено два пункта управления и пять районов сосредоточения живой силы и военной техники ВСУ.\n\nРакетными войсками и подразделениями артиллерии поражено 318 районов сосредоточения живой силы и военной техники.\n\nВ результате ударов уничтожены до 400 националистов, выведены из строя 48 единиц военной техники.\n\nВ течение дня российскими средствами противовоздушной обороны над городом Северодонецк сбит самолет МиГ-29 воздушных сил Украины.\n\nКроме того, уничтожены три украинских беспилотных летательных аппарата над населенными пунктами Новозвановка, Харцызск и Изюм.\n\nВ районе населенного пункта Ивановка Харьковской области перехвачена украинская ракета «Точка-У», а в районах Большой Камышевахи и Изюма – два реактивных снаряда системы залпового огня «Смерч».\n\nВсего с начала проведения специальной военной операции уничтожены: 162 самолета, 124 вертолета, 790 беспилотных летательных аппаратов, 299 зенитных ракетных комплексов,  2967 танков и других боевых бронированных машин, 347 установок реактивных систем залпового огня, 1432 орудия полевой артиллерии и миномета, а также 2778 единиц специальной военной автомобильной техники.\n\nC 7-го мая, по прямому указанию В.Зеленского, украинским генштабом, при непосредственном участии советников из США и Великобритании, была спланирована крупная провокация по захвату острова Змеиный.\n\nВ течение двух последних суток киевским режимом было предпринято несколько отчаянных попыток высадки воздушного и морского десанта на остров Змеиный, имеющий важное значение для обеспечения контроля северо-западной части акватории Черного моря.\n\nВ результате грамотных действий находящегося на острове подразделения российских вооруженных сил украинская провокация была сорвана. Противник понес большие потери.\n\nЗа период отражения атак в районе Змеиного были сбиты в воздухе четыре украинских самолета, в том числе три Су-24 и один Су-27, три вертолета Ми-8 с десантом на борту, один вертолёт Ми-24.\n\nВ течение двух суток сбиты в воздухе 29 украинских беспилотных летательных аппаратов, в том числе восемь ударных «Байрактар ТБ-2». При этом четыре беспилотных летательных аппарата «Байрактар» сбиты сегодня днём.\n\nТакже, при попытке высадки десанта в ночь на 8 мая, были уничтожены три бронированных украинских десантно-штурмовых катера проекта 58181 «Кентавр» с военнослужащими ВМС Украины.\n\nВ результате бездумной провокации Зеленского только в ходе высадки и попытки закрепления на острове были уничтожены в море и на побережье более 50-ти украинских диверсантов.\n\nНа берегу острова Змеиный остались 24 тела погибших украинских военнослужащих.",
    "url": "https://z.mil.ru/spec_mil_oper/brief/briefings/more.htm?id=12420647@egNews",
    "destroyed": {
      "САМОЛЕТЫ": 162,
      "ВЕРТОЛЕТЫ": 124,
      "БЕСПИЛОТНИКИ": 790,
      "ЗЕНИТКИ": 299,
      "ТАНКИ И БМ": 2967,
      "РСЗО": 347,
      "АРТИЛЛЕРИЯ И МИНОМЕТЫ": 1432,
      "АВТОМОБИЛЬНАЯ ТЕХНИКА": 2778
    }
  },
  "10.05.2022": {
    "date": "10.05.2022",
    "message": "Вооруженные Силы Российской Федерации продолжают специальную военную операцию на Украине.\n\nОперативно-тактической и армейской авиацией в течение дня поражено 74 объекта в том числе два пункта управления, двадцать районов сосредоточения живой силы и военной техники ВСУ, а также два склада ракетно-артиллерийского вооружения.\n\nРакетными войсками и подразделениями артиллерии поражены 223 района сосредоточения живой силы и военной техники, уничтожено три пункта управления и два склада боеприпасов. В результате ударов уничтожены более 100 националистов, выведены из строя 19 единиц военной техники.\n\nРоссийскими средствами противовоздушной обороны в воздухе в районе населенного пункта Широкое Днепропетровской области сбит украинский самолет Су-25. Кроме того, в районе Новодмитровки Херсонской области сбит вертолет Ми-8 воздушных сил Украины.\n\nКроме того, уничтожены четыре украинских беспилотных летательных аппарата в районе Лисичанска, Кривого Рога и Кулиновки Харьковской области.\n\nВсего с начала проведения специальной военной операции уничтожены: 164 самолета, 125 вертолетов, 798 беспилотных летательных аппаратов, 302 зенитных ракетных комплексов, 2983 танков и других боевых бронированных машин, 351 установок реактивных систем залпового огня, 1440 орудия полевой артиллерии и миномета, а также 2796 единиц специальной военной автомобильной техники.\n\nОтмечу, что в районе острова Змеиный российскими средствами противовоздушной обороны сегодня днём был уничтожен ещё один украинский беспилотный летательный аппарат Байрактар-ТБ2.\n\nТаким образом, киевский режим за прошедшие трое суток потерял в данном районе 30 только военных беспилотных летательных аппаратов. Напомню, что из них девять - ударных Байрактар-ТБ2.\n\nВсе беспилотные аппараты были задействованы в провалившейся пиар-акции киевского режима по захвату в канун 9 мая, Праздника Победы в Великой Отечественной войне, острова Змеиный.\n\nКроме того, сегодня российскими военнослужащими на берегу были обнаружены ещё три, прибитых с моря, тела украинских диверсантов. Сейчас на Змеином в результате провала операции Киева остаются 27 тел боевиков украинских подразделений спецназначения и националистов.\n\nВсего же, в ходе бессмысленной с военной точки зрения попытки захвата острова киевский режим потерял в районе Змеиного три бомбардировщика Су-24 и один истребитель Су-27. Уничтожены 10 вертолётов Воздушных сил Украины. Из них в воздухе сбиты три вертолета Ми-8 с десантом на борту, один вертолёт поддержки Ми-24. Кроме того, задействованные в операции ещё шесть вертолетов Ми-8 и Ми-24 были уничтожены на земле в районе населенного пункта Арциз Одесской области.\n\nТакже в море были уничтожены три украинских бронированных десантно-штурмовых катера Кентавр с морским десантом на борту.\n\nТаким образом, данная авантюра закончилась для Украины катастрофой. Бездумная пиар-акция киевского режима по захвату острова Змеиный в канун Дня Победы привела к бессмысленной гибели более 50 украинских боевиков и военнослужащих элитных подразделений ВСУ, потере четырех самолётов, десяти вертолетов, трех катеров и тридцати беспилотных летательных аппаратов.",
    "url": "https://z.mil.ru/spec_mil_oper/brief/briefings/more.htm?id=12420823@egNews",
    "destroyed": {
      "САМОЛЕТЫ": 164,
      "ВЕРТОЛЕТЫ": 125,
      "БЕСПИЛОТНИКИ": 798,
      "ЗЕНИТКИ": 302,
      "ТАНКИ И БМ": 2983,
      "РСЗО": 351,
      "АРТИЛЛЕРИЯ И МИНОМЕТЫ": 1440,
      "АВТОМОБИЛЬНАЯ ТЕХНИКА": 2796
    }
  },
  "11.05.2022": {
    "date": "11.05.2022",
    "message": "Вооруженные Силы Российской Федерации продолжают специальную военную операцию на Украине.\n\nОперативно-тактической и армейской авиацией в течение ночи поражено 93 объекта, в том числе два пункта управления, 69 районов сосредоточения живой силы и военной техники, а также три склада боеприпасов ВСУ.\n\nРакетными войсками и подразделениями артиллерии поражены 407 районов сосредоточения живой силы и военной техники, уничтожено 13 пунктов управления, четыре позиции зенитных ракетных комплексов «Оса-АКМ» и 14 складов боеприпасов.\n\nВ результате ударов уничтожены более 280 националистов, выведено из строя 59 единиц военной техники.\n\nСредствами противовоздушной обороны ночью уничтожены девять украинских беспилотных летательных аппаратов, в том числе четыре в районе населенного пункта Балаклея Харьковской области, три в районе Рубежного Луганской Народной Республики, один в районе острова Змеиный, а также один «Байрактар-ТБ2» в районе населенного пункта Архангельское Николаевской области.\n\nВсего с начала проведения специальной военной операции уничтожены: 164 самолета, 125 вертолетов, 807 беспилотных летательных аппаратов, 302 зенитных ракетных комплекса, 2998 танков и других боевых бронированных машин, 360 установок реактивных систем залпового огня, 1455 орудий полевой артиллерии и минометов, а также 2808 единиц специальной военной автомобильной техники.",
    "url": "https://z.mil.ru/spec_mil_oper/brief/briefings/more.htm?id=12420876@egNews",
    "destroyed": {
      "САМОЛЕТЫ": 164,
      "ВЕРТОЛЕТЫ": 125,
      "БЕСПИЛОТНИКИ": 807,
      "ЗЕНИТКИ": 302,
      "ТАНКИ И БМ": 2998,
      "РСЗО": 360,
      "АРТИЛЛЕРИЯ И МИНОМЕТЫ": 1455,
      "АВТОМОБИЛЬНАЯ ТЕХНИКА": 2808
    }
  },
  "12.05.2022": {
    "date": "12.05.2022",
    "message": "Вооруженные Силы Российской Федерации продолжают специальную военную операцию на Украине.\n\nВысокоточными ракетами воздушного базирования ВКС России за день поражены четыре пункта управления, 38 районов сосредоточения живой силы и военной техники, четыре склада боеприпасов в районе Соледар Донецкой Народной Республики, а также в районе Харькова радиолокационная станция контрбатарейной борьбы производства США. В результате ударов уничтожены более 170 националистов, выведена из строя 41 единица военной техники.\n\nОперативно-тактической и армейской авиацией поражено 45 районов сосредоточения живой силы и военной техники, а также хранилище топлива для украинской военной техники в районе Врубовки Луганской Народной Республики.\n\nПодразделениями артиллерии поражены 14 пунктов управления, семь артиллерийских подразделений на огневых позициях и 358 районов сосредоточения живой силы и украинской военной техники. Кроме того, в районе населенного пункта Долина Харьковской области уничтожена пусковая установка зенитного ракетного комплекса С-300.\n\nСредствами противовоздушной обороны в течение дня уничтожены пять украинских беспилотных летательных аппаратов в районах населенных пунктов Глубокое, Липцы Харьковской области, Александровка, Донецк, а также 10 реактивных снарядов РСЗО «Смерч» в районе Полевое Донецкой Народной Республики.\n\nКроме того, над островом Змеиный сбит в воздухе один беспилотный летательный аппарат и перехвачены три украинские баллистические ракеты «Точка-У».\n\nВсего с начала проведения специальной военной операции уничтожены: 164 самолета, 125 вертолетов, 827 беспилотных летательных аппаратов, 304 зенитных ракетных комплекса, 3022 танка и других боевых бронированных машин, 366 установок реактивных систем залпового огня, 1479 орудий полевой артиллерии и минометов, а также 2832 единицы специальной военной автомобильной техники.",
    "url": "https://z.mil.ru/spec_mil_oper/brief/briefings/more.htm?id=12421228@egNews",
    "destroyed": {
      "САМОЛЕТЫ": 164,
      "ВЕРТОЛЕТЫ": 125,
      "БЕСПИЛОТНИКИ": 827,
      "ЗЕНИТКИ": 304,
      "ТАНКИ И БМ": 3022,
      "РСЗО": 366,
      "АРТИЛЛЕРИЯ И МИНОМЕТЫ": 1479,
      "АВТОМОБИЛЬНАЯ ТЕХНИКА": 2832
    }
  },
  "13.05.2022": {
    "date": "13.05.2022",
    "message": "Вооруженные Силы Российской Федерации продолжают специальную военную операцию на Украине.\n\nВысокоточными ракетами воздушного базирования ВКС России в районах населенных пунктов ЗОЛОТОЕ и ВРУБОВКА Луганской Народной Республики уничтожены штабы территориальной обороны и батальона 24-й механизированной бригады. Кроме того, поражены 32 района сосредоточения живой силы и военной техники, а также склад боеприпасов в районе КРАСНОПАВЛОВКА Харьковской области. В результате ударов уничтожены более 300 националистов, выведены из строя 37 единиц военной техники.\n\nОперативно-тактической и армейской авиацией поражены три командных пункта ВСУ, а также 52 района сосредоточения живой силы и военной техники.\n\nРакетными войсками и артиллерией поражены 17 пунктов управления, а также 370 районов сосредоточения живой силы и военной техники и пять артиллерийских подразделений на огневых позициях.\n\nРоссийскими средствами противовоздушной обороны уничтожены три украинских беспилотных летательных аппарата в районах населенных пунктов КРАСНОПОЛЬЕ, МАЛАЯ КАМЫШЕВАХА Харьковской области и ГОРЛОВКА Донецкой Народной Республики.\n\nВсего с начала проведения специальной военной операции уничтожены: 165 самолетов, 125 вертолетов, 845 беспилотных летательных аппаратов, 304 зенитных ракетных комплекса, 3039 танков и других боевых бронированных машин, 369 установок реактивных систем залпового огня, 1498 орудий полевой артиллерии и минометов, а также 2882 единицы специальной военной автомобильной техники.",
    "url": "https://z.mil.ru/spec_mil_oper/brief/briefings/more.htm?id=12421721@egNews",
    "destroyed": {
      "САМОЛЕТЫ": 165,
      "ВЕРТОЛЕТЫ": 125,
      "БЕСПИЛОТНИКИ": 845,
      "ЗЕНИТКИ": 304,
      "ТАНКИ И БМ": 3039,
      "РСЗО": 369,
      "АРТИЛЛЕРИЯ И МИНОМЕТЫ": 1498,
      "АВТОМОБИЛЬНАЯ ТЕХНИКА": 2882
    }
  },
  "14.05.2022": {
    "date": "14.05.2022",
    "message": "Вооруженные Силы Российской Федерации продолжают специальную военную операцию на Украине.\n \nВысокоточными ракетами воздушного базирования ВКС России в течение дня поражены 28 ротных опорных пунктов ВСУ и два склада боеприпасов в районах населенных пунктов Петровское и Жовтневое.\n \nОперативно-тактической и армейской авиацией поражены 33 района сосредоточения живой силы и военной техники. В результате ударов уничтожены до 90 националистов, выведены из строя 18 единиц военной техники.\n \nРакетными войсками и артиллерией в течение дня поражены шесть пунктов управления, 178 районов сосредоточения живой силы и военной техники, три укрепленных бункера, а также 28 артиллерийских подразделений на огневых позициях, в том числе пусковая установка системы залпового огня «Смерч» в районе населенного пункта Березовка.\n \nРоссийскими средствами противовоздушной обороны в течение дня сбиты шесть украинских беспилотных летательных аппаратов в районах населенных пунктов Русская Лозовая, Питомник, Изюм Харьковской области, в том числе один над островом Змеиный.\nКроме того, перехвачены: в районе населенного пункта Хлебороб украинская баллистическая ракета «Точка-У» и в районе Каменка Харьковской области три реактивных снаряда системы залпового огня «Смерч».\n \nВсего с начала проведения специальной военной операции уничтожены: 165 самолетов, 125 вертолетов, 864 беспилотных летательных аппаратов, 304 зенитных ракетных комплекса, 3067 танков и других боевых бронированных машин, 372 установки реактивных систем залпового огня, 1514 орудий полевой артиллерии и минометов, а также 2913 единиц специальной военной автомобильной техники.",
    "url": "https://z.mil.ru/spec_mil_oper/brief/briefings/more.htm?id=12421801@egNews",
    "destroyed": {
      "САМОЛЕТЫ": 165,
      "ВЕРТОЛЕТЫ": 125,
      "БЕСПИЛОТНИКИ": 864,
      "ЗЕНИТКИ": 304,
      "ТАНКИ И БМ": 3067,
      "РСЗО": 372,
      "АРТИЛЛЕРИЯ И МИНОМЕТЫ": 1514,
      "АВТОМОБИЛЬНАЯ ТЕХНИКА": 2913
    }
  },
  "15.05.2022": {
    "date": "15.05.2022",
    "message": "Вооруженные Силы Российской Федерации продолжают специальную военную операцию на Украине.\n\nВысокоточными ракетами воздушного базирования ВКС России в течение ночи поражены два пункта управления, 11 ротных опорных пунктов и четыре склада ракетно-артиллерийского вооружения и боеприпасов ВСУ в районах населенных пунктов Запорожье, Парасковиевка, Константиновка и Новомихайловка Донецкой Народной Республики.\n\nОперативно-тактической и армейской авиацией нанесено поражение 32-м районам сосредоточения живой силы и военной техники ВСУ. Уничтожены две пусковые установки зенитного ракетного комплекса С-300 и радиолокационный пост в районе Шпилевка Сумской области.\n\nРакетными войсками и артиллерией поражены шесть пунктов управления, 123 района сосредоточения живой силы и военной техники, 13 артиллерийских батарей ВСУ на огневых позициях. В результате ударов уничтожены до 150 националистов, выведены из строя 26 единиц военной техники.\n\nРоссийскими средствами противовоздушной обороны в течение ночи сбиты 15 украинских беспилотных летательных аппаратов в районах населенных пунктов, Новотроицкое, Владимировка, Петровское, Луганское Донецкой Народной Республики, Епифановка, Кудряшовка, Верхняя Дуванка Луганской Народной Республики, Чкаловское, Великие Проходы, Высшее Соленое Харьковской области и над островом Змеиный. Кроме того, в районе населенного пункта Степное Херсонской области перехвачена тактическая ракета «Точка-У», а в районах Каменка, Малая Камышеваха, Бражковка Харьковской области и Чернобаевка Херсонской области перехвачены 11 реактивных снарядов системы залпового огня «Смерч».\n\nВсего с начала проведения специальной военной операции уничтожены: 165 самолетов, 125 вертолетов, 879 беспилотных летательных аппаратов, 306 зенитных ракетных комплексов, 3098 танков и других боевых бронированных машин, 381 установка реактивных систем залпового огня, 1525 орудий полевой артиллерии и минометов, а также 2934 единицы специальной военной автомобильной техники.",
    "url": "https://z.mil.ru/spec_mil_oper/brief/briefings/more.htm?id=12421850@egNews",
    "destroyed": {
      "САМОЛЕТЫ": 165,
      "ВЕРТОЛЕТЫ": 125,
      "БЕСПИЛОТНИКИ": 879,
      "ЗЕНИТКИ": 306,
      "ТАНКИ И БМ": 3098,
      "РСЗО": 381,
      "АРТИЛЛЕРИЯ И МИНОМЕТЫ": 1525,
      "АВТОМОБИЛЬНАЯ ТЕХНИКА": 2934
    }
  },
  "16.05.2022": {
    "date": "16.05.2022",
    "message": "Вооруженные Силы Российской Федерации продолжают специальную военную операцию на Украине.\n\nВысокоточными ракетами воздушного базирования ВКС России за сутки поражены два пункта управления, в том числе командный пункт 72-й механизированной бригады в районе Цаповка Харьковской области, 16 районов сосредоточения живой силы и военной техники, восемь долговременных огневых точек и пять складов ракетно-артиллерийского вооружения в районах населенных пунктов Красный Лиман Харьковской области, Владимировка и Константиновка Донецкой Народной Республики, а также Берестовое Луганской Народной Республики.\n\nВ результате ударов уничтожены свыше 360 националистов, выведены из строя 78 единиц военной техники.\n\nОперативно-тактической и армейской авиацией поражены три пункта управления, 104 района сосредоточения живой силы и военной техники, а также два склада горючего.\n\nРакетными войсками и артиллерией поражены 325 районов сосредоточения живой силы и военной техники, 14 пунктов управления и 24 артиллерийские батареи на огневых позициях.\n\nРоссийскими средствами противовоздушной обороны в районах населенных пунктов Евгеновка Николаевской области и Великая Камышеваха сбиты в воздухе два самолета Су-25 воздушных сил Украины. Кроме того, в районе острова Змеиный сбит один украинский самолет Су-24.\n\nНад населенными пунктами Новосветловка Луганской Народной Республики, Дементиевка, Изюм и Малые Проходы Харьковской области, Донецк, Высокое и Калиновское Донецкой Народной Республики уничтожены десять украинских беспилотных летательных аппаратов, в том числе два реактивных Ту-143 «Рейс» советского производства.\n\nКроме того, в районах Малая Камышеваха, Снежковка, Шпаковка, Ивановка Харьковской области и Чернобаевка Херсонской области перехвачены 18 реактивных снарядов системы залпового огня «Смерч».\n\nВсего с начала проведения специальной военной операции уничтожены: 168 самолетов, 125 вертолетов, 889 беспилотных летательных аппаратов, 307 зенитных ракетных комплексов, 3108 танков и других боевых бронированных машин, 381 установка реактивных систем залпового огня, 1529 орудий полевой артиллерии и минометов, а также 2949 единиц специальной военной автомобильной техники.",
    "url": "https://z.mil.ru/spec_mil_oper/brief/briefings/more.htm?id=12421941@egNews",
    "destroyed": {
      "САМОЛЕТЫ": 168,
      "ВЕРТОЛЕТЫ": 125,
      "БЕСПИЛОТНИКИ": 889,
      "ЗЕНИТКИ": 307,
      "ТАНКИ И БМ": 3108,
      "РСЗО": 381,
      "АРТИЛЛЕРИЯ И МИНОМЕТЫ": 1529,
      "АВТОМОБИЛЬНАЯ ТЕХНИКА": 2949
    }
  },
  "17.05.2022": {
    "date": "17.05.2022",
    "message": "Вооруженные Силы Российской Федерации продолжают специальную военную операцию на Украине.\n\nВчера началась сдача в плен боевиков националистического подразделения «Азов» и украинских военнослужащих, заблокированных на заводе «Азовсталь» в Мариуполе. За прошедшие сутки сложили оружие и сдались в плен 265 боевиков, в том числе 51 тяжелораненый. Все нуждающиеся в медицинской помощи направлены для лечения в больницу города Новоазовск Донецкой Народной Республики.\n\nВысокоточными ракетами большой дальности морского базирования «Калибр» в районе железнодорожной станции Старичи Львовской области уничтожен личный состав украинских резервных формирований, а также партии иностранного вооружения и военной техники из США и европейских стран, подготовленные для отправки на Донбасс.\n\nКроме того, высокоточными ракетами большой дальности воздушного и наземного базирования уничтожены резервы противника, завершавшие боевое слаживание на территории учебных центров в районах населенных пунктов Ахтырка Сумской области и Десна Черниговской области.\n\nВысокоточными ракетами воздушного базирования ВКС России поражены два пункта управления и узел связи, в том числе 30-й механизированной бригады в районе Бахмут, 28 районов сосредоточения живой силы и военной техники ВСУ, два склада ракетно-артиллерийского вооружения и боеприпасов в районах населенных пунктов Угледар и Константиновка Донецкой Народной Республики. В результате ударов уничтожены более 470 националистов, выведены из строя 68 единиц военной техники. Кроме того, в районе железнодорожной станции Мерефа Харьковской области уничтожена тяговая электроподстанция, обеспечивавшая доставку на Донбасс вооружение и военную технику из США и западных стран.\n\nОперативно-тактической и армейской авиацией поражены девять пунктов управления, 93 района сосредоточения живой силы и военной техники ВСУ, а также три склада боеприпасов в районе Лупарево и Шевченково Николаевской области.\n\nРакетными войсками и артиллерией поражены шесть пунктов управления, 224 района сосредоточения живой силы и военной техники ВСУ, 12 артиллерийских и минометных батарей на огневых позициях, четыре батареи РСЗО БМ-21 «Град» и две радиолокационные станции обнаружения воздушных целей.\n\nРоссийскими средствами противовоздушной обороны над населенными пунктами Питомник, Изюм, Снежковка, Ольховатка, Дементиевка, Русская Лозовая, Большие Проходы и Петровское Харьковской области, Старомихайловка, Новотамаровка, Новотроицкое, Невельское, Свердлово, Авдеевка и Владимировка Донецкой Народной Республики уничтожены 23 украинских беспилотных летательных аппарата. Также в районе Чернобаевки Херсонской области перехвачены восемь реактивных снарядов РСЗО «Смерч».\n\nВчера с 10.00 до 11.00 украинскими националистами из реактивных систем залпового огня «Смерч» нанесен удар по жилым кварталам города Херсон. Российскими средствами ПВО перехвачены все 10 украинских реактивных снарядов.\n\nХочу подчеркнуть, что подразделений российских войск в городе Херсон нет. Об этом киевскому режиму хорошо известно. Удар умышленно наносился по мирному населению Херсона в отместку за поддержку Российской Федерации.\n\nВсего с начала проведения специальной военной операции уничтожены: 168 самолетов, 125 вертолетов, 912 беспилотных летательных аппаратов, 309 зенитных ракетных комплексов, 3134 танка и других боевых бронированных машин, 385 установок реактивных систем залпового огня, 1542 орудия полевой артиллерии и миномета, а также 2983 единицы специальной военной автомобильной техники.",
    "url": "https://z.mil.ru/spec_mil_oper/brief/briefings/more.htm?id=12422066@egNews",
    "destroyed": {
      "САМОЛЕТЫ": 168,
      "ВЕРТОЛЕТЫ": 125,
      "БЕСПИЛОТНИКИ": 912,
      "ЗЕНИТКИ": 309,
      "ТАНКИ И БМ": 3134,
      "РСЗО": 385,
      "АРТИЛЛЕРИЯ И МИНОМЕТЫ": 1542,
      "АВТОМОБИЛЬНАЯ ТЕХНИКА": 2983
    }
  },
  "18.05.2022": {
    "date": "18.05.2022",
    "message": "В Мариуполе заблокированные на заводе «Азовсталь» боевики националистического подразделения «Азов» и украинские военнослужащие продолжали сдаваться в плен.\n\nЗа прошедшие сутки сдались в плен 694 боевика, в том числе 29 раненых. Всего с 16 мая сдались в плен 959 боевиков, в том числе 80 раненых, из которых 51 нуждавшийся в стационарном лечении помещены в больницу Новоазовска Донецкой Народной Республики.\n\nВооруженные Силы Российской Федерации продолжают специальную военную операцию на Украине. За сутки высокоточными ракетами воздушного базирования ВКС России поражены два пункта управления, в том числе штаб территориальной обороны в районе населенного пункта Соледар Донецкой Народной Республики, а также 31 район сосредоточения живой силы и украинской военной техники, включая расположения подразделений иностранных наемников из европейских стран в Николаеве и Красногоровке. Кроме того, уничтожены: на военном аэродроме в районе Днепропетровска два украинских самолета Су-24, в районе Николаева дивизион украинских зенитных ракетных комплексов С-300, а также четыре склада ракетно-артиллерийского вооружения и боеприпасов ВСУ в районах населенных пунктов Угледар, Покровское, Соледар и Бахмут Донецкой Народной Республики.\n\nОперативно-тактической и армейской авиацией поражены три пункта управления, 41 район сосредоточения живой силы и военной техники ВСУ, а также склад боеприпасов в районе населенного пункта Угледар Донецкой Народной Республики. В результате ударов авиации уничтожены более 270 националистов и выведены из строя 54 единицы военной техники. Ракетными войсками и артиллерией поражены 76 пунктов управления, 421 район сосредоточения живой силы и военной техники, а также 147 артиллерийских и минометных подразделений на огневых позициях, в том числе украинская батарея 155-миллиметровых гаубиц М777 производства США в районе населенного пункта Подгорное. В районе населенного пункта Протопоповка Харьковской области уничтожена наведенная подразделениями ВСУ для форсирования реки Северский Донец понтонная переправа.\n\nРоссийскими средствами противовоздушной обороны над населенным пунктом Триполье Донецкой Народной Республики сбит один украинский самолет Су-25. Кроме того, в районе населенного пункта Каменная Яруга Харьковской области сбит МиГ-29 воздушных сил Украины. В районах населенных пунктов Семеновка, Великие Проходы, Балаклея, Малые Проходы, Великая Камышеваха Харьковской области, Рудничный, Грабское, Старомихайловка, Вольное Донецкой Народной Республики, Беляевка, Чернобаевка Херсонской области уничтожены 15 украинских беспилотных летательных аппаратов. Также в районах населенных пунктов Каменка и Малая Камышеваха Харьковской области перехвачены восемь украинских реактивных снарядов системы залпового огня «Смерч».\n\nВсего с начала проведения специальной военной операции уничтожены: 172 самолета, 125 вертолетов, 927 беспилотных летательных аппаратов, 311 зенитных ракетных комплексов, 3139 танков и других боевых бронированных машин, 389 установок реактивных систем залпового огня, 1548 орудий полевой артиллерии и минометов, а также 2997 единиц специальной военной автомобильной техники.",
    "url": "https://z.mil.ru/spec_mil_oper/brief/briefings/more.htm?id=12422179@egNews",
    "destroyed": {
      "САМОЛЕТЫ": 172,
      "ВЕРТОЛЕТЫ": 125,
      "БЕСПИЛОТНИКИ": 927,
      "ЗЕНИТКИ": 311,
      "ТАНКИ И БМ": 3139,
      "РСЗО": 389,
      "АРТИЛЛЕРИЯ И МИНОМЕТЫ": 1548,
      "АВТОМОБИЛЬНАЯ ТЕХНИКА": 2997
    }
  },
  "19.05.2022": {
    "date": "19.05.2022",
    "message": "Вооруженные Силы Российской Федерации продолжают специальную военную операцию на Украине.\n\nЗа прошедшие сутки на заблокированном металлургическом комбинате «Азовсталь» в Мариуполе в плен сдался 771 боевик националистического подразделения «Азов». Всего с 16 мая в плен сдались 1730 боевиков, в том числе 80 раненых. Все нуждающиеся в стационарном лечении получают помощь в медучреждениях Донецкой Народной Республики в Новоазовске и Донецке.\n\nЗа сутки высокоточными ракетами воздушного базирования ВКС России поражены семь пунктов управления, в том числе командные пункты 24-й мотопехотной бригады ВСУ в населенном пункте Николаевка и 104-й бригады территориальной обороны в населенном пункте Константиновка, а также 11 складов ракетно-артиллерийского вооружения и боеприпасов в районах населенных пунктов Бахмут, Константиновка, Ильинка и Миньковка Донецкой Народной Республики и 26 районов сосредоточения живой силы и военной техники ВСУ.\n\nУничтожены: дивизион зенитных ракетных комплексов С-300 в районе Большие Ломзаки Николаевской области и дивизион ЗРК «Бук-М1» в районе Славяногорска Донецкой Народной Республики.\n\nОперативно-тактической и армейской авиацией поражены два пункта управления, а также 58 районов сосредоточения живой силы и украинской военной техники. Всего в результате ударов авиации уничтожены более 340 националистов, выведены из строя 62 единицы военной техники.\n\nРакетными войсками и артиллерией поражены шесть пунктов управления, 295 районов сосредоточения живой силы и военной техники ВСУ, 43 артиллерийских и минометных украинских подразделения на огневых позициях и две станции радиоэлектронной борьбы.\n\nРоссийскими средствами противовоздушной обороны в районах населенных пунктов Волчий Яр, Борщевка, Великие Хутора, Малые Проходы, Снежковка и Петровское Харьковской области, Чернобаевка и Новая Каховка Херсонской области уничтожены 15 украинских беспилотных летательных аппаратов, в том числе один БпЛА «Байрактар-ТБ2».\n\nКроме того, в районах населенных пунктов Топольское, Малая Камышеваха, Семеновка, Шпаковка, Глинское, Снежковка Харьковской области и Чернобаевка Херсонской области перехвачены 12 украинских реактивных снарядов системы залпового огня «Смерч».\n\nВсего с начала проведения специальной военной операции уничтожены: 172 самолета, 125 вертолетов, 942 беспилотных летательных аппарата, 313 зенитных ракетных комплексов, 3158 танков и других боевых бронированных машин, 395 установок реактивных систем залпового огня, 1562 орудия полевой артиллерии и минометов, а также 3026 единиц специальной военной автомобильной техники.",
    "url": "https://z.mil.ru/spec_mil_oper/brief/briefings/more.htm?id=12422278@egNews",
    "destroyed": {
      "САМОЛЕТЫ": 172,
      "ВЕРТОЛЕТЫ": 125,
      "БЕСПИЛОТНИКИ": 942,
      "ЗЕНИТКИ": 313,
      "ТАНКИ И БМ": 3158,
      "РСЗО": 395,
      "АРТИЛЛЕРИЯ И МИНОМЕТЫ": 1562,
      "АВТОМОБИЛЬНАЯ ТЕХНИКА": 3026
    }
  },
  "20.05.2022": {
    "date": "20.05.2022",
    "message": "Вооруженные Силы Российской Федерации продолжают специальную военную операцию на Украине.\n\nЗа сутки высокоточными ракетами воздушного базирования ВКС России поражены четыре пункта управления, 45 районов сосредоточения живой силы и военной техники, а также семь складов боеприпасов и горючего в населенных пунктах Бахмут, Берестовое, Соледар, Покровское, Константиновка и Масляковка Донецкой Народной Республики. Кроме того, уничтожены: пусковая установка зенитного ракетного комплекса «Оса-АКМ» в районе Северска и радиолокатор подсвета и наведения украинского зенитного ракетного комплекса С-300 в районе населенного пункта Барвенково Харьковской области.\n\nОперативно-тактической и армейской авиацией поражены три пункта управления и 47 районов сосредоточения живой силы и военной техники ВСУ. В результате ударов авиации уничтожены более 280 националистов, выведены из строя 59 единиц военной техники.\n\nРакетными войсками и артиллерией поражены 12 пунктов управления, 213 районов сосредоточения живой силы и военной техники, 24 артиллерийских и минометных подразделений на огневых позициях, а также три склада боеприпасов в районах населенного пункта Чугуев Харьковской области.\n\nРоссийскими средствами противовоздушной обороны сбиты в воздухе 10 украинских беспилотных летательных аппаратов в районах населенных пунктов Барвинок, Чернобаевка, Лазурное Херсонской области, Граково, Малые Проходы, Новая Гнилица, Чкаловское Харьковской области. Кроме того, в районах населенных пунктов Топольское, Малая Камышеваха, Снежковка Харьковской области и Чернобаевка Херсонской области перехвачены 17 украинских реактивных снарядов системы залпового огня «Смерч».\n\nВсего с начала проведения специальной военной операции уничтожены: 172 самолета, 125 вертолетов, 952 беспилотных летательных аппарата, 314 зенитных ракетных комплексов, 3168 танков и других боевых бронированных машин, 396 установок реактивных систем залпового огня, 1571 орудие полевой артиллерии и миномет, а также 3039 единиц специальной военной автомобильной техники.",
    "url": "https://z.mil.ru/spec_mil_oper/brief/briefings/more.htm?id=12422423@egNews",
    "destroyed": {
      "САМОЛЕТЫ": 172,
      "ВЕРТОЛЕТЫ": 125,
      "БЕСПИЛОТНИКИ": 952,
      "ЗЕНИТКИ": 314,
      "ТАНКИ И БМ": 3168,
      "РСЗО": 396,
      "АРТИЛЛЕРИЯ И МИНОМЕТЫ": 1571,
      "АВТОМОБИЛЬНАЯ ТЕХНИКА": 3039
    }
  },
  "21.05.2022": {
    "date": "21.05.2022",
    "message": "Вооруженные Силы Российской Федерации продолжают специальную военную операцию на Украине.\n\nВысокоточными ракетами большой дальности морского базирования «Калибр» в районе железнодорожной станции Малин Житомирской области уничтожена крупная партия вооружения и военной техники, доставленные из США и европейских стран для группировки украинских войск на Донбассе.\n\nВ районе Одессы, на «Одесском припортовом заводе», высокоточными ракетами воздушного базирования ВКС России уничтожены хранилища с топливом, предназначенным для бронетехники украинских националистов. Кроме того, высокоточными ракетами воздушного базирования поражены три пункта управления, в том числе командный пункт 109-й бригады территориальной обороны в районе населенного пункта Бахмут, 36 районов сосредоточения живой силы и военной техники ВСУ, а также восемь складов боеприпасов в населенных пунктах Галициново Николаевской области, Нырково Луганской Народной Республики, Красный Лиман и Очеретино Донецкой Народной Республики.\n\nОперативно-тактической и армейской авиацией поражены четыре пункта управления, 47 районов сосредоточения живой силы и военной техники ВСУ, а также уничтожен склад с боеприпасами в районе Дробышево.\n\nВсего в результате ударов авиации уничтожено более 270 националистов, выведены из строя 52 единицы военной техники. Также истребительной авиацией в ходе воздушного боя в районе населенного пункта Белицкое Донецкой Народной Республики сбит украинский самолет Су-25.\n\nРоссийскими средствами противовоздушной обороны еще один самолет Су-25 воздушных сил Украины сбит в районе Новоалександровки Херсонской области. Также сбиты в воздухе 14 украинских беспилотных летательных аппаратов в районах населенных пунктов Славное, Крутая Балка, Александровка, Красногоровка, Петропавловка, Первомайск Донецкой Народной Республики, Попасная Луганской Народной Республики, Новая Каховка, Александровка Херсонской области, Червоный Яр, Малые Проходы, Кунье и Бражковка Харьковской области.\n\nКроме того, сбиты восемь украинских реактивных снарядов системы залпового огня «Смерч»в районах населенных пунктов Малая Камышеваха, Каменка, Бражковка Харьковской области и Чернобаевка Херсонской области.\n\nРакетными войсками и артиллерией поражены 77 пунктов управления, 602 района сосредоточения живой силы и военной техники ВСУ, в том числе лагерь подготовки сил специальных операций ВСУ с личным составом в районе озера Сасик в Одесской области, 43 артиллерийских и минометных подразделения на огневых позициях, две батареи РСЗО «Град», 10 складов боеприпасов и пусковая установка ЗРК «Бук-М1» в районе населенного пункта Маяки Харьковской области.\n\nВсего с начала проведения специальной военной операции уничтожены: 174 самолета, 125 вертолетов, 966 беспилотных летательных аппарата, 315 зенитных ракетных комплексов, 3182 танка и других боевых бронированных машин, 402 установки реактивных систем залпового огня, 1614 орудия полевой артиллерии и миномета, а также 3054 единицы специальной военной автомобильной техники.",
    "url": "https://z.mil.ru/spec_mil_oper/brief/briefings/more.htm?id=12422515@egNews",
    "destroyed": {
      "САМОЛЕТЫ": 174,
      "ВЕРТОЛЕТЫ": 125,
      "БЕСПИЛОТНИКИ": 966,
      "ЗЕНИТКИ": 315,
      "ТАНКИ И БМ": 3182,
      "РСЗО": 402,
      "АРТИЛЛЕРИЯ И МИНОМЕТЫ": 1614,
      "АВТОМОБИЛЬНАЯ ТЕХНИКА": 3054
    }
  },
  "22.05.2022": {
    "date": "22.05.2022",
    "message": "Вооруженные Силы Российской Федерации продолжают специальную военную операцию на Украине.\n\nЗа сутки высокоточными ракетами воздушного базирования поражены три пункта управления, 13 районов сосредоточения живой силы и украинской военной техники, а также четыре склада боеприпасов в районах населенных пунктов Соледар, Соль Донецкой Народной Республики и Нырково Луганской Народной Республики.\n\nОперативно-тактической и армейской авиацией поражены три пункта управления, 26 районов сосредоточения живой силы и военной техники ВСУ, а также уничтожен склад с боеприпасами в районе населенного пункта Красный лиман.\n\nВсего в результате ударов авиации уничтожены более 210 националистов, выведены из строя 38 единиц украинской военной техники.\n\nРоссийскими средствами противовоздушной обороны в течение суток сбиты в воздухе 11 украинских беспилотных летательных аппаратов в районах населенных пунктов Курахово, Гусельское Донецкой Народной Республики, Попасная Луганской Народной Республики, Чернобаевка Херсонской области, Русская лозовая, Казачья лопань, Низшее, Малая камышеваха и Петровское Харьковской области.\n\nКроме того, в районах населенных пунктов Каменка и Букино Харьковской области перехвачены два украинскаих реактивных снаряда системы залпового огня «Смерч».\n\nРакетными войсками и артиллерией поражены 583 района сосредоточения живой силы и военной техники противника, 41 пункт управления, 76 артиллерийских и минометных подразделений на огневых позициях, в том числе три батареи РСЗО «Град», а также украинская станция РЭБ «Буковель» в районе населенного пункта Анновка Николаевской области.\n\nВсего с начала проведения специальной военной операции уничтожены: 174 самолета, 125 вертолетов, 977 беспилотных летательных аппаратов, 317 зенитных ракетных комплексов, 3198 танков и других боевых бронированных машин, 408 установок реактивных систем залпового огня, 1622 орудия полевой артиллерии и миномета, а также 3077 единиц специальной военной автомобильной техники.",
    "url": "https://z.mil.ru/spec_mil_oper/brief/briefings/more.htm?id=12422622@egNews",
    "destroyed": {
      "САМОЛЕТЫ": 174,
      "ВЕРТОЛЕТЫ": 125,
      "БЕСПИЛОТНИКИ": 977,
      "ЗЕНИТКИ": 317,
      "ТАНКИ И БМ": 3198,
      "РСЗО": 408,
      "АРТИЛЛЕРИЯ И МИНОМЕТЫ": 1622,
      "АВТОМОБИЛЬНАЯ ТЕХНИКА": 3077
    }
  },
  "23.05.2022": {
    "date": "23.05.2022",
    "message": "Вооруженные Силы Российской Федерации продолжают специальную военную операцию на Украине.\n\nВысокоточными ракетами большой дальности морского базирования в районе железнодорожной станции Малин Житомирской области уничтожено перебрасывавшееся на Донбасс вооружение и военная техника 10-й горно-штурмовой бригады ВСУ из Ивано-Франковска.\n\nЗа сутки высокоточными ракетами воздушного базирования поражены четыре пункта управления, узел связи оперативно-тактической группы «Север» в районе населенного пункта Бахмут Донецкой Народной Республики, 48 районов сосредоточения живой силы и военной техники, а также шесть складов боеприпасов в районах населенных пунктов Соледар, Соль, Бахмут, Берестовое, Закотное и Нырково Луганской Народной Республики. Также в районе населенного пункта Бахмут Донецкой Народной Республики уничтожен украинский зенитный ракетный комплекс «Оса-АКМ»\n\nОперативно-тактической и армейской авиацией поражены 39 районов сосредоточения живой силы и военной техники, а также уничтожен склад боеприпасов в районе Красный Лиман Луганской Народной Республики. Всего в результате ударов авиации уничтожены более 230 националистов, выведены из строя 33 единицы украинской военной техники.\n\nРоссийскими средствами противовоздушной обороны за сутки сбиты три самолета Су-25 воздушных сил Украины в том числе два – в районе населенного пункта Киселевка Херсонской области и один над Павлоградом Харьковской области. Также сбиты 13 украинских беспилотных летательных аппаратов в районах Червоный Яр, Чернобаевка, Мирное, Александровка Херсонской области, Юнокоммунаровск Донецкой Народной Республики, Хотомля, Синичино, Петровское, Терны Харьковской области, в том числе один «Байрактар ТБ-2» в районе Лозовая Харьковской области. Кроме того, перехвачены: над населенным пунктом Томина Балка Херсонской области две украинские баллистические ракеты «Точка-У», а в районах населенных пунктов Изюм, Топольское, Семеновка и Бикино Харьковской области восемь украинских реактивных снарядов системы залпового огня «Смерч».\n\nРакетными войсками и артиллерией поражены 73 пункта управления, 578 районов сосредоточения живой силы и военной техники ВСУ, а также 37 артиллерийских и минометных подразделений на огневых позициях. Уничтожены 13 танков и боевых машин пехоты, пять установок реактивных систем залпового огня «Град», а также три склада боеприпасов.\n\nВсего с начала проведения специальной военной операции уничтожены: 177 самолетов, 125 вертолетов, 990 беспилотных летательных аппаратов, 319 зенитных ракетных комплексов, 3226 танков и других боевых бронированных машин, 421 установка реактивных систем залпового огня, 1643 орудия полевой артиллерии и миномета, а также 3106 единиц специальной военной автомобильной техники.",
    "url": "https://z.mil.ru/spec_mil_oper/brief/briefings/more.htm?id=12422698@egNews",
    "destroyed": {
      "САМОЛЕТЫ": 177,
      "ВЕРТОЛЕТЫ": 125,
      "БЕСПИЛОТНИКИ": 990,
      "ЗЕНИТКИ": 319,
      "ТАНКИ И БМ": 3226,
      "РСЗО": 421,
      "АРТИЛЛЕРИЯ И МИНОМЕТЫ": 1643,
      "АВТОМОБИЛЬНАЯ ТЕХНИКА": 3106
    }
  },
  "24.05.2022": {
    "date": "24.05.2022",
    "message": "Вооруженные Силы Российской Федерации продолжают специальную военную операцию на Украине.\n\nЗа сутки высокоточными ракетами воздушного базирования поражены: три пункта управления, 36 районов сосредоточения живой силы и военной техники ВСУ, самоходный артиллерийский дивизион 14-й механизированной бригады в районе населенного пункта Соледар, а также шесть складов боеприпасов в районах Миньковка, Бахмут, Николаевка, Спорное и Красный Лиман Донецкой Народной Республики, в том числе один крупный склад 155-мм снарядов к американским гаубицам М-777 в Раздоловке.\n\nОперативно-тактической и армейской авиацией поражены: два пункта управления, три склада боеприпасов, 80 районов сосредоточения живой силы и украинской военной техники, а также зенитный ракетный комплекс «Бук-М1» в районе Пилипчатино Донецкой Народной Республики.\n\nВсего в результате ударов авиации уничтожены более 210 националистов, выведена из строя 31 единица военной техники.\n\nТакже российской истребительной авиацией в районе Крамоторска Донецкой Народной Республики сбит украинский самолет МиГ-29.\n\nРакетными войсками и артиллерией поражены 84 пункта управления, 463 района сосредоточения живой силы и военной техники ВСУ, а также 137 артиллерийских и минометных подразделений на огневых позициях.\n\nУничтожены 13 танков и боевых бронированых машин, четыре установки реактивных систем залпового огня «Град» и три склада боеприпасов.\n\nРоссийскими средствами противовоздушной обороны сбито пять беспилотных летательных аппаратов в районах Чернобаевка Херсонской области, Дибровное, Каменка, Питомник, Малые Проходы Харьковской области.\n\nКроме того, над населенными пунктами Топольское, Семеновка и Сухая Каменка Харьковской области перехвачены четыре украинских реактивных снаряда системы залпового огня «Смерч».\n\nВсего с начала проведения специальной военной операции уничтожены: 178 самолетов, 125 вертолетов, 995 беспилотных летательных аппаратов, 320 зенитных ракетных комплексов, 3243 танка и других боевых бронированных машин, 425 установок реактивных систем залпового огня, 1658 орудий полевой артиллерии и минометов, а также 3124 единицы специальной военной автомобильной техники.",
    "url": "https://z.mil.ru/spec_mil_oper/brief/briefings/more.htm?id=12422803@egNews",
    "destroyed": {
      "САМОЛЕТЫ": 178,
      "ВЕРТОЛЕТЫ": 125,
      "БЕСПИЛОТНИКИ": 995,
      "ЗЕНИТКИ": 320,
      "ТАНКИ И БМ": 3243,
      "РСЗО": 425,
      "АРТИЛЛЕРИЯ И МИНОМЕТЫ": 1658,
      "АВТОМОБИЛЬНАЯ ТЕХНИКА": 3124
    }
  },
  "25.05.2022": {
    "date": "25.05.2022",
    "message": "В освобожденном от украинских боевиков городе Мариуполь Донецкой Народной Республики завершены мероприятия по разминированию и демилитаризации морского порта, который начал функционирование в повседневном режиме.\n\nВооруженные Силы Российской Федерации продолжают специальную военную операцию на Украине.\n\nВысокоточными ракетами большой дальности воздушного и морского базирования в городе Запорожье уничтожены производственные цеха завода «Мотор Сич», выпускавшие авиационные двигатели для боевой авиации воздушных сил Украины, в том числе беспилотных летательных аппаратов.\n\nКроме того, в районе железнодорожной станции Покровское Днепропетровской области уничтожены подразделения резерва ВСУ, перебрасывавшиеся для усиления группировки украинских войск на Донбассе.\n\nЗа сутки высокоточными ракетами воздушного базирования поражены: три пункта управления, в том числе командный пункт14-й механизированной бригады и узел связи в районах Врубовки и Бахмута; радиотехнический центр ВСУ в районе населенного пункта Днепровское Николаевской области; логистический центр 72-й мотопехотной бригады в районе Соледара; две базы горючего в районах Ковягина и Безлюдовки Харьковской области; два радиолокационных поста ПВО и военная техника на базе хранения в районе населенного пункта Бахмут, а также 16 районов сосредоточения живой силы и военной техники ВСУ.\n\nОперативно-тактической и армейской авиацией поражены два склада ракетно-артиллерийского вооружения и боеприпасов в районах населенных пунктов Долина Харьковской области и Посад-Покровское Николаевской области, штаб территориальной обороны в населенном пункте Соледар, а также 46 районов сосредоточения живой силы и военной техники.\n\nВсего в результате ударов авиации уничтожены более 300 националистов, выведены из строя 46 единиц военной техники.\n\nРоссийскими средствами противовоздушной обороны над населенным пунктом БАРМАШОВО Николаевской области сбит один вертолет Ми-8 воздушных сил Украины.\n\nТакже сбиты в воздухе 11 украинских беспилотных летательных аппаратов в районах: острова Змеиный, населенных пунктов Глубокое, Першотравневое, Большие Проходы Харьковской области, Верхнеторецкое, Ставки, Терны, в том числе один «Байрактар ТБ-2» в районе Шандриголово Донецкой Народной Республики.\n\nРакетными войсками и артиллерией поражен 51 пункт управления ВСУ, 385 районов сосредоточения живой силы и военной техники, а также 53 артиллерийских и минометных подразделений на огневых позициях.\n\nВсего с начала проведения специальной военной операции уничтожены: 178 самолетов, 126 вертолетов, 1006 беспилотных летательных аппаратов, 322 зенитных ракетных комплекса, 3258 танков и других боевых бронированных машин, 430 установок реактивных систем залпового огня, 1671 орудие полевой артиллерии и минометов, а также 3155 единиц специальной военной автомобильной техники.",
    "url": "https://z.mil.ru/spec_mil_oper/brief/briefings/more.htm?id=12422983@egNews",
    "destroyed": {
      "САМОЛЕТЫ": 178,
      "ВЕРТОЛЕТЫ": 126,
      "БЕСПИЛОТНИКИ": 1006,
      "ЗЕНИТКИ": 322,
      "ТАНКИ И БМ": 3258,
      "РСЗО": 430,
      "АРТИЛЛЕРИЯ И МИНОМЕТЫ": 1671,
      "АВТОМОБИЛЬНАЯ ТЕХНИКА": 3155
    }
  },
  "26.05.2022": {
    "date": "26.05.2022",
    "message": "Вооруженные Силы Российской Федерации продолжают специальную военную операцию на Украине.\n\nЗа сутки высокоточными ракетами воздушного базирования поражены: 48 районов сосредоточения живой силы и военной техники ВСУ; две артиллерийские батареи, два склада боеприпасов в районах Николаевка и Берестовое Донецкой Народной Республики. В районе населенного пункта Днепровское Николаевской области уничтожен украинский центр радиоэлектронной разведки, в том числе 11 военнослужащих боевого расчета, а также 15 прибывших с охраной иностранных специалистов инженерно-технического и оперативного состава.\n\nКроме того, уничтожены: в районе населенного пункта Николаевка Донецкой Народной Республики пусковая установка зенитного ракетного комплекса «Оса-АКМ», и в районе Чугуева Харьковской области радиолокатор подсвета и наведения украинского зенитного ракетного комплекса С-300.\n\nОперативно-тактической и армейской авиацией поражены 49 районов сосредоточения живой силы и военной техники ВСУ, два минометных расчета, а также склад ракетно-артиллерийского вооружения и боеприпасов.\n\nВсего в результате ударов авиации уничтожены более 350-ти националистов, выведены из строя 96 единиц вооружения и военной техники.\n\nРоссийскими средствами противовоздушной обороны над населенным пунктом Гусаровка Харьковской области сбит один украинский вертолет Ми-24. Также сбит в воздухе доставлявший боеприпасы и вооружение военно-транспортный самолет воздушных сил Украины в районе Кремидовки Одесской области.\n\nКроме того, в районах  населенных пунктов Зеленый Гай Херсонской области, Большие и Малые Проходы, Гавриловка, Веселое Харьковской области, Епифановка, Кировск Луганской Народной Республики уничтожены 13 украинских беспилотных летательных аппаратов, в том числе два реактивных Ту-143 «Рейс» советского производства в районе населенного пункта МЕЛОВАТКА Луганской Народной Республики.\n\nРакетными войсками и артиллерией поражены 62 пункта управления, 407 районов сосредоточения живой силы и военной техники ВСУ, 47 артиллерийских и минометных подразделений на огневых позициях, а также три склада боеприпасов.\n\nВ районе железнодорожной станции Покровск Донецкой Народной Республики в результате удара уничтожены во время выгрузки подразделения и военная техника 10-й горно-штурмовой бригады ВСУ, прибывшие для усиления украинской группировки на Донбассе.\n\nВсего с начала проведения специальной военной операции уничтожены: 179 самолетов, 127 вертолетов, 1019 беспилотных летательных аппарата, 323 зенитных ракетных комплекса, 3266 танков и других боевых бронированных машин, 433 установки реактивных систем залпового огня, 1682 орудия полевой артиллерии и миномета, а также 3190 единиц специальной военной автомобильной техники.",
    "url": "https://z.mil.ru/spec_mil_oper/brief/briefings/more.htm?id=12423128@egNews",
    "destroyed": {
      "САМОЛЕТЫ": 179,
      "ВЕРТОЛЕТЫ": 127,
      "БЕСПИЛОТНИКИ": 1019,
      "ЗЕНИТКИ": 323,
      "ТАНКИ И БМ": 3266,
      "РСЗО": 433,
      "АРТИЛЛЕРИЯ И МИНОМЕТЫ": 1682,
      "АВТОМОБИЛЬНАЯ ТЕХНИКА": 3190
    }
  },
  "27.05.2022": {
    "date": "27.05.2022",
    "message": "Вооруженные Силы Российской Федерации продолжают специальную военную операцию на Украине.\n\nВысокоточными ракетами воздушного базирования ВКС России в районе населенного пункта Бахмут Донецкой Народной Республики нанесен удар по позициям 10-й отдельной горной штурмовой бригады ВСУ. Поражены семь командно-наблюдательных пунктов и тринадцать районов сосредоточения живой силы и военной техники.\n\nТакже, в районе Барвенково уничтожены пусковая установка зенитного ракетного комплекса «Бук-М1» и радиолокатор подсвета и наведения украинского зенитного ракетного комплекса С-300.\n\nКроме того, в районе Гусаровки Харьковской области уничтожена украинская радиолокационная станция наведения и целеуказания ПВО.\n\nОперативно-тактической и армейской авиацией поражены 44 района сосредоточения живой силы и украинской военной техники.\n\nВ результате ударов авиации уничтожены более 250 националистов, выведены из строя 84 единицы вооружения и военной техники, в том числе девять танков, пять установок реактивной системы залпового огня «Град», десять орудий полевой артиллерии и 22 автомобиля различного назначения.\n\nКроме того, в районе населенного пункта Спорное Донецкой Народной Республики и Барвенково Харьковской области уничтожены два склада боеприпасов.\n\nРоссийскими средствами противовоздушной обороны над населенным пунктом Беляры Одесской области сбит один самолет МиГ-29 воздушных сил Украины.\n\nКроме того, в районах населенных пунктов Липцы, Балаклея, Малые Проходы, Глубокое, Глинское Харьковской области, Ямполь, Масляковка, Васильевка Донецкой Народной Республики уничтожены восемь украинских беспилотных летательных аппаратов, а также перехвачена одна украинская баллистическая ракета «Точка-У» в районе Сватово Луганской Народной Республики.\n\nРакетными войсками и артиллерией поражены 77 пунктов управления подразделений ВСУ, 412 районов сосредоточения живой силы и военной техники, а также 53 артиллерийских огневых позиций.\n\nВ районе населенного пункта Завгороднее Харьковской области в результате удара по понтонной роте сорвана очередная попытка наведения понтонной переправы ВСУ через реку Северский Донец.\n\nВсего с начала проведения специальной военной операции уничтожены: 180 самолетов, 127 вертолетов, 1027 беспилотный летательный аппарат, 324 зенитных ракетных комплекса, 3281 танк и других боевых бронированных машин, 438 установок реактивных систем залпового огня, 1693 орудия полевой артиллерии и миномета, а также 3218 единиц специальной военной автомобильной техники.",
    "url": "https://z.mil.ru/spec_mil_oper/brief/briefings/more.htm?id=12423278@egNews",
    "destroyed": {
      "САМОЛЕТЫ": 180,
      "ВЕРТОЛЕТЫ": 127,
      "БЕСПИЛОТНИКИ": 1027,
      "ЗЕНИТКИ": 324,
      "ТАНКИ И БМ": 3281,
      "РСЗО": 438,
      "АРТИЛЛЕРИЯ И МИНОМЕТЫ": 1693,
      "АВТОМОБИЛЬНАЯ ТЕХНИКА": 3218
    }
  },
  "28.05.2022": {
    "date": "28.05.2022",
    "message": "Вооруженные Силы Российской Федерации продолжают специальную военную операцию на Украине.\n\nВ результате совместных действий подразделений народной милиции Донецкой Народной Республики и российских вооруженных сил полностью освобожден от украинских националистов город Красный Лиман.\n\nВысокоточными ракетами воздушного базирования ВКС России в населенном пункте Бахмут были уничтожены: передовой пункт управления 30-й механизированной бригады ВСУ и пункт управления бригады территориальной обороны в населенном пункте Соледар.\n\nКроме того, поражены: пять командно-наблюдательных пунктов, 17 районов сосредоточения живой силы и украинской военной техники, а также уничтожены четыре склада боеприпасов в районе Нырково, Бахмут и Мироновка Донецкой Народной Республики.\n\nОперативно-тактической и армейской авиацией за сутки поражены шесть пунктов управления, узел связи, четыре склада боеприпасов, две батареи РСЗО «Град», а также 50 районов сосредоточения живой силы и украинской военной техники.\n\nВ результате ударов авиации уничтожено более 260-ти националистов, кроме того, истребительной авиацией за сутки сбиты в воздухе два самолета Су-25 украинских воздушных сил над населенными пунктами Заградовка Херсонской области и Барвенкого Харьковской области.\n\nРоссийскими средствами противовоздушной обороны в районе населенного пункта Орехово Запорожской области сбит украинский вертолет Ми-8.\n\nТакже, за сутки сбиты в воздухе 18 украинских беспилотных летательных аппаратов в районах населенных пунктов Жовтневое, Питомник, Русская Лозовая, Липцы, Волохов Яр, Глубокое, Стрелечья, Петровское, Михайловка, Мосьпаново, Малые Проходы Харьковской области, Первомайск Луганской Народной Республики, Вознесенск Николаевской области.\n\nВ том числе один украинский ударный беспилотный летательный аппарат «Байрактар ТБ-2» сбит в районе населенного пункта ПОКРОВКА Николаевской области.\n\nКроме того, в районе Сватово в Луганской области перехвачена украинская баллистическая ракета «Точка-У» и в районах населенных пунктов Сухая Каменка Харьковской области и Голая Пристань Херсонской области сбиты семь реактивных снарядов РСЗО «Смерч».\n\nРакетными войсками и артиллерией поражены 57 пунктов управления, 618 районов сосредоточения живой силы и военной техники, 42 украинских артиллерийских и минометных подразделений на огневых позициях, две батареи реактивных систем залпового огня «Град».\n\nВсего с начала проведения специальной военной операции уничтожены: 182 самолета, 128 вертолетов, 1045 беспилотных летательных аппаратов, 324 зенитных ракетных комплекса, 3297 танков и других боевых бронированных машин, 444 установки реактивных систем залпового огня, 1714 орудий полевой артиллерии и минометов, а также 3245 единиц специальной военной автомобильной техники.",
    "url": "https://z.mil.ru/spec_mil_oper/brief/briefings/more.htm?id=12423406@egNews",
    "destroyed": {
      "САМОЛЕТЫ": 182,
      "ВЕРТОЛЕТЫ": 128,
      "БЕСПИЛОТНИКИ": 1045,
      "ЗЕНИТКИ": 324,
      "ТАНКИ И БМ": 3297,
      "РСЗО": 444,
      "АРТИЛЛЕРИЯ И МИНОМЕТЫ": 1714,
      "АВТОМОБИЛЬНАЯ ТЕХНИКА": 3245
    }
  },
  "29.05.2022": {
    "date": "29.05.2022",
    "message": "Вооруженные Силы Российской Федерации продолжают специальную военную операцию на Украине.\n\nВысокоточными ракетами большой дальности ВКС России уничтожен крупный арсенал ВСУ на складской территории одного из предприятий в Кривом Роге Днепропетровской области. За сутки высокоточными ракетами воздушного базирования поражены три пункта управления, 25 районов сосредоточения живой силы и военной техники ВСУ и две артиллерийских батареи на огневых позициях. Уничтожена пусковая установка зенитного ракетного комплекса «Оса-АКМ» в районе населенного пункта Николаевка Донецкой Народной Республики, радиолокационная станция обнаружения и сопровождения воздушных целей в районе Богуславка Харьковской области, пять складов боеприпасов в районах Красногоровка, Покровское Донецкой Народной Республики, Северодонецк Луганской Народной Республики и Безруков Харьковской области.\n\nОперативно-тактической, армейской и беспилотной авиацией поражены два пункта управления, а также 53 района сосредоточения живой силы и военной техники ВСУ.\n\nВсего в результате ударов российской авиации уничтожены более 300 националистов и до 50 единиц военной и специальной техники ВСУ.\n\nРоссийскими средствами противовоздушной обороны в районе населенного пункта Новогригоровка Днепропетровской области сбит в воздухе один самолет Су-25 воздушных сил Украины. В районах населенных пунктов Малые Проходы, Питомник Харьковской области, Миролюбовка Днепропетровской области и Нижняя Крынка Донецкой Народной Республики уничтожены четыре украинских беспилотных летательных аппарата. В районе населенного пункта Малая Камышеваха Харьковской области перехвачен украинский реактивный снаряд системы залпового огня «Смерч».\n\nРакетными войсками и артиллерией поражены 62 пункта управления, 596 районов сосредоточения живой силы и военной техники, а также 52 позиции артиллерийских и минометных подразделений украинских националистов.\n\nВсего с начала проведения специальной военной операции уничтожены: 183 самолета, 128 вертолетов, 1049 беспилотных летательных аппаратов, 325 зенитных ракетных комплексов, 3309 танков и других боевых бронированных машин, 447 установок реактивных систем залпового огня, 1722 орудия полевой артиллерии и миномета, а также 3270 единиц специальной военной автомобильной техники.",
    "url": "https://z.mil.ru/spec_mil_oper/brief/briefings/more.htm?id=12423493@egNews",
    "destroyed": {
      "САМОЛЕТЫ": 183,
      "ВЕРТОЛЕТЫ": 128,
      "БЕСПИЛОТНИКИ": 1049,
      "ЗЕНИТКИ": 325,
      "ТАНКИ И БМ": 3309,
      "РСЗО": 447,
      "АРТИЛЛЕРИЯ И МИНОМЕТЫ": 1722,
      "АВТОМОБИЛЬНАЯ ТЕХНИКА": 3270
    }
  },
  "30.05.2022": {
    "date": "30.05.2022",
    "message": "Вооруженные Силы Российской Федерации продолжают специальную военную операцию на Украине.\n\nВысокоточными ракетами воздушного базирования поражены два командно-наблюдательных пункта батальонов ВСУ, узел связи, а также 34 района сосредоточения живой силы и военной техники ВСУ.\n\nОперативно-тактической, армейской и беспилотной авиацией поражены три пункта управления и 67 районов сосредоточения живой силы и военной техники ВСУ.\n\nВсего в результате ударов авиации за сутки уничтожено до 320 националистов, а также 47 единиц вооружения и военной техники ВСУ.\n\nРоссийскими средствами противовоздушной обороны сбиты 15 украинских беспилотных летательных аппаратов в районах населенных пунктов Северодонецк, Новочервоное, Василевка Луганской Народной Республики, Пантелеймоновка, Григоровка, Красногоровка, Невельское Донецкой Народной Республики, Петраполье, Петровское, Глинское Харьковской области, Чернобаевка и Александровка Херсонской области.\n\nКроме того, в районах населенных пунктов Малая Камышеваха, Каменка, Бражковка, Глинское Харьковской области и Чернобаевка Херсонской области перехвачены 9 украинских реактивных снарядов системы залпового огня «Смерч».\n\nРакетными войсками и артиллерией поражены 62 пункта управления, в том числе оперативного командования «Юг» в районе населенного пункта Новый Буг Николаевской области, а также 593 района сосредоточения живой силы и военной техники ВСУ и 55 артиллерийских и минометных батарей на огневых позициях.\n\nУничтожены четыре установки реактивной системы залпового огня БМ-21 «Град», 46 единиц вооружения и украинской военной техники, а также склад боеприпасов в районе Новомихайловки Донецкой Народной Республики.\n\nКроме того, в результате артиллерийского удара по ангару на территории судостроительного завода «Океан» в городе Николаев уничтожено более 15 украинских танков и боевых машин пехоты и 5 артиллерийских орудий крупного калибра.\n\nВсего с начала проведения специальной военной операции уничтожены: 183 самолета, 128 вертолетов, 1064 беспилотных летательных аппарата, 325 зенитных ракетных комплексов, 3323 танка и других боевых бронированных машин, 451 установка реактивных систем залпового огня, 1731 орудие полевой артиллерии и миномет, а также 3294 единицы специальной военной автомобильной техники.",
    "url": "https://z.mil.ru/spec_mil_oper/brief/briefings/more.htm?id=12423589@egNews",
    "destroyed": {
      "САМОЛЕТЫ": 183,
      "ВЕРТОЛЕТЫ": 128,
      "БЕСПИЛОТНИКИ": 1064,
      "ЗЕНИТКИ": 325,
      "ТАНКИ И БМ": 3323,
      "РСЗО": 451,
      "АРТИЛЛЕРИЯ И МИНОМЕТЫ": 1731,
      "АВТОМОБИЛЬНАЯ ТЕХНИКА": 3294
    }
  },
  "31.05.2022": {
    "date": "31.05.2022",
    "message": "В ходе обследования в Мариуполе подземных сооружений металлургического комбината «Азовсталь», где укрывались сдавшиеся в плен нацисты украинского формирования «Азов», российскими военнослужащими был обнаружен изотермический фургон.\n\nВ фургоне с неработавшей системой охлаждения были складированы 152 тела погибших боевиков и военнослужащих ВСУ.\n\nНапомню, что командование «Азова» перед сдачей в плен публично обращалось к Зеленскому забрать тела погибших, чтобы семьи смогли захоронить их на подконтрольной киевскому режиму территории. Однако никаких запросов со стороны Киева о получении тел погибших с комбината «Азовсталь» не поступало.\n\nБолее того, во время обследования фургона российские саперы выявили установленные под телами погибших украинских военнослужащих четыре мины. Совокупная масса взрывчатого вещества в них была достаточна для уничтожения всех оставшихся в фургоне останков тел.\n\nПо результатам допросов пленных боевиков «Азова» установлено, что минирование тел было проведено по прямому указанию из Киева.\n\nЦель провокации – обвинить Россию в намеренном уничтожении останков тел и не допустить их вывоза для передачи родственникам, чтобы спасти политическую «репутацию» киевского режима и лично Зеленского.\n\nРоссийская сторона в ближайшее время планирует передать обнаруженные на территории комбината «Азовсталь» тела украинских боевиков и военнослужащих представителям Украины.\n\nВооруженные Силы Российской Федерации продолжают специальную военную операцию на Украине.\n\nЗа сутки высокоточными ракетами воздушного базирования поражены четыре пункта управления, а также 13 районов сосредоточения живой силы и украинской военной техники.\n\nОперативно-тактической, армейской и беспилотной авиацией поражены три пункта управления, 69 районов сосредоточения живой силы и военной техники, радиолокационная станция и два склада боеприпасов ВСУ в районах населенных пунктов Райгородок и Николаевка Донецкой Народной Республики.\n\nВсего в результате ударов авиации уничтожено до 290 националистов и 23 единицы вооружения и военной техники ВСУ.\n\nКроме того, в районе населенного пункта Кобзарцы Николаевской области сбит самолет Су-25 воздушных сил Украины.\n\nРоссийскими средствами противовоздушной обороны сбито шесть украинских беспилотных летательных аппаратов в районах населенных пунктов Донецк, Макеевка Донецкой Народной Республики, Попасная Луганской Народной Республики, Липцы, Большие Проходы Харьковской области, в том числе один беспилотный летательный аппарат сбит в районе острова Змеиный.\n\nРакетными войсками и артиллерией поражено: 38 пунктов управления, 417 районов сосредоточения живой силы и военной техники, 46 огневых позиций артиллерийских и минометных батарей.\n\nУничтожены 36 единиц вооружения и военной техники, в том числе украинская батарея реактивной системы залпового огня «Ураган», батарея реактивной системы залпового огня «Град», два склада боеприпасов, а также склад топлива.\n\nВсего с начала проведения специальной военной операции уничтожены: 184 самолета, 128 вертолетов, 1070 беспилотных летательных аппарата, 325 зенитных ракетных комплексов, 3342 танка и других боевых бронированных машин, 454 установки реактивных систем залпового огня, 1738 орудий полевой артиллерии и минометов, а также 3311 единиц специальной военной автомобильной техники.",
    "url": "https://z.mil.ru/spec_mil_oper/brief/briefings/more.htm?id=12423729@egNews",
    "destroyed": {
      "САМОЛЕТЫ": 184,
      "ВЕРТОЛЕТЫ": 128,
      "БЕСПИЛОТНИКИ": 1070,
      "ЗЕНИТКИ": 325,
      "ТАНКИ И БМ": 3342,
      "РСЗО": 454,
      "АРТИЛЛЕРИЯ И МИНОМЕТЫ": 1738,
      "АВТОМОБИЛЬНАЯ ТЕХНИКА": 3311
    }
  },
  "01.06.2022": {
    "date": "01.06.2022",
    "message": "Вооруженные Силы Российской Федерации продолжают специальную военную операцию на Украине.\n\nВысокоточными ракетами воздушного базирования ВКС России поражены пять пунктов управления, а также 29 районов сосредоточения живой силы и военной техники ВСУ.\n\nКроме того, оперативно-тактической, армейской и беспилотной авиацией за сутки поражен 61 район сосредоточения живой силы и военной техники ВСУ. Всего в результате ударов авиации уничтожено более 140 националистов, а также 9 танков и боевых машин пехоты, батарея реактивных систем залпового огня БМ-21 «Град», шесть артиллерийских орудий и минометов, 13 автомобилей ВСУ различного предназначения и один зенитный ракетный комплекс «ОСА-АКМ»,\n\nРоссийскими средствами противовоздушной обороны за сутки сбит один самолет Су-25 воздушных сил Украины в районе Сергеевки Донецкой Народной Республики и один вертолет Ми-8 в районе Харькова.\n\nКроме того, сбито семь украинских беспилотных летательных аппаратов в районах населенных пунктов Горловка, Гольмовский, Ясиноватая, Варваровка Донецкой Народной Республики, Малые Проходы, Новая Гнилица Харьковской области, Пятихатка Херсонской области. Также в районах населенных пунктов Малая Камышеваха и Каменка Харьковской области перехвачены две украинские ракеты реактивной системы залпового огня «Смерч».\n\nРакетными войсками и артиллерией поражены 128 пунктов управления, 169 огневых позиций артиллерийских и минометных батарей, а также 623 района сосредоточения живой силы и военной техники ВСУ. Уничтожено до 200 националистов, а также 24 единицы вооружения и военной техники, в том числе батарея 155-мм гаубиц М777, 203-мм орудие 2С7 «Пион», боевая машина БМ-21 реактивной системы залпового огня «Град» и два склада боеприпасов.\n\nВсего с начала проведения специальной военной операции уничтожены: 185 самолетов, 129 вертолетов, 1077 беспилотных летательных аппаратов, 326 зенитных ракетных комплексов, 3363 танка и других боевых бронированных машин, 457 установок реактивных систем залпового огня, 1744 орудия полевой артиллерии и минометов, а также 3329 единиц специальной военной автомобильной техники.",
    "url": "https://z.mil.ru/spec_mil_oper/brief/briefings/more.htm?id=12423847@egNews",
    "destroyed": {
      "САМОЛЕТЫ": 185,
      "ВЕРТОЛЕТЫ": 129,
      "БЕСПИЛОТНИКИ": 1077,
      "ЗЕНИТКИ": 326,
      "ТАНКИ И БМ": 3363,
      "РСЗО": 457,
      "АРТИЛЛЕРИЯ И МИНОМЕТЫ": 1744,
      "АВТОМОБИЛЬНАЯ ТЕХНИКА": 3329
    }
  },
  "02.06.2022": {
    "date": "02.06.2022",
    "message": "Вооруженные Силы Российской Федерации продолжают специальную военную операцию на Украине.\n\nВысокоточными ракетами воздушного базирования поражен 21 район сосредоточения живой силы и военной техники ВСУ, в том числе пункты управления украинских нацистских формирований «Кракен» и «Азов» в районе Харькова.\n\nОперативно-тактической, армейской и беспилотной авиацией поражено 15 районов сосредоточения живой силы и украинской военной техники. Уничтожены склады боеприпасов и топлива ВСУ в районах населенных пунктов Долина и Славянск Донецкой Народной Республики.\n\nВсего в результате ударов авиации уничтожено до 240 националистов, 39 единиц вооружения и военной техники, в том числе зенитный ракетный комплекс «Оса-АКМ», 10 танков и боевых машин пехоты, три установки реактивных систем залпового огня БМ-21 «Град», семь артиллерийских орудий и минометов, а также 17 специальных автомобилей.\n\nИстребительной авиацией сбит один самолет Су-25 воздушных сил Украины в районе населенного пункта Любомировка Николаевской области.\n\nРоссийскими средствами противовоздушной обороны за сутки уничтожено семь украинских беспилотных летательных аппаратов в районах населенных пунктов Одесса, Камышеваха, Попасная, Золотое, Кудряшовка Луганской Народной Республики, Яровая Харьковской области, а также Верхнеторецкое Донецкой Народной Республики.\n\nРакетными войсками и артиллерией поражен 131 пункт управления, 146 артиллерийских и минометных батарей на огневых позициях, а также 579 районов сосредоточения живой силы и военной техники ВСУ.\n\nВсего с начала проведения специальной военной операции уничтожено: 186 самолетов, 129 вертолетов, 1084 беспилотных летательных аппарата, 327 зенитных ракетных комплексов, 3373 танка и других боевых бронированных машин, 460 установок реактивных систем залпового огня, 1752 орудия полевой артиллерии и миномета, а также 3350 единиц специальной военной автомобильной техники.\n\n* * *\n\nОтмечаем, что с начала мая фактически иссяк приток на Украину иностранных наемников для участия в боевых действиях против российских Вооруженных Сил.\n\nПо имеющимся в нашем распоряжении данным, на сегодняшний день общая численность иностранных наемников на Украине сократилась практически в два раза — с 6,6 до 3,5 тыс. человек. При этом число наемников в боевых подразделениях ВСУ и нацгвардии на Донбассе сократилось на порядки.\n\nСотни иностранных наемников на Украине были уничтожены российским высокоточным оружием большой дальности вскоре после прибытия еще в местах прохождения ими доподготовки и слаживания тактических подразделений.\n\nНо большая часть наемников уничтожена в зоне боевых действий вследствие низкого уровня подготовки и отсутствия реального боевого опыта.\n\nОтдельно обращаем внимание, что командиры подразделений ВСУ и нацгвардии Украины, в состав которых попадали наемники, стремясь снизить потери своих военнослужащих, не жалеют иностранцев. Захваченные в плен наемники рассказывают на допросах, что ими жертвуют в первую очередь. Вследствие замалчивания потерь киевским режимом и отсутствия останков, родственники наемников в странах проживания об их гибели просто не знают.\n\nСтолкнувшись с реальной боевой обстановкой и большими потерями среди военнослужащих ВСУ, нацгвардиии и иностранцев, значительное число наемников предпочитает поскорее покинуть территорию Украины, но киевский режим всячески препятствует их выезду за рубеж.\n\nНапомню, что в соответствии с международным гуманитарным правом, наемники не являются комбатантами, и лучшее, что их ожидает, — уголовная ответственность.\n\nЭкстренные попытки киевского режима гарантировать наемникам правовую защиту, включая их в списочный состав воинских подразделений ВСУ или нацгвардии, или выдавая им свежие паспорта граждан Украины, никого из них не спасут.",
    "url": "https://z.mil.ru/spec_mil_oper/brief/briefings/more.htm?id=12424004@egNews",
    "destroyed": {
      "САМОЛЕТЫ": 186,
      "ВЕРТОЛЕТЫ": 129,
      "БЕСПИЛОТНИКИ": 1084,
      "ЗЕНИТКИ": 327,
      "ТАНКИ И БМ": 3373,
      "РСЗО": 460,
      "АРТИЛЛЕРИЯ И МИНОМЕТЫ": 1752,
      "АВТОМОБИЛЬНАЯ ТЕХНИКА": 3350
    }
  },
  "03.06.2022": {
    "date": "03.06.2022",
    "message": "Вооруженные Силы Российской Федерации продолжают специальную военную операцию на Украине.\n\nЗа сутки высокоточными ракетами воздушного базирования ВКС России поражен 21 район сосредоточения живой силы и военной техники ВСУ.\n\nКроме того, оперативно-тактической, армейской и беспилотной авиацией поражены 37 районов сосредоточения живой силы и украинской военной техники.\n\nВсего в результате ударов авиации уничтожено более 360 националистов, 49 единиц вооружения и военной техники, в том числе радиолокационная станция обнаружения и контроля воздушного пространства в Славянске Донецкой Народной Республики.\n\nТакже уничтожены 13 украинских танков и боевых машин пехоты, зенитный ракетный комплекс «Оса-АКМ» в районе Бахмут, две минометных батареи, две установки реактивных систем залпового огня «Град», восемь артиллерийских орудий, 26 специальных автомобилей, а также четыре склада ракетно-артиллерийского вооружения в районах населенных пунктов Соледар, Дзержинск, Яковлевка и Бахмут.\n\nРоссийскими средствами противовоздушной обороны за сутки уничтожены три украинских беспилотных летательных аппарата в районах Рясная, Крутая Балка Донецкой Народной Республики и Дмитровка Харьковской области. Также перехвачены три реактивных снаряда системы залпового огня «Ураган» над населенными пунктами Петрополье, Каменка Харьковской области и Новоселовка Вторая Донецкой Народной Республики.\n\nРакетными войсками и артиллерией поражены 26 пунктов управления, 122 артиллерийские и минометные батареи ВСУ на огневых позициях, 537 районов сосредоточения живой силы и военной техники, а также пять складов боеприпасов.\n\nВ районе населенного пункта Первомайское Николаевской области уничтожен пункт управления беспилотными летательными аппаратами ВСУ.\n\nВсего с начала проведения специальной военной операции уничтожены: 186 самолетов, 129 вертолетов, 1087 беспилотных летательных аппаратов, 328 зенитных ракетных комплексов, 3386 танков и других боевых бронированных машин, 462 установки реактивных систем залпового огня, 1760 орудий полевой артиллерии и минометов, а также 3376 единиц специальной военной автомобильной техники.\n\n* * *\n\nНа фоне политической катастрофы Киева в Мариуполе и военных провалов на Донбассе киевским режимом при финансовой поддержке Великобритании организованы съемки «духоподъемных» видеосюжетов для западной и украинской аудиторий.\n\nВ частности, 28 мая в районе населенного пункта Мешковка Николаевской области отсняты постановочные видеоматериалы о якобы «высокой эффективности» применения украинскими националистами западного вооружения.\n\nДля придания будущей картине большего драматизма, по настоянию британских кураторов, на съемочной площадке была создана «реконструкция» никогда не существовавшего боя украинских нацистов с превосходящими по численности «российскими военнослужащими».\n\nРоли «противников» украинских нацистов в постановочной короткометражке исполнили нацепившие повязки красного цвета члены местного подразделения территориальной обороны.\n\nЗа отсутствием трофейной российской техники условный противник в кадре появляется на украинских БТР и бронемашинах.\n\nСледующие съемки видеосюжетов спланированы на 5 и 6 июня. Видеоматериалы будут посвящены постановочным свидетельствам «простых украинцев», обвиняющих Россию в якобы намеренных обстрелах мирных населенных пунктов.",
    "url": "https://z.mil.ru/spec_mil_oper/brief/briefings/more.htm?id=12424125@egNews",
    "destroyed": {
      "САМОЛЕТЫ": 186,
      "ВЕРТОЛЕТЫ": 129,
      "БЕСПИЛОТНИКИ": 1087,
      "ЗЕНИТКИ": 328,
      "ТАНКИ И БМ": 3386,
      "РСЗО": 462,
      "АРТИЛЛЕРИЯ И МИНОМЕТЫ": 1760,
      "АВТОМОБИЛЬНАЯ ТЕХНИКА": 3376
    }
  },
  "04.06.2022": {
    "date": "04.06.2022",
    "message": "Вооруженные Силы Российской Федерации продолжают специальную военную операцию на Украине.\n\nВысокоточными ракетами воздушного базирования нанесен удар по центру артиллерийской подготовки ВСУ в районе населенного пункта Стецковка Сумской области.\n\nВ данном центре прибывшими иностранными инструкторами осуществлялось практическое обучение украинских военнослужащих эксплуатации и управлению огнем 155-миллиметровых гаубиц М777. Также, в районе Дачное Одесской области в результате ракетного удара уничтожен пункт дислокации иностранных наемников.\n\nКроме того, поражены 27 районов сосредоточения живой силы и военной техники ВСУ, а также уничтожены два пункта управления ВСУ, шесть складов ракетно-артиллерийского вооружения, боеприпасов и горючего в районах населенных пунктов Веселое, Бахмут Донецкой Народной Республики, Спорное, Подлесное И Лоскутовка Луганской Народной Республики.\n\nОперативно-тактической, армейской и беспилотной авиацией поражены 54 района сосредоточения живой силы и военной техники ВСУ.\n\nВсего в результате ударов авиации уничтожено более 400 националистов, 20 танков и бронемашин, четыре установки реактивных систем залпового огня БМ-21 «Град», девять артиллерийских орудий и 29 автомобилей различного назначения.\n\nРоссийскими средствами противовоздушной обороны в районе Одессы сбит доставлявший вооружение и боеприпасы самолет военно-транспортной авиации воздушных сил Украины.\n\nТакже за сутки уничтожены 17 беспилотных летательных аппаратов в районах населенных пунктов Попасная, Варваровка, Стаханов Луганской Народной Республики, Дементьевка, Волхов Яр, Мосьпаново, Новая Гнилица, Дослипное, Большие Проходы, Капитоловка Харьковской области, Новоалександровка Николаевской области. В том числе в районе Каменка Николаевской области российскими средствами ПВО сбиты два беспилотных летательных аппарата «Байрактар-ТБ2».\n\nРакетными войсками и артиллерией за сутки поражено: 33 пункта управления, 131 огневая позиция артиллерийских подразделений ВСУ, а также 542 района сосредоточения живой силы и военной техники.\n\nВсего с начала проведения специальной военной операции уничтожены: 187 самолетов, 129 вертолетов, 1104 беспилотных летательных аппарата, 328 зенитных ракетных комплексов, 3406 танков и других боевых бронированных машин, 466 установок реактивных систем залпового огня, 1769 орудий полевой артиллерии и минометов, а также 3405 единиц специальной военной автомобильной техники.",
    "url": "https://z.mil.ru/spec_mil_oper/brief/briefings/more.htm?id=12424253@egNews",
    "destroyed": {
      "САМОЛЕТЫ": 187,
      "ВЕРТОЛЕТЫ": 129,
      "БЕСПИЛОТНИКИ": 1104,
      "ЗЕНИТКИ": 328,
      "ТАНКИ И БМ": 3406,
      "РСЗО": 466,
      "АРТИЛЛЕРИЯ И МИНОМЕТЫ": 1769,
      "АВТОМОБИЛЬНАЯ ТЕХНИКА": 3405
    }
  },
  "05.06.2022": {
    "date": "05.06.2022",
    "message": "Вооруженные Силы Российской Федерации продолжают специальную военную операцию на Украине.\n\nВКС России высокоточными ракетами воздушного базирования большой дальности на окраине Киева уничтожены поставленные восточноевропейскими странами танки Т-72 и другая бронетехника, размещенные в корпусах вагонно-ремонтного предприятия.\n\nВысокоточными ракетами воздушного базирования в населенных пунктах Краматорск, Дружковка и Часов Яр Донецкой Народной Республики уничтожены заводские цеха, в которых осуществлялся ремонт и восстановление для ВСУ военной техники, поврежденной в ходе боевых действий.\n\nКроме того, за сутки поражены пункты управления 81-й и 95-й десантно-штурмовых бригад ВСУ, а также 6 районов сосредоточения живой силы и украинской военной техники.\n\nВ результате ударов уничтожено: две пусковых установки зенитного ракетного комплекса «Оса-АКМ» в районах населенных пунктов Черкасское Донецкой Народной Республики и Орехов Запорожской области, две боевые машины реактивных систем залпового огня в районе населенного пункта Коротыч Харьковской области, три склада ракетно-артиллерийского вооружения в районах Маяки и Славянск Донецкой Народной Республики, а также радиолокационная станция контрбатарейной борьбы производства США AN/TPQ-50 в районе Северска Донецкой Народной Республики,\n\nОперативно-тактической и армейской авиацией поражено: три пункта управления, 65 районов сосредоточения живой силы и военной техники, и три склада боеприпасов.\n\nВсего в результате ударов авиации уничтожено более 350 националистов, 10 танков и бронеавтомобилей, две установки реактивных систем залпового огня «Град», девять артиллерийских орудий, 14 специальных автомобилей, а также в районе железнодорожной станции Константиновка цистерны с топливом, предназначенным для группировки войск ВСУ на Донбассе, и два склада боеприпасов в районах населенных пунктов Бахмут Донецкой Народной Республики и Лоскутовка Луганской Народной Республики.\n\nВ ходе воздушного боя в районе населенного пункта Славянск Донецкой Народной Республики сбит самолет МиГ-29 воздушных сил Украины.\n\nРоссийскими средствами противовоздушной обороны в районе Одессы сбит самолет военно-транспортной авиации Ан-26 воздушных сил Украины, перевозивший вооружение и военную технику.\n\nТакже за сутки уничтожены 10 беспилотных летательных аппаратов в районах населенных пунктов Видрождення, Рясное, Святогорск Донецкой Народной Республики, Кировск, Прудовка, Боровеньки, Варваровка Луганской Народной Республики, Волчий Яр, Большие Проходы Харьковской области, Зазорное Запорожской области, в том числе в районе Березовки Харьковской области – беспилотный летательных аппарат «Байрактар ТБ2».\n\nКроме того, над населенным пунктом Новогеоргиевка Николаевской области перехвачены две тактические ракеты «Точка-У», а в районах населенных пунктов Сухая Каменка, Долгенькое и Каменка Харьковской области сбиты три украинских снаряда реактивной системы залпового огня «Ураган».\n\nРакетными войсками и артиллерией поражено: 46 пунктов управления, 123 артиллерийских и минометных подразделений на огневых позициях, а также 498 районов сосредоточения живой силы и военной техники ВСУ.\n\nВсего с начала проведения специальной военной операции уничтожены: 189 самолетов, 129 вертолетов, 1114 беспилотных летательных аппаратов, 330 зенитных ракетных комплексов, 3416 танков и других боевых бронированных машин, 470 установок реактивных систем залпового огня, 1778 орудий полевой артиллерии и минометов, а также 3419 единиц специальной военной автомобильной техники.",
    "url": "https://z.mil.ru/spec_mil_oper/brief/briefings/more.htm?id=12424347@egNews",
    "destroyed": {
      "САМОЛЕТЫ": 189,
      "ВЕРТОЛЕТЫ": 129,
      "БЕСПИЛОТНИКИ": 1114,
      "ЗЕНИТКИ": 330,
      "ТАНКИ И БМ": 3416,
      "РСЗО": 470,
      "АРТИЛЛЕРИЯ И МИНОМЕТЫ": 1778,
      "АВТОМОБИЛЬНАЯ ТЕХНИКА": 3419
    }
  },
  "06.06.2022": {
    "date": "06.06.2022",
    "message": "Вооруженные Силы Российской Федерации продолжают специальную военную операцию на Украине.\n\nВКС России высокоточными ракетами воздушного базирования большой дальности на окраине населенного пункта Лозовая Харьковской области уничтожены производственные корпуса кузнечно-механического завода, в которых осуществлялось восстановление и ремонт бронетехники ВСУ.\n\nКроме того, высокоточными ракетами воздушного базирования поражено четыре пункта управления ВСУ, а также 15 районов скопления живой силы и украинской военной техники.\n\nОперативно-тактической и армейской авиацией поражены 73 района скопления живой силы и военной техники ВСУ. В результате ударов авиации уничтожено: два пункта управления, более 150 националистов, три склада ракетно-артиллерийского вооружения и склад горючего в районе Кодема Донецкой Народной Республики, восемь танков и бронеавтомобилей, установка реактивных систем залпового огня «Град», батарея полевой артиллерии, 10 специальных автомобилей, а также радиолокационная станция контрбатарейной борьбы производства США AN/TPQ-50 в районе Северска Донецкой Народной Республики.\n\nРоссийскими средствами противовоздушной обороны в районе населенного пункта Славянск Донецкой Народной Республики сбит самолет МиГ-29 воздушных сил Украины\n\nТакже уничтожены 13 украинских беспилотных летательных аппаратов в районах населенных пунктов Ясиноватая, Ставки Донецкой Народной Республики, Волчеяровка, Боровеньки Луганской Народной Республики, Балаклея, Глубокое, Вербовка, Липцы, Михайловка Харьковской области, Токмак Запорожской области.\n\nРакетными войсками и артиллерией поражен 431 район скопления живой силы и военной техники ВСУ, семь пунктов управления и 34 огневых позиций артиллерийских и минометных подразделений.\n\nВ результате ударов артиллерии уничтожено более 300 националистов, 10 танков, две установки реактивных систем залпового огня «Град», 17 специальных автомобилей, 17 орудий полевой артиллерии и минометов, а также три склада ракетно-артиллерийского вооружения ВСУ в районе Горловки.\n\nВсего с начала проведения специальной военной операции уничтожено: 190 самолетов, 129 вертолетов, 1127 беспилотных летательных аппарата, 330 зенитных ракетных комплексов, 3424 танка и других боевых бронированных машин, 473 установки реактивных систем залпового огня, 1795 орудий полевой артиллерии и минометов, а также 3446 единиц специальной военной автомобильной техники.",
    "url": "https://z.mil.ru/spec_mil_oper/brief/briefings/more.htm?id=12424424@egNews",
    "destroyed": {
      "САМОЛЕТЫ": 190,
      "ВЕРТОЛЕТЫ": 129,
      "БЕСПИЛОТНИКИ": 1127,
      "ЗЕНИТКИ": 330,
      "ТАНКИ И БМ": 3424,
      "РСЗО": 473,
      "АРТИЛЛЕРИЯ И МИНОМЕТЫ": 1795,
      "АВТОМОБИЛЬНАЯ ТЕХНИКА": 3446
    }
  },
  "07.06.2022": {
    "date": "07.06.2022",
    "message": "Вооруженные Силы Российской Федерации продолжают специальную военную операцию на Украине.\n\nВысокоточными ракетами воздушного базирования поражено два пункта управления, три огневые позиции артиллерийских батарей, а также 18 районов скопления живой силы и украинский военной техники.\n\nВ районах населенных пунктов Врубовка и Яковлевка Луганской Народной Республики уничтожены два склада боеприпасов.\n\nОперативно-тактической авиацией поражены 65 районов сосредоточения живой силы и техника ВСУ.\n\nВ результате ударов авиации уничтожено более 170 националистов, девять танков, две установки реактивных систем залпового огня «Град», батарея полевой артиллерии и восемь автомобилей различного назначения.\n\nРоссийскими средствами противовоздушной обороны за сутки сбито 12 украинских беспилотных летательных аппаратов в районах населенных пунктов Липцы, Стрелечье, Дементьевка, Бородоярское, Марьино, Петровское, Граково, Малые Проходы Харьковской области, а также Васильевка Николаевской области.\n\nРакетными войсками и артиллерией поражено 39 пунктов управления, 47 огневых позиций артиллерийских подразделений ВСУ, а также 426 районов сосредоточения живой силы и военной техники.\n\nВ результате ударов уничтожено более 400 националистов, 10 единиц бронетехники, три установки реактивных систем залпового огня «Град», 10 специальных автомобилей, а также три пусковых установки зенитных ракетных комплексов С-300 в районе Краматорска.\n\nКроме того, в результате ударов артиллерии уничтожена одна переданная Норвегией 155-мм самоходная установка М109А3, две 155-мм гаубицы М777 производства США, а также семь орудий полевой артиллерии и минометов, в том числе 203-мм самоходная артиллерийская установка «Пион».\n\nВсего с начала проведения специальной военной операции уничтожено: 190 самолетов, 129 вертолетов, 1139 беспилотных летательных аппаратов, 333 зенитных ракетных комплекса, 3443 танка и других боевых бронированных машин, 478 установок реактивных систем залпового огня, 1807 орудий полевой артиллерии и минометов, а также 3464 единицы специальной военной автомобильной техники.",
    "url": "https://z.mil.ru/spec_mil_oper/brief/briefings/more.htm?id=12424543@egNews",
    "destroyed": {
      "САМОЛЕТЫ": 190,
      "ВЕРТОЛЕТЫ": 129,
      "БЕСПИЛОТНИКИ": 1139,
      "ЗЕНИТКИ": 333,
      "ТАНКИ И БМ": 3443,
      "РСЗО": 478,
      "АРТИЛЛЕРИЯ И МИНОМЕТЫ": 1807,
      "АВТОМОБИЛЬНАЯ ТЕХНИКА": 3464
    }
  },
  "08.06.2022": {
    "date": "08.06.2022",
    "message": "Украинская группировка на Донбассе несет значительные потери в живой силе, вооружении и военной технике. Только в ходе освобождения Святогорска в Донецкой Народной Республике за три дня боев потери украинских войск составили более 300 националистов, шесть танков, 15 боевых бронированных машин различных типов, 36 орудий полевой артиллерии и минометов, четыре установки реактивной системы залпового огня «Град» и свыше 20 единиц автомобильной техники.\n\nВооруженные Силы Российской Федерации продолжают специальную военную операцию на Украине.\n\nВысокоточными ракетами воздушного базирования в районе Харькова нанесен удар по бронетанковому заводу, в цехах которого осуществлялся ремонт и восстановление танков и другой бронетехники ВСУ. Кроме того, высокоточными ракетами воздушного базирования поражены два пункта управления, 13 районов сосредоточения живой силы и военной техники ВСУ, а также в районе Харькова — батарея реактивных систем залпового огня «Ураган». В районах Малиновки Харьковской области, Спорное Донецкой Народной Республики, Звановка Луганской Народной Республики уничтожены четыре склада с вооружением и боеприпасами. В районе населенного пункта Чугуев Харьковской области уничтожено хранилище топлива для техники ВСУ.\n\nОперативно-тактической авиацией за сутки поражено 63 района скопления живой силы и военной техники ВСУ. В результате ударов авиации уничтожен пункт управления 14-й механизированной бригады ВСУ, более 160 националистов, восемь танков, две установки реактивных систем залпового огня «Град», артиллерийская батарея, станция радиоэлектронной борьбы и 13 автомобилей различного назначения.\n\nРоссийскими средствами противовоздушной обороны сбиты два самолета МиГ-29 воздушных сил Украины в районе населенного пункта Снегиревка Николаевской области, а также вертолет Ми-8 в районе населенного пункта Белая Криница Николаевской области. Кроме того, сбито 11 украинских беспилотных летательных аппаратов в районах населенных пунктов Донецк, Рубцы, Лозовое, Краснореченское, Коровий Яр, Пески-Радьковские Донецкой Народной Республики, Изюм, Дергачи Харьковской области и Чернобаевка Херсонской области. Перехвачены три ракеты оперативно-тактического комплекса «Точка-У» и пять реактивных снарядов системы залпового огня «Смерч» в районе Чернобаевки Херсонской области.\n\nРакетными войсками и артиллерией поражено: 68 пунктов управления, 172 огневые позиции артиллерии ВСУ, в том числе две батареи реактивных систем залпового огня «Смерч» районе Александровки и Кутузовки, батарея РСЗО «Ураган» в районе населенного пункта Кицевка Харьковской области, а также 261 район сосредоточения живой силы и военной техник ВСУ. В результате ударов уничтожено более 320 националистов, четыре склада боеприпасов в районе Новоеленовки Запорожской области, девять единиц бронетехники, три установки реактивных систем залпового огня «Град», 15 орудий полевой артиллерии и минометов, 14 специальных автомобилей, а также боевые машины зенитных ракетных комплексов «Бук-М1» в районе Шелкоплясы и «Оса-АКМ» в Верхней Роганке Харьковской области.\n\nВсего с начала проведения специальной военной операции уничтожено: 192 самолета, 130 вертолетов, 1150 беспилотных летательных аппаратов, 335 зенитных ракетных комплексов, 3459 танков и других боевых бронированных машин, 489 установок реактивных систем залпового огня, 1822 орудия полевой артиллерии и миномета, а также 3488 единиц специальной военной автомобильной техники.",
    "url": "https://z.mil.ru/spec_mil_oper/brief/briefings/more.htm?id=12424655@egNews",
    "destroyed": {
      "САМОЛЕТЫ": 192,
      "ВЕРТОЛЕТЫ": 130,
      "БЕСПИЛОТНИКИ": 1150,
      "ЗЕНИТКИ": 335,
      "ТАНКИ И БМ": 3459,
      "РСЗО": 489,
      "АРТИЛЛЕРИЯ И МИНОМЕТЫ": 1822,
      "АВТОМОБИЛЬНАЯ ТЕХНИКА": 3488
    }
  },
  "09.06.2022": {
    "date": "09.06.2022",
    "message": "Инженерные подразделения Вооруженных Сил Российской Федерации приступили к разминированию дорог и лесного массива национального парка «Святые горы» в районах населенных пунктов Святогорск, Яровая, Студенок и Сосновое Донецкой Народной Республики.\n\nЗа прошедшие сутки обнаружено и уничтожено 126 установленных украинскими националистами взрывных устройств различных типов, в том числе 54 противотанковые мины.\n\nВооруженные Силы Российской Федерации продолжают специальную военную операцию на Украине.\n\nВ результате удара высокоточными ракетами воздушного базирования в районе населенного пункта Новоград-Волынский Житомирской области уничтожен учебный центр ВСУ, в котором проходили переподготовку и слаживание иностранные наемники.\n\nКроме того, высокоточными ракетами воздушного базирования за сутки уничтожены: два пункта управления, зенитный ракетный комплекс «Оса-АКМ» в районе населенного пункта Раздоловка Донецкой Народной Республики, склад боеприпасов в районе Парасковиевка Луганской Народной Республики, а также поражено 23 района сосредоточения живой силы и военной техники ВСУ.\n\nОперативно-тактической и армейской авиацией поражено 18 районов сосредоточения живой силы и военная техника ВСУ.\n\nВ результате ударов авиации уничтожено более 200 националистов, пять танков, две установки реактивной системы залпового огня «Град», а также склад ракетно-артиллерийского вооружения в районе населенного пункта Верхнекаменское Луганской Народной Республики.\n\nРоссийскими средствами противовоздушной обороны сбит самолет Су-25 воздушных сил Украины в районе населенного пункта Мазановка Донецкой Народной Республики,\n\nТакже, сбиты 13 украинских беспилотных летательных аппаратов в районах населенных пунктов Славное, Пречистовка, Кудряшовка, Епифановка Донецкой Народной Республики, Варваровка, Боровеньки Луганской Народной Республики, Токмак Запорожской области, Петровское, Сулиговка Харьковской области, Снегиревка, Александровка и курган Могила Кулича Херсонской области.\n\nКроме того, в районе населенного пункта Кирово Херсонской области перехвачена украинская баллистическая ракета «Точка-У» и в районах Каменка Харьковской области и Пантелеймоновка Донецкой Народной Республики сбиты два реактивных снаряда РСЗО «Смерч».\n\nРакетными войсками и артиллерией поражено 56 пунктов управления, 127 огневых позиций артиллерийских подразделений ВСУ, а также 273 района сосредоточения живой силы и военной техники.\n\nВ результате ударов за сутки уничтожено: более 300 националистов, семь единиц бронетехники, две установки реактивных систем залпового огня «Град», 12 орудий полевой артиллерии и минометов, 24 специальных автомобиля, хранилище топлива для военной техники в районе населенного пункта Кобзарцы в Николаевской области, а также наведенная ВСУ переправа через реку Северский Донец в районе населенного пункта Протопоповка.\n\nВсего с начала проведения специальной военной операции уничтожены: 193 самолета, 130 вертолетов, 1163 беспилотных летательных аппарата, 336 зенитных ракетных комплексов, 3471 танк и других боевых бронированных машин, 493 установки реактивных систем залпового огня, 1834 орудия полевой артиллерии и миномета, а также 3512 единиц специальной военной автомобильной техники.",
    "url": "https://z.mil.ru/spec_mil_oper/brief/briefings/more.htm?id=12424762@egNews",
    "destroyed": {
      "САМОЛЕТЫ": 193,
      "ВЕРТОЛЕТЫ": 130,
      "БЕСПИЛОТНИКИ": 1163,
      "ЗЕНИТКИ": 336,
      "ТАНКИ И БМ": 3471,
      "РСЗО": 493,
      "АРТИЛЛЕРИЯ И МИНОМЕТЫ": 1834,
      "АВТОМОБИЛЬНАЯ ТЕХНИКА": 3512
    }
  },
  "10.06.2022": {
    "date": "10.06.2022",
    "message": "&nbsp;\n\nИнженерные подразделения Вооруженных Сил Российской Федерации продолжают разминирование дорог и лесного массива национального парка «Святые горы» в районе освобожденных населенных пунктов Святогорск, Яровая, Студенок и Сосновое.\n\nК настоящему времени российскими военнослужащими очищено более пяти квадратных километров территории населенных пунктов Яровая и Студенок, обнаружено и уничтожено 224 взрывных устройства, в том числе 66 противотанковых мин.\n\nВооруженные Силы Российской Федерации продолжают специальную военную операцию на Украине.\n\nВысокоточными ракетами воздушного базирования на военном аэродроме Днепр уничтожена авиационная техника воздушных сил Украины. В районе Харькова уничтожены производственные мощности предприятия по восстановлению вооружения и военной техники ВСУ.\n\nКроме того, высокоточными ракетами воздушного базирования поражено: два пункта управления, 27 районов сосредоточения живой силы и военной техники ВСУ, пять огневых позиций украинской артиллерии, в том числе две батареи реактивных систем залпового огня в районах Соледара и Прасковиевки Донецкой Народной Республики, а также пять складов ракетно-артиллерийского вооружения и боеприпасов в районах Бахмута, Берестового Донецкой Народной Республики и Лоскутовки Луганской Народной Республики.\n\nОперативно-тактической и армейской авиацией поражено 46 районов сосредоточения живой силы и военной техники ВСУ. В результате ударов авиации уничтожено более 150 националистов, шесть танков, четыре орудия полевой артиллерии, две установки украинских реактивных систем залпового огня «Град».\n\nРоссийскими средствами противовоздушной обороны за сутки сбиты два самолета воздушных сил Украины: один Су-25 в районе Долгенького Харьковской области и один МиГ-29 в районе населенного пункта Ингулец Днепропетровской области.\n\nТакже уничтожены пять украинских беспилотных летательных аппаратов в районах населенных пунктов Лозовая, Глубокое Харьковской области, Борозенское Херсонской области, Невское Донецкой Народной Республики, Попасная Луганской Народной Республики.\n\nКроме того, перехвачены четыре ракеты тактического комплекса «Точка-У» в районах Попасная Луганской Народной Республики, Ледовка, Калиново Харьковской области и три снаряда реактивной системы залпового огня «Ураган» в районах Малая Камышеваха, Нижнее Купье Харьковской области и Яковлевка Донецкой Народной Республики.\n\nРакетными войсками и артиллерией поражено 62 пункта управления, 138 огневых позиций артиллерии, а также 303 района сосредоточения живой силы и военной техники ВСУ.\n\nВ результате ударов артиллерии уничтожено: более 350 националистов, семь единиц бронетехники, две установки реактивных систем залпового огня «Град», пять орудий полевой артиллерии и минометов, 16 специальных автомобилей, а также 11 складов ракетно-артиллерийского вооружения, боеприпасов и горючего.\n\nВсего с начала проведения специальной военной операции уничтожены: 195 самолетов, 130 вертолетов, 1168 беспилотных летательных аппаратов, 336 зенитных ракетных комплексов, 3484 танка и других боевых бронированных машин, 499 установок реактивных систем залпового огня, 1843 орудия полевой артиллерии и миномета, а также 3528 единиц специальной военной автомобильной техники.",
    "url": "https://z.mil.ru/spec_mil_oper/brief/briefings/more.htm?id=12424862@egNews",
    "destroyed": {
      "САМОЛЕТЫ": 195,
      "ВЕРТОЛЕТЫ": 130,
      "БЕСПИЛОТНИКИ": 1168,
      "ЗЕНИТКИ": 336,
      "ТАНКИ И БМ": 3484,
      "РСЗО": 499,
      "АРТИЛЛЕРИЯ И МИНОМЕТЫ": 1843,
      "АВТОМОБИЛЬНАЯ ТЕХНИКА": 3528
    }
  },
  "11.06.2022": {
    "date": "11.06.2022",
    "message": "Вооруженные Силы Российской Федерации продолжают специальную военную операцию на Украине.\n\nВ районе Андреевки Харьковской области высокоточными ракетами воздушного базирования уничтожен пункт дислокации иностранных наемников.\n\nКроме того, за прошедшие сутки поражено: 9 районов сосредоточения живой силы и военной техники ВСУ, пять огневых позиций подразделений реактивных систем залпового огня в районах населенных пунктов Малорязанцево, Волчеяровка, Подгорное, Малая Ильиновка и Лисичанск Луганской Народной Республики, а также уничтожен зенитный ракетный комплекс «Бук-М1» в районе Миньковки Донецкой Народной Республики.\n\nОперативно-тактической и армейской авиацией поражено 48 районов сосредоточения живой силы и военной техники ВСУ.\n\nВ результате ударов авиации уничтожено более 170 националистов, пять танков, шесть орудий полевой артиллерии, 8 специальных автомобилей, а также уничтожен склад боеприпасов в районе Краснополье Донецкой Народной Республики.\n\nРоссийскими средствами противовоздушной обороны за прошедшие сутки сбиты: два самолета МиГ-29 воздушных сил Украины в районе населенного пункта Снегиревка Николаевской области и один Су-25 в районе Александровки Харьковской области.\n\nТакже сбито: 12 украинских беспилотных летательных аппаратов в районах населенных пунктов Ильичевка, Чкаловское, Красное, Малые Проходы, Заводы, Бражковка, Вернополье, Оводмитровская, Грушеваха Харьковской области, Васильевка, Стаханов, Теплогорск Луганской Народной Республики.\n\nКроме того, перехвачены три реактивных снаряда украинской системы залпового огня «Ураган» в районах Долгенькое, Сухая Каменка и Малая Камышеваха Харьковской области.\n\nРакетными войсками и артиллерией за сутки поражен 231 район сосредоточения живой силы и военной техники ВСУ, а также 13 пунктов управления и 42 огневых позиций артиллерийских подразделений.\n\nУничтожено более 300 националистов, 11 единиц бронетехники, две установки реактивных систем залпового огня «Град», 10 орудий полевой артиллерии, 9 специальных автомобилей, а также 9 полевых складов ракетно-артиллерийского вооружения, боеприпасов и горючего.\n\nВсего с начала проведения специальной военной операции уничтожены: 198 самолетов, 130 вертолетов, 1180 беспилотных летательных аппаратов, 337 зенитных ракетных комплексов, 3503 танка и других боевых бронированных машин, 506 установок реактивных систем залпового огня, 1859 орудий полевой артиллерии и минометов, а также 3545 единиц специальной военной автомобильной техники.",
    "url": "https://z.mil.ru/spec_mil_oper/brief/briefings/more.htm?id=12424947@egNews",
    "destroyed": {
      "САМОЛЕТЫ": 198,
      "ВЕРТОЛЕТЫ": 130,
      "БЕСПИЛОТНИКИ": 1180,
      "ЗЕНИТКИ": 337,
      "ТАНКИ И БМ": 3503,
      "РСЗО": 506,
      "АРТИЛЛЕРИЯ И МИНОМЕТЫ": 1859,
      "АВТОМОБИЛЬНАЯ ТЕХНИКА": 3545
    }
  },
  "12.06.2022": {
    "date": "12.06.2022",
    "message": "Вооруженные Силы Российской Федерации продолжают специальную военную операцию на Украине.\n\nВысокоточными ракетами большой дальности морского базирования «Калибр» в районе населенного пункта Чортков Тернопольской области уничтожен крупный склад поставленных киевскому режиму из США и европейских стран противотанковых ракетных комплексов, переносных зенитных ракетных комплексов и артиллерийские снарядов к системам вооружения.\n\nЗа прошедшие сутки высокоточными ракетами воздушного базирования поражены два пункта управления и 15 районов сосредоточения живой силы и военной техники ВСУ.\n\nУничтожены: пусковая установка зенитного ракетного комплекса «Бук-М1» в районе населенного пункта Барвенково Харьковской области, радиолокационная станция контроля воздушного пространства в районе Славянска Донецкой Народной Республики, радиолокатор обнаружения и сопровождения целей зенитного ракетного комплекса С-300 в районе Кривого Рога, а также две батареи реактивных систем залпового огня в районах Звановка Луганской Народной Республики и Закотное Донецкой Народной Республики.\n\nОперативно-тактической и армейской авиацией поражены три пункта управления и 25 районов сосредоточения живой силы и военной техники.\n\nВ результате ударов авиации уничтожено более 150 националистов, шесть танков, пять орудий полевой артиллерии и 10 специальных автомобилей различного назначения.\n\nИстребительной авиацией сбиты два самолета Су-25 воздушных сил Украины в районах Райгородок и Черкасское Донецкой Народной Республики.\n\nРоссийскими средствами противовоздушной обороны сбит один самолет Су-25 воздушных сил Украины в районе Долгенькое Харьковской области.\n\nТакже, сбито восемь украинских беспилотных летательных аппаратов в районах населенных пунктов Боровеньки, Дружба Луганской Народной Республики, Владимировка Донецкой Народной Республики, Бражковка, Большие Проходы Харьковской области, в том числе один «Байрактар ТБ-2» в районе населенного пункта Великая Камышеваха.\n\nКроме того, над населенными пунктами Каховка и Чернобаевка Херсонской области перехвачены две украинские баллистические ракеты «Точка-У» и три реактивных снаряда системы залпового огня «Ураган» в районах Долгенькое, Синичино Харьковской области, Попасная Луганской Народной Республики.\n\nРакетными войсками и артиллерией поражено 248 районов сосредоточения живой силы и военной техники ВСУ, 21 пункт управления, а также 37 огневых позиций артиллерийских подразделений ВСУ.\n\nВ результате ударов уничтожено: более 320 националистов, пять единиц бронетехники, шесть орудий полевой артиллерии и минометов, 15 специальных автомобилей и пять складов боеприпасов и топлива.\n\nВсего с начала проведения специальной военной операции уничтожены: 201 самолет, 130 вертолетов, 1188 беспилотных летательных аппаратов, 338 зенитных ракетных комплексов, 3514 танка и других боевых бронированных машин, 508 установок реактивных систем залпового огня, 1870 орудий полевой артиллерии и минометов, а также 3570 единиц специальной военной автомобильной техники.",
    "url": "https://z.mil.ru/spec_mil_oper/brief/briefings/more.htm?id=12425042@egNews",
    "destroyed": {
      "САМОЛЕТЫ": 201,
      "ВЕРТОЛЕТЫ": 130,
      "БЕСПИЛОТНИКИ": 1188,
      "ЗЕНИТКИ": 338,
      "ТАНКИ И БМ": 3514,
      "РСЗО": 508,
      "АРТИЛЛЕРИЯ И МИНОМЕТЫ": 1870,
      "АВТОМОБИЛЬНАЯ ТЕХНИКА": 3570
    }
  },
  "13.06.2022": {
    "date": "13.06.2022",
    "message": "Вооруженные Силы Российской Федерации продолжают специальную военную операцию на Украине.\n\nВысокоточными ракетами воздушного базирования в районе железнодорожной станции Удачное Донецкой народной республики уничтожено большое количество доставленного для группировки украинских националистов вооружения и военной техники, в том числе из США и европейских стран.\n\nКроме того, уничтожены: пункт временной дислокации иностранных наемников в районе Федоровки Луганской Народной Республики, а также две батареи реактивных систем залпового огня в районах Прогресс Харьковской области и Волчеяровка Луганской Народной Республики.\n\nОперативно-тактической и армейской авиацией поражены: один пункт управления, радиолокационная станция зенитного ракетного комплекса «Бук-М1» в районе Лисичанска Луганской Народной Республики, а также 63 района сосредоточения живой силы и военной техники ВСУ.\n\nВ результате ударов авиации уничтожено более 120 националистов, два танка, семь орудий полевой артиллерии и 11 специальных автомобилей.\n\nРоссийскими средствами противовоздушной обороны за сутки сбиты восемь украинских беспилотных летательных аппаратов в районах населенных пунктов Шевченково, Костромка Николаевской области, Балаклея, Бородоярское Харьковской области, Старомихайловка, Опытное Донецкой Народной Республики, Смоляниново, Попасная, Лисичанск Луганской Народной Республики, в том числе «Байрактар ТБ-2» в районе Луганска.\n\nРакетными войсками и артиллерией поражено 247 районов сосредоточения живой силы и военной техники ВСУ, 13 пунктов управления, 63 огневых позиций артиллерийских подразделений ВСУ, в том числе семь установок реактивных систем залпового огня в районах Артемовска, Славянска, Соледара и населенного пункта Соль, а также станция радиоэлектронной борьбы в районе Покровского Донецкой Народной Республики.\n\nВсего с начала проведения специальной военной операции уничтожены: 201 самолет, 130 вертолетов, 1196 беспилотных летательных аппаратов, 338 зенитных ракетных комплексов, 3525 танков и других боевых бронированных машин, 515 установок реактивных систем залпового огня, 1933 орудия полевой артиллерии и минометов, а также 3583 единицы специальной военной автомобильной техники.",
    "url": "https://z.mil.ru/spec_mil_oper/brief/briefings/more.htm?id=12425136@egNews",
    "destroyed": {
      "САМОЛЕТЫ": 201,
      "ВЕРТОЛЕТЫ": 130,
      "БЕСПИЛОТНИКИ": 1196,
      "ЗЕНИТКИ": 338,
      "ТАНКИ И БМ": 3525,
      "РСЗО": 515,
      "АРТИЛЛЕРИЯ И МИНОМЕТЫ": 1933,
      "АВТОМОБИЛЬНАЯ ТЕХНИКА": 3583
    }
  },
  "14.06.2022": {
    "date": "14.06.2022",
    "message": "Вооруженные Силы Российской Федерации продолжают специальную военную операцию на Украине.\n\nВысокоточными ракетами большой дальности «Калибр» в районе населенного пункта Прилуки Черниговской области уничтожен арсенал артиллерийского вооружения и боеприпасов ВСУ.\n\nКроме того, высокоточными ракетами воздушного базирования поражены 11 районов сосредоточения живой силы и украинской военной техники, восемь огневых позиций артиллерийских подразделений ВСУ, в том числе три взвода реактивных систем залпового огня «Град» в районах населенных пунктов Бахмут и Переездное Донецкой Народной Республики, Лисичанск Луганской Народной Республики, а также два склада боеприпасов на южной окраине Харькова и в районе Горского Луганской Народной Республики.\n\nОперативно-тактической и армейской авиацией поражен 101 район сосредоточения живой силы и военной техники ВСУ. В результате ударов авиации уничтожено более 350 националистов, три пункта управления, 13 танков и других боевых бронированных машин, шесть установок реактивных систем залпового огня «Град», 14 орудий полевой артиллерии и 22 специальных автомобиля.\n\nРоссийскими средствами противовоздушной обороны за сутки сбиты: самолет МиГ-29 воздушных сил Украины в районе Славянска Донецкой Народной Республики и вертолет Ми-24 в районе Снегиревки Николаевской области.\n\nТакже сбиты девять украинских беспилотных летательных аппаратов в районах населенных пунктов Червоная Гусаровка, Большие Проходы, Малая Камышеваха Харьковской области, Апостолово Днепропетровской области, Донецк, Левковка, Яковлевка Донецкой Народной Республики.\n\nКроме того, перехвачены: украинская баллистическая ракета «Точка-У» в районе Вернополье Харьковской области и 14 реактивных снарядов РСЗО «Смерч» в районах населенных пунктов Донецк, Александровка Донецкой Народной Республики, Попасная Луганской Народной Республики и Сухая Каменка Харьковской области.\n\nРакетными войсками и артиллерией за сутки поражено: 280 районов сосредоточения живой силы и военной техники ВСУ, 18 пунктов управления, 59 огневых позиций артиллерийских и минометных подразделений, а также склад горючего в районе Константиновки Донецкой Народной Республики.\n\nВсего с начала проведения специальной военной операции уничтожены: 202 самолета, 131 вертолет, 1205 беспилотных летательных аппаратов, 338 зенитных ракетных комплексов, 3548 танков и других боевых бронированных машин, 521 установка реактивных систем залпового огня, 1947 орудий полевой артиллерии и минометов, а также 3605 единиц специальной военной автомобильной техники.\n\n***\n\nВ ходе специальной военной операции украинская армия продолжает нести значительные потери.\n\nОсобо отмечу, что в последние недели в районах боевых действий участились инциденты с расстрелом украинских военнослужащих в спину националистическими подразделениями.\n\nТак, после проведения огневой подготовки наступления российских войск в районе населенного пункта Новомихайловка Донецкой Народной Республики более 30 военнослужащих 25-го батальона 54-й механизированной бригады ВСУ приняли решение сложить оружие и сдаться.\n\nЗанимавшие опорный пункт в районе Зверофермы украинские военнослужащие обратились по радиосвязи к командованию российского подразделения прекратить огонь и предоставить коридор для выхода.\n\nОколо 22 часов военнослужащие ВСУ с белыми флагами начали продвижение в сторону российских позиций.\n\nВ этот момент прибывшее к опорному пункту на бронеавтомобилях подразделение заградотряда украинских националистов открыло по военнослужащим 54-й бригады ВСУ перекрестный огонь в спину.\n\nВ результате данного расстрела получили смертельные ранения и погибли 32 украинских военнослужащих.\n\nДанный инцидент, как и многие другие подобные, наглядно показывает, что на фоне нарастающих военных провалов и деморализации украинских войск киевский националистический режим пытается остановить отступление и сдачу в плен своих подразделений карательными акциями заградотрядов.\n\nЖизни украинских военнослужащих и мобилизованных бойцов подразделений территориальной обороны для нынешнего руководства Украины не значат ничего.",
    "url": "https://z.mil.ru/spec_mil_oper/brief/briefings/more.htm?id=12425226@egNews",
    "destroyed": {
      "САМОЛЕТЫ": 202,
      "ВЕРТОЛЕТЫ": 131,
      "БЕСПИЛОТНИКИ": 1205,
      "ЗЕНИТКИ": 338,
      "ТАНКИ И БМ": 3548,
      "РСЗО": 521,
      "АРТИЛЛЕРИЯ И МИНОМЕТЫ": 1947,
      "АВТОМОБИЛЬНАЯ ТЕХНИКА": 3605
    }
  },
  "15.06.2022": {
    "date": "15.06.2022",
    "message": "Вооруженные Силы Российской Федерации продолжают специальную военную операцию на Украине.\n\nВысокоточными ракетами большой дальности «Калибр» в районе населенного пункта Золочев Львовской области уничтожен склад боеприпасов к переданным Украине странами НАТО иностранным образцам вооружений, в том числе к 155-мм гаубицам М777.\n\nВысокоточными ракетами воздушного базирования в Николаевской области на военном аэродроме «Вознесенск» уничтожена авиационная техника воздушных сил Украины.\n\nВ районах железнодорожных станций Доброполье, Покровск Донецкой Народной Республики и Орловщина Днепропетровской области уничтожено большое количество вооружения и военной техники из США и европейских стран, доставленных для украинской группировки на Донбассе.\n\nКроме того, в результате ударов уничтожены: радиолокационная станция контроля воздушного пространства в районе Лисичанска Луганской Народной Республики, зенитный ракетный комплекс «Бук-М1» в районе населенного пункта Соледар Донецкой Народной Республики, склады боеприпасов в районах Горское и Верхнекаменское Луганской Народной Республики, а также два пункта управления ВСУ и узел связи в районах населенных пунктов Переездное и Ивано-Дарьевка Донецкой Народной Республики.\n\nОперативно-тактической, армейской и беспилотной авиацией поражено 24 района сосредоточения живой силы и военной техники ВСУ.\n\nВ результате ударов авиации уничтожено более 300 националистов, станция радиоэлектронной борьбы в районе населенного пункта Малиновка Харьковской области, 10 танков и других боевых бронированных машин, три установки реактивных систем залпового огня «Град», 18 специальных автомобилей, три минометных расчета, а также 11 орудий полевой артиллерии, в том числе четыре 155-мм гаубицы М777.\n\nРоссийскими средствами противовоздушной обороны России в районе Краснополье Донецкой Народной Республики сбит самолет Су-25 воздушных сил Украины.\n\nТакже, сбиты шесть украинских беспилотных летательных аппаратов в районах города Донецк и населенных пунктов Павловка Донецкой Народной Республики, Бакалея, Малая Камышеваха, Червоный Шахтер Харьковской области, Лисичанск Луганской Народной Республики\n\nКроме того, перехвачено 12 снарядов реактивной системы залпового огня «Ураган» в районах города Донецк и населенных пунктов Горское и Васильевка Луганской Народной Республики.\n\nРакетными войсками и артиллерией за сутки поражено: 313 районов сосредоточения живой силы и военной техники, 43 пункта управления подразделений, а также 62 огневые позиции артиллерийских подразделений ВСУ.\n\nВсего с начала проведения специальной военной операции уничтожены: 203 самолета, 131 вертолет, 1211 беспилотных летательных аппаратов, 339 зенитных ракетных комплексов, 3558 танков и других боевых бронированных машин, 524 установки реактивных систем залпового огня, 1958 орудий полевой артиллерии и минометов, а также 3623 единицы специальной военной автомобильной техники.",
    "url": "https://z.mil.ru/spec_mil_oper/brief/briefings/more.htm?id=12425334@egNews",
    "destroyed": {
      "САМОЛЕТЫ": 203,
      "ВЕРТОЛЕТЫ": 131,
      "БЕСПИЛОТНИКИ": 1211,
      "ЗЕНИТКИ": 339,
      "ТАНКИ И БМ": 3558,
      "РСЗО": 524,
      "АРТИЛЛЕРИЯ И МИНОМЕТЫ": 1958,
      "АВТОМОБИЛЬНАЯ ТЕХНИКА": 3623
    }
  },
  "16.06.2022": {
    "date": "16.06.2022",
    "message": "Вооруженные Силы Российской Федерации продолжают специальную военную операцию на Украине.\n\nВ результате ударов высокоточными ракетами воздушного базирования уничтожено: два пункта управления ВСУ, станция радиоэлектронной борьбы в районе Пятихатки Харьковской области, пусковая установка оперативно-тактического ракетного комплекса «Точка-У» и боевая машина реактивной системы залпового огня «Ураган» в районе Барвенково Харьковской области.\n\nОперативно-тактической, армейской и беспилотной авиацией за сутки поражено: 57 районов сосредоточения живой силы и военной техники ВСУ. Уничтожено три пункта управления, зенитный ракетный комплекс «Бук-М1» в районе Речки Сумской области, а также пункт ремонта и восстановления бронетехники ВСУ в районе Харькова.\n\n280 националистов, два склада боеприпасов в районе Раздоловки Донецкой Народной Республики, пять танков и других боевых бронированных машин, шесть орудий полевой артиллерии и 11 специальных автомобилей.\n\nРоссийскими средствами противовоздушной обороны в районе Мазановки Харьковской области сбит самолет Су-25 воздушных сил Украины.\n\nТакже сбиты семь украинских беспилотных летательных аппаратов в районах населенных пунктов Томина Балка, Сухой Ставок Херсонской области, Большие Проходы, Чистоводовка, Малая Камышеваха, Каменка Харьковской области, Золотое Луганской Народной Республики.\n\nКроме того, перехвачена баллистическая ракета «Точка-У» в районе Стаханова Луганской Народной Республики, а также 21 реактивный снаряд системы залпового огня «Ураган» в районах населенных пунктов Чернобаевка, Сухой Ставок Херсонской области, Каменка, Долгенькое, Малые Проходы Харьковской области, Донецк, Докучаевск, Сухая Каменка, Ясиноватая Донецкой Народной Республики, Копанки, Новозвановка Луганской Народной Республики.\n\nРакетными войсками и артиллерией за сутки поражено: 195 районов сосредоточения живой силы и военной техники, 34 пункта управления и 42 огневых позиций артиллерийских и минометных подразделений ВСУ.\n\nВ результате ударов ракетных войск и артиллерии уничтожено более 200 националистов, станция радиоэлектронной борьбы, три склада боеприпасов, шесть танков и других боевых бронированных машин, боевая машина реактивной системы залпового огня «Град», четыре орудия полевой артиллерии, 18 специальных автомобилей, а также два пункта управления беспилотными летательными аппаратами в районах населенных пунктов Жовтневое и Кульбакино Николаевской области,\n\nВсего с начала проведения специальной военной операции уничтожены: 204 самолета, 131 вертолет, 1218 беспилотных летательных аппаратов, 340 зенитных ракетных комплексов, 3569 танков и других боевых бронированных машин, 526 боевых машин реактивной системы залпового огня, 1968 орудий полевой артиллерии и минометов, а также 3647 единиц специальной военной автомобильной техники.",
    "url": "https://z.mil.ru/spec_mil_oper/brief/briefings/more.htm?id=12425444@egNews",
    "destroyed": {
      "САМОЛЕТЫ": 204,
      "ВЕРТОЛЕТЫ": 131,
      "БЕСПИЛОТНИКИ": 1218,
      "ЗЕНИТКИ": 340,
      "ТАНКИ И БМ": 3569,
      "РСЗО": 526,
      "АРТИЛЛЕРИЯ И МИНОМЕТЫ": 1968,
      "АВТОМОБИЛЬНАЯ ТЕХНИКА": 3647
    }
  },
  "17.06.2022": {
    "date": "17.06.2022",
    "message": "Вооруженные Силы Российской Федерации продолжают специальную военную операцию на Украине.\n\nВысокоточными ракетами воздушного базирования за сутки поражено 18 районов сосредоточения живой силы и военной техники, а также 10 огневых позиций украинских артиллерийских и минометных батарей, в том числе шесть батарей РСЗО «Град» в районах Зайцево, Курдюмовка, Дзержинск, Бахмут, Артемово и Очеретино Донецкой Народной Республики.\n\nТакже, в районе Песочин Харьковской области уничтожен штаб подразделения националистического формирования «Азов».\n\nКроме того, в районах населенных пунктов Спорное и Выемка Донецкой Народной Республики уничтожены два склада ракетно-артиллерийского вооружения и боеприпасов.\n\nОперативно-тактической и армейской авиацией за сутки поражено 58 районов сосредоточения живой силы и военной техники ВСУ.\n\nВ результате ударов авиации уничтожено более 200 националистов, две пусковые установки зенитных ракетных комплексов «Бук-М1» и «Оса-АКМ» в районах населенных пунктов Красная Гора и Артемовск Донецкой Народной Республики, склад боеприпасов в районе Лисичанска Луганской Народной Республики, 10 танков и других боевых бронированных машин, шесть орудий полевой артиллерии, четыре пусковые установки реактивных систем залпового огня и девять специальных автомобилей.\n\nРоссийскими средствами противовоздушной обороны России в районе Мазановки Харьковской области сбит самолет Су-25 воздушных сил Украины.\n\nТакже сбиты 15 украинских беспилотных летательных аппаратов в районах населенных пунктов Мирное, Зеленый Гай Николаевской области, Малые Проходы, Сулиговка, Малая Камышеваха, Долгенькое, Рассоховатое, Чкаловское Харьковской области, Брянка, Фрунзе, Новоивановка Луганской Народной Республики, Триполье Донецкой Народной Республики, в том числе один «Байрактар-ТБ2» в районе Чернобаевки Херсонской области.\n\nКроме того, перехвачена ракета оперативно-тактического ракетного комплекса «Точка-У» в районе населенного пункта Красный Луч Луганской Народной Республики, а также восемь реактивных снарядов РСЗО «Ураган» в районах Чернобаевки Херсонской области, Липцы Харьковской области, Верхнеторецкое, Новоселка Донецкой Народной Республики и Николаевка Луганской Народной Республики.\n\nРакетными войсками и артиллерией поражено: 203 района сосредоточения живой силы и военной техники, а также 38 огневых позиций артиллерийских подразделений ВСУ.\n\nВ результате ударов ракетными войсками и артиллерией за сутки уничтожено более 350 националистов, пункт управления беспилотными летательными аппаратами ВСУ в районе населенного пункта Украинка Николаевской области, восемь танков и других боевых бронированных машин, три боевых машины БМ-21 РСЗО «Град», три орудия полевой артиллерии и 11 специальных автомобилей.\n\nВсего с начала проведения специальной военной операции уничтожены: 205 самолетов, 131 вертолет, 1233 беспилотных летательных аппаратов, 342 зенитный ракетных комплекса, 3587 танков и других боевых бронированных машин, 539 боевых машин реактивной системы залпового огня, 2013 орудий полевой артиллерии и минометов, а также 3658 единиц специальной военной автомобильной техники.",
    "url": "https://z.mil.ru/spec_mil_oper/brief/briefings/more.htm?id=12425590@egNews",
    "destroyed": {
      "САМОЛЕТЫ": 205,
      "ВЕРТОЛЕТЫ": 131,
      "БЕСПИЛОТНИКИ": 1233,
      "ЗЕНИТКИ": 342,
      "ТАНКИ И БМ": 3587,
      "РСЗО": 539,
      "АРТИЛЛЕРИЯ И МИНОМЕТЫ": 2013,
      "АВТОМОБИЛЬНАЯ ТЕХНИКА": 3658
    }
  },
  "18.06.2022": {
    "date": "18.06.2022",
    "message": "Вооруженные Силы Российской Федерации продолжают специальную военную операцию на Украине.\n\nВысокоточным оружием воздушного и наземного базирования в районах КРЕМЕНЧУГА и ЛИСИЧАНСКА уничтожены технологические мощности по переработке нефти и хранилища топлива, предназначавшегося для снабжения украинской военной техники на Донбассе.\n\nВысокоточными ракетами воздушного базирования поражено 12 огневых позиций артиллерийских и минометных подразделений ВСУ, в том числе четыре взвода реактивных систем залпового огня «Град» в районах АВДЕЕВКИ, КЕРАМИК, ЖЕЛАННОЕ и четыре взвода 155-мм гаубиц М777 в районах ЛАСТОЧКИНО, ОЧЕРЕТИНО, ВОДЯНОЕ, ЖЕЛАННОЕ Донецкой Народной Республики.\n\nОперативно-тактической и армейской авиацией за сутки поражено 62 района сосредоточения живой силы и военной техники ВСУ.\n\nВ результате ударов авиации уничтожено более 160 националистов, зенитный ракетный комплекс «Бук-М1» в районе населенного пункта КАМЫШЕВАХА Луганской Народной Республики, пять боевых машин реактивной системы залпового огня «Град», шесть танков и других боевых бронированных машин, восемь орудий полевой артиллерии, шесть специальных автомобилей и три склада боеприпасов в районах ЦАПОВКИ Харьковской области и ЛИСИЧАНСКА Луганской Народной Республики.\n\nРоссийскими средствами противовоздушной обороны сбиты: украинский самолет Су-25 в районе населенного пункта КАМЫШЕВАХА и вертолет Ми-24 воздушных сил Украины в районе АРХАНГЕЛЬСКОГО Донецкой Народной Республики,\n\nТакже за сутки сбиты: восемь украинских беспилотных летательных аппаратов в районах населенных пунктов БОРОВЕНЬКИ Луганской Народной Республики, ЧЕРНОБАЕВКА Херсонской области, СУХАЯ КАМЕНКА, МАЛАЯ КАМЫШЕВАХА, ЗАБАВНОЕ Харьковской области, ГУЛЯЙПОЛЕ Запорожской области, в том числе ударный беспилотный летательный аппарат «Байрактар-ТБ2» в районе ХЕРСОНА.\n\nКроме того, перехвачены: четыре украинские баллистические ракеты «Точка-У» в районах СТАХАНОВА, КАЛИНОВО, АЛМАЗНАЯ Донецкой Народной Республики, а также 24 ракеты реактивной системы залпового огня «Ураган» над населенными пунктами ДОНЕЦК, ЯСИНОВАТАЯ, ВЕРХНЕТОРЕЦКОЕ, ЛУГАНСКОЕ, НОВОАЛЕКСАНДРОВКА Донецкой Народной Республики, ЗОЛОТОЕ, ПОПАСНОЕ Луганской Народной Республики, ИЗЮМ, РУССКИЕ ТИШКИ и МАЛЫЕ ПРОХОДЫ Харьковской области.\n\nРакетными войсками и артиллерией за сутки поражены: 180 районов сосредоточения живой силы и военной техники, 16 пунктов управления, а также 32 огневые позиции артиллерийских и минометных подразделений ВСУ.\n\nВ результате ударов уничтожено более 310 националистов, 10 танков и других боевых бронированных машин, три боевые машины реактивной системы залпового огня «Град», девять орудий полевой артиллерии и 14 специальных автомобилей.\n\nВсего с начала проведения специальной военной операции уничтожено: 206 самолетов, 132 вертолета, 1241 беспилотный летательный аппарат, 343 зенитных ракетных комплекса, 3613 танков и других боевых бронированных машин, 547 боевых машин реактивной системы залпового огня, 2032 орудия полевой артиллерии и миномета, а также 3687 единиц специальной военной автомобильной техники.",
    "url": "https://z.mil.ru/spec_mil_oper/brief/briefings/more.htm?id=12425697@egNews",
    "destroyed": {
      "САМОЛЕТЫ": 206,
      "ВЕРТОЛЕТЫ": 132,
      "БЕСПИЛОТНИКИ": 1241,
      "ЗЕНИТКИ": 343,
      "ТАНКИ И БМ": 3613,
      "РСЗО": 547,
      "АРТИЛЛЕРИЯ И МИНОМЕТЫ": 2032,
      "АВТОМОБИЛЬНАЯ ТЕХНИКА": 3687
    }
  },
  "19.06.2022": {
    "date": "19.06.2022",
    "message": "Успешно развивается наступление на Северодонецком направлении. Подразделениями Народной Милиции Луганской Народной Республики при поддержке Вооруженных Сил Российской Федерации освобожден населенный пункт Метелкино.\n\nОтдельные подразделения ВСУ из-за низкого морально-психологического состояния, нехватки боеприпасов и отсутствия обеспечения, покидают район боевых действий. Так, взвод 1-й роты 1-го батальона 57-й мотопехотной бригады, оборонявшийся в районе Лисичанска, бросил тяжелое вооружение и оставил свои позиции.\n\nВооруженные Силы Российской Федерации продолжают наносить удары по военным объектам на территории Украины.\n\nЗа прошедшие сутки высокоточными ракетами большой дальности морского базирования «Калибр» в 12.30 нанесен удар по пункту управления украинских войск в районе села Широкая Дача Днепропетровской области в момент, когда там проходило рабочее совещание командного состава оперативно-стратегической группировки войск «Александрия».\n\nВ результате удара уничтожено свыше 50 генералов и офицеров ВСУ, в том числе генерального штаба, командования группировки войск «Каховка», десантно-штурмовых войск и соединений, действующих на Николаевском и Запорожском направлениях.\n\nВ 20.20 высокоточными ракетами большой дальности «Калибр» на территории трансформаторного завода в городе Николаев уничтожены десять 155-мм гаубиц М777 и до 20-ти боевых бронированных машин, поставленных Западом киевскому режиму за последние 10 дней.\n\nВысокоточными ракетами воздушного базирования в 19.20 нанесено поражение эшелону с личным составом, вооружением и военной техникой 1-го батальона 14-ой отдельной механизированной бригады, прибывшего из города Владимир-Волынский в зону боевых действий на Донбассе.\n\nВ результате удара по месту разгрузки эшелона в районе железнодорожной станции Губиниха Днепропетровской области уничтожено более 100 военнослужащих ВСУ, 30 танков и боевых бронированных машин.\n\nВ 02.05 в районе населенного пункта Селидово Донецкой Народной Республики нанесено поражение живой силе и военной технике 56-й мотопехотной бригады ВСУ. Уничтожено до 200 боевиков, в том числе иностранные наемники, входившие в состав данной бригады, а также две боевые машины реактивной системы залпового огня «Град», 10 боевых машин пехоты и бронетранспортеров.\n\nВ рамках контрбатарейной борьбы на Донецком направлении нанесено поражение семи взводам РСЗО «Град» и артиллерийскому взводу на огневых позициях.\n\nОперативно-тактической и армейской авиацией уничтожено четыре склада с ракетно-артиллерийским вооружением и артиллерийскими боеприпасами в районах населенных пунктов Максимильяновка, Авдеевка, Зеленое Поле и Георгиевка Донецкой Народной Республики, а также пусковая установка зенитного ракетного комплекса «Бук-М1» в районе Северска Луганской Народной Республики.\n\nРакетными войсками и артиллерией поражены 22 пункта управления, 48 артиллерийских подразделений на огневых позициях, живая сила и военная техника ВСУ в 123-х районах.\n\nУдаром оперативно-тактического ракетного комплекса «Искандер» по территории Харьковского танкоремонтного завода уничтожены две пусковые установки реактивной системы залпового огня «Ураган».\n\nУкраинские вооруженные силы несут значительные потери от контрбатарейной борьбы. Так военнослужащий 22-ой мотопехотной бригады ВСУ, взятый в плен в районе населенного пункта Перемога, рассказал о том, что за последние 10 дней в артиллерийских подразделениях, действующих на Харьковском направлении, потери составили 380 человек, в том числе 90 – безвозвратные.\n\nЗа сутки в результате ударов авиации, ракетных войск и артиллерии уничтожено свыше 400 националистов, 10 танков и других боевых бронированных машин, 11 орудий полевой артиллерии, 11 пусковых установок реактивной системы залпового огня и 28 специальных автомобилей.\n\nВойсками противовоздушной обороны России за сутки сбит самолет Су-25 воздушных сил Украины в районе Червонная Долина Николаевской области.\n\nТакже сбито восемь украинских беспилотных летательных аппаратов в районах населенных пунктов Заводы, Червоный Шахтер, Дементиевка, ГЛУБОКОЕ Харьковской области, Криница Херсонской области, Попасная Луганской Народной Республики и в районе острова Змеиный.\n\nКроме того, перехвачены три тактические ракеты «Точка-У» в районах Новозвановка и Новоалександровка Луганской Народной Республики, два снаряда реактивной системы залпового огня «Ураган» в районах населенных пунктов Большие Проходы Харьковской области и Червонная Долина Николаевской области.\n\nВсего с начала проведения специальной военной операции уничтожены: 207 самолетов, 132 вертолета, 1249 беспилотных летательных аппаратов, 344 зенитных ракетных комплекса, 3683 танка и других боевых бронированных машин, 562 боевые машины реактивной системы залпового огня, 2043 орудия полевой артиллерии и минометов, а также 3715 единиц специальной военной автомобильной техники.\n\nБольшие потери в рядах ВСУ вынуждают украинское командование бросать в бой неподготовленный личный состав у которого отсутствуют необходимые навыки обращения с вооружением и военной техникой.\n\nТак, в 13.30 пара штурмовиков Су-25 воздушных сил Украины нанесла удар по позициям своих подразделений в районе населенного пункта Широкое Днепропетровской области.",
    "url": "https://z.mil.ru/spec_mil_oper/brief/briefings/more.htm?id=12425783@egNews",
    "destroyed": {
      "САМОЛЕТЫ": 207,
      "ВЕРТОЛЕТЫ": 132,
      "БЕСПИЛОТНИКИ": 1249,
      "ЗЕНИТКИ": 344,
      "ТАНКИ И БМ": 3683,
      "РСЗО": 562,
      "АРТИЛЛЕРИЯ И МИНОМЕТЫ": 2043,
      "АВТОМОБИЛЬНАЯ ТЕХНИКА": 3715
    }
  },
  "20.06.2022": {
    "date": "20.06.2022",
    "message": "Вооруженные Силы Российской Федерации продолжают наносить удары по военным объектам на территории Украины.\n\nВысокоточной ракетой «Оникс» берегового ракетного комплекса «Бастион» нанесен удар по аэродрому Арциз Одесской области. В результате удара уничтожена станция управления беспилотными летательными аппаратами «Байрактар ТБ2» и два беспилотных аппарата этого комплекса на земле.\n\nВ рамках контрбатарейной борьбы на Донецком направлении за сутки поражено 11 взводов реактивных систем залпового огня «Град» в районах Куртимовка, Очертино, Тоненькое, Сухая Балка, Новгородское, Майоровка, Отрадовка и Зайцево.\n\nТакже поражено 12 артиллерийских взводов ВСУ на огневых позициях в районах Дзержинска, Новгородское, Николаевка, Ленинское, Зайцево.\n\nВ районе населенного пункта Подгорное уничтожены две 155-мм гаубицы М777 вместе с артиллерийскими расчетами.\n\nОперативно-тактической и армейской авиацией за сутки поражено 47 районов сосредоточения живой силы и техники\n\nВ том числе уничтожены: живая сила и военная техника в районах Веселое, Приволье и Богородичное Донецкой Народной Республики, пусковая установка зенитного ракетного комплекса «Бук-М1» в районе Северска Донецкой Народной Республики, а также локатор подсвета и наблюдения зенитного ракетного комплекса С-300 в районе Новодружеска Луганской Народной Республики.\n\nРакетными войсками и артиллерией за сутки поражены 148 районов сосредоточения живой силы и военной техники ВСУ, 25 пунктов управления, а также 59 артиллерийских подразделений на огневых позициях.\n\nВ результате ударов авиации, ракетных войск и артиллерии уничтожено 450 националистов, 13 танков и других боевых бронированных машин, а также 16 специальных автомобилей.\n\nРоссийскими средствами противовоздушной обороны России сбит самолет МиГ-29 воздушных сил Украины в районе населенного пункта Апостолово Днепропетровской области.\n\nТакже сбиты в воздухе девять украинских беспилотных летательных аппаратов в районах населенных пунктов Алисовка Харьковской области, Верхнеторецкое Донецкой Народной Республики, Гречишкино Луганской Народной Республики, курган Могила Кулича, Томина Балка и Чернобаевка Херсонской области.\n\nКроме того, перехвачены девять снарядов реактивной системы залпового огня «Ураган» в районах населенных пунктов Малая Камышеваха и Долгенькое Харьковской области, Макеевка и Авдеевка Донецкой Народной Республики.\n\nВсего с начала проведения специальной военной операции уничтожены: 208 самолетов, 132 вертолета, 1260 беспилотных летательных аппаратов, 345 зенитных ракетных комплекса, 3696 танков и других боевых бронированных машин, 576 боевых машин реактивной системы залпового огня, 2055 орудий полевой артиллерии и минометов, а также 3731 единица специальной военной автомобильной техники.\n\nВ ходе проведения специальной военной операции противник несет значительные потери.\n\nТак, с 19 мая, за месяц боев, одна только 14-я механизированная бригада ВСУ потеряла убитыми и раненными больше 2100 человек. Из-за низкого морально-психологического состояния 800 человек, предназначенных для восполнения потерь этого соединения, отказались ехать в район боевых действий, обвинив офицеров в некомпетентности, взяточничестве и кумовстве при выплатах денежного довольствия.\n\nВ 10-й горно-штурмовой бригаде около 100 военнослужащих разведывательного подразделения из-за массового неповиновения командованию были сняты с выполнения боевых задач и вывезены в г. Кременчуг для проведения расследования.\n\nЗначительная часть командного состава 30-й механизированной бригады ВСУ самоустранились от управления своими подразделениями и уклоняются от выполнения боевых задач. Используются любые предлоги по симуляции заболеваний. В большинстве подразделений бригады уже не осталось ни одного офицера.",
    "url": "https://z.mil.ru/spec_mil_oper/brief/briefings/more.htm?id=12425852@egNews",
    "destroyed": {
      "САМОЛЕТЫ": 208,
      "ВЕРТОЛЕТЫ": 132,
      "БЕСПИЛОТНИКИ": 1260,
      "ЗЕНИТКИ": 345,
      "ТАНКИ И БМ": 3696,
      "РСЗО": 576,
      "АРТИЛЛЕРИЯ И МИНОМЕТЫ": 2055,
      "АВТОМОБИЛЬНАЯ ТЕХНИКА": 3731
    }
  },
  "21.06.2022": {
    "date": "21.06.2022",
    "message": "Ракетными войсками и артиллерией поражено 216 районов сосредоточения живой силы и военной техники ВСУ, 28 пунктов управления, 64 артиллерийских подразделения на огневых позициях, а также два склада с боеприпасами.\n\nВ результате ударов авиации, ракетных войск и артиллерии уничтожено 570 националистов, 13 танков и других боевых бронированных машин и 29 специальных автомобилей.\n\nВойсками противовоздушной обороны России сбит самолет Су-25 воздушных сил Украины в районе населенного пункта Мазановка Харьковской области.\n\nТакже сбиты в воздухе 19 украинских беспилотных летательных аппаратов в районах населенных пунктов Крутая Балка Донецкой Народной Республики, Диброво, Капитоловка, Липцы и Заводы Харьковской области.\n\nКроме того, перехвачено пять тактических ракет «Точка-У», а также 30 реактивных снарядов РСЗО «Ураган» в районах населенных пунктов Лозовский Луганской Народной Республики, Лозовая, Кременец, Александровка Донецкой Народной Республики, Долгенькое и Топольское Харьковской области.\n\nВсего с начала проведения специальной военной операции уничтожены: 209 самолетов, 132 вертолета, 1292 беспилотных летательных аппарата, 348 зенитных ракетных комплексов, 3709 танков и других боевых бронированных машин, 580 боевых машин реактивной системы залпового огня, 2065 орудий полевой артиллерии и минометов, а также 3760 единиц специальной военной автомобильной техники.\n\n* * *\n\nВ ходе проведения специальной военной операции противник продолжает нести значительные потери.\n\nВ 57-й механизированной бригаде ВСУ, действующей в Северодонецке, в одном из батальонов в строю осталось только 28 военнослужащих, в другом — только командный состав.\n\nРезервы для восполнения потерь исчерпаны. Батальоны территориальной обороны, прибывающие из западных регионов Украины для усиления, отказываются выдвигаться на передовую.\n\nВ зоне ответственности оперативной тактической группы «Соледар» военнослужащие 101-й бригады территориальной обороны ВСУ заявили, что «не желают принимать участие в боевых действиях» и самостоятельно отправились в тыловой район. Отказников более 600 человек.\n\nПоступившие от США и европейских стран Украине 155-мм гаубицы М-777 стали хорошей целью для российских средств огневого поражения.\n\nТолько за прошедшие сутки было уничтожено 15 единиц, большинство из которых — в районе железнодорожной станции Дружковка, не успев сделать еще ни одного выстрела.\n\nВ прилегающих к зоне боевых действий населенных пунктах Днепропетровской, Харьковской и Запорожской областей проводится принудительная мобилизация. Мероприятия сопровождаются блокированием населенных пунктов органами национальной полиции. Задерживаются мужчины всех возрастных групп, подлежащих мобилизации.\n\n* * *\n\nКиевским режимом распространена информация о якобы «тайной» поездке Зеленского в Лисичанск, где он попал под обстрел.\n\nПри этом группировка украинских войск в районе Лисичанска отрезана от снабжения и находится под огневым контролем российских Вооруженных Сил.\n\nПо свидетельству украинских пленных, подразделения 79-й десантно-штурмовой бригады брошены своим командованием. Оставшимся в живых военнослужащим оставалось только сдаться в плен, чтобы сохранить свои жизни.\n\nВ таком же состоянии находится 57-я механизированная бригада ВСУ, чей командир после потери двух третей личного состава умолял командование группировкой доложить истинное положение дел генеральному штабу ВСУ и лично Зеленскому.\n\nКиевским режимом на фоне военных провалов продолжаются вбросы в лучших традициях «Квартала-95», чтобы хоть как-то остановить панику и бегство своих военнослужащих из Донбасса.",
    "url": "https://z.mil.ru/spec_mil_oper/brief/briefings/more.htm?id=12425943@egNews",
    "destroyed": {
      "САМОЛЕТЫ": 209,
      "ВЕРТОЛЕТЫ": 132,
      "БЕСПИЛОТНИКИ": 1292,
      "ЗЕНИТКИ": 348,
      "ТАНКИ И БМ": 3709,
      "РСЗО": 580,
      "АРТИЛЛЕРИЯ И МИНОМЕТЫ": 2065,
      "АВТОМОБИЛЬНАЯ ТЕХНИКА": 3760
    }
  },
  "22.06.2022": {
    "date": "22.06.2022",
    "message": "Вооруженные Силы Российской Федерации продолжают специальную военную операцию на Украине.\n\nПротивник несет значительные потери. 21 июня в результате удара высокоточным оружием ВКС России уничтожено до 500 военнослужащих 59-й механизированной бригады ВСУ с вооружением и военной техникой, размещавшихся в цехах Николаевского судостроительного завода «Океан».\n\nВоеннослужащие батальона 57-й мотопехотной бригады, оборонявшейся в районе населенных пунктов Горское, Подлесное, Врубовка Луганской Народной Республики, потеряв более 60 процентов личного состава, отказались выполнять приказ командования и самовольно оставили все занимаемые позиции.\n\nВ районе Николаевки Донецкой Народной Республики в связи с угрозой разгрома подразделений 14-й и 24-й механизированных бригад украинским командованием ночью эвакуированы до 30 раненых и восемь убитых американских и британских наемников, чтобы не допустить их попадания подразделениям Вооруженных Сил России.\n\nВооруженные Силы Российской Федерации наносят удары по военным объектам на территории Украины.\n\nОперативно-тактической и армейской авиацией за сутки уничтожено: пять складов боеприпасов ВСУ в районах Сидорово, Верхняя Каменка Донецкой Народной республики и Мирополье Сумской области, зенитный ракетный комплекс «Бук-М1» в районе Курахово Донецкой Народной Республики, а также живая сила и военная техника в 151 районе.\n\nРакетными войсками и артиллерией поражены 253 района сосредоточения живой силы и военной техники ВСУ, а также шесть складов с боеприпасами в районах населенных пунктов Лисичанск, Верхнекаменка, Мирная Долина, Лоскутовка и Подлесное Луганской Народной Республики.\n\nУничтожен топливный терминал в Николаеве, с которого осуществлялось снабжение горючим военной техники ВСУ.\n\nВ рамках контрбатарейной борьбы поражено 13 украинских взводов реактивных систем залпового огня в районах Острое, Горняк, Кодема, Дзержинск, Калиново, Зоряное, Дмитров, Новолуганск, Новгородское, Ленинское, а также десять взводов ствольной артиллерии на огневых позициях в районах Степная Долина Николаевской области, Спартак, Подгорное, Николаевка, Ленинское, Зайцево, Семигорье, Дзержинск.\n\nВ районе населенного пункта Никольское Донецкой Народной Республики уничтожена станция артиллерийской разведки AN-TPQ производства США.\n\nВсего в результате ударов авиации, ракетных войск и артиллерии за сутки уничтожено более 620 националистов, 24 танка и других боевых бронированных машин, а также 27 специальных автомобилей.\n\nРоссийскими средствами ПВО за сутки сбиты: самолет Су-25 воздушных сил Украины в районе Бармашево Николаевской области и МиГ-29 в районе Апостолово Днепропетровской области.\n\nТакже сбиты 16 украинских беспилотных летательных аппаратов в районах населенных пунктов Большие Проходы, Малая Камышеваха, Новодмитровское, Веселое, Беляевка, Бражковка, Червоное, Долгенькое, Сулиговка, Ясиноватое и остров Змеиный.\n\nКроме того, перехвачены три украинские баллистические ракеты «Точка-У» в районах Пашково Харьковской области и Новая Каховка Херсонской области, а также 14 реактивных снарядов системы залпового огня в районах: остров Змеиный, Ясиноватая Донецкой Народной Республики, Новоселовка Луганской Народной Республики и Сулиговка Харьковской Области.\n\nВсего с начала проведения специальной военной операции уничтожены: 211 самолетов, 132 вертолета, 1308 беспилотных летательных аппаратов, 349 зенитных ракетных комплексов, 3733 танка и других боевых бронированных машин, 594 боевых машин реактивных систем залпового огня, 2081 орудие полевой артиллерии и минометов, а также 3801 единица специальной военной автомобильной техники.",
    "url": "https://z.mil.ru/spec_mil_oper/brief/briefings/more.htm?id=12426071@egNews",
    "destroyed": {
      "САМОЛЕТЫ": 211,
      "ВЕРТОЛЕТЫ": 132,
      "БЕСПИЛОТНИКИ": 1308,
      "ЗЕНИТКИ": 349,
      "ТАНКИ И БМ": 3733,
      "РСЗО": 594,
      "АРТИЛЛЕРИЯ И МИНОМЕТЫ": 2081,
      "АВТОМОБИЛЬНАЯ ТЕХНИКА": 3801
    }
  },
  "23.06.2022": {
    "date": "23.06.2022",
    "message": "Противник продолжает нести значительные потери.\n\nВ разгромленном под населенным пунктом Мирная Долина Луганской Народной Республики 34-м батальоне 57-й мотопехотной бригады ВСУ потери за два дня составили более 150 человек убитыми и около 450 раненых.\n\nВ каждой из рот данного батальона — не более 15–20 солдат. Младший командный состав бросил своих подчиненных и дезертировал из района боевых действий.\n\nВ подразделениях 30-й механизированной бригады ВСУ в районе населенного пункта Клиновое Донецкой Народной Республики в результате огневого поражения российскими Вооруженными Силами осталось менее 50 % личного состава. Еще более 170 солдат и офицеров командованием эвакуированы из района боевых действий с тяжелыми ранениями.\n\n* * *\n\nВооруженные Силы Российской Федерации продолжают наносить удары по военным объектам на территории Украины.\n\n22 июня высокоточным оружием ВКС России в районе Николаева уничтожено 49 резервуаров с топливом для военной техники ВСУ, а также до 50 размещенных в ангарах боевых машин реактивных систем залпового огня, в том числе иностранного производства.\n\nЗа сутки высокоточным оружием ВКС России также поражены три базы ремонта бронетанковой техники в районе Николаева, четыре пункта управления, живая сила и военная техника в 18 районах.\n\nОперативно-тактической и армейской авиацией за сутки уничтожены живая сила и военная техника в 96 районах и полевой радиолокационный пост в районе Константиновки Харьковской области.\n\nРакетными войсками и артиллерией поражены 26 пунктов управления, живая сила и военная техника ВСУ в 364 районах, а также подразделения украинской артиллерии в 58 районах, в том числе взвод 155-мм гаубиц М-777 на острове Кубанский и взвод реактивных систем залпового огня «Смерч» в районе Новопокровское Донецкой Народной Республики.\n\nУничтожены три мобильных пункта управления беспилотными летательными аппаратами в районах населенных пунктов Жовтневая, Киселевка, Бармашово Николаевской области.\n\nВ рамках контрбатарейной борьбы высокоточным оружием ВКС России, ракетными войсками и артиллерией на донецком направлении за сутки поражено восемь украинских взводов РСЗО «Ураган» в районах Авдеевка, Веселое, Дзержинск, Новолуганское, Курдюмовка, а также 11 взводов ствольной артиллерии ВСУ на огневых позициях в районах Новопокровское, Галициновка, Артемовск, Часов-Яр, Крутая Балка, Авдеевка, Нововеселовка и в районе Клебан-Быкского водохранилища, которые обстреливали город Донецк и другие населенные пункты Донецкой Народной Республики.\n\nВ результате ударов авиации, ракетных войск и артиллерии за сутки уничтожено более 650 националистов, 17 танков и других боевых бронированных машин, три боевые машины реактивных систем залпового огня «Смерч», а также 17 специальных автомобилей.\n\nВойсками противовоздушной обороны ВКС России за сутки уничтожен 21 украинский беспилотный летательный аппарат в районах: остров Змеиный, Петрополье, Стрелечье, Малая Камышеваха, Дементиевка Харьковской области, Скадовск Херсонской области, Донецк, Горловка, Донецкий Донецкой Народной Республики, Горское, Окнино Луганской Народной Республики и Новая Сбурьевка Херсонской области.\n\nКроме того, перехвачена баллистическая ракета «Точка-У» в районе Пески-Радьковские Харьковской области и 22 реактивных снаряда РСЗО в районах Донецк, Макеевка, Горловка, Камышеваха Донецкой Народной Республики, Червоное, Изюм, Сухая Каменка Харьковской области и над островом Змеиный.\n\nВсего с начала проведения специальной военной операции уничтожены: 211 самолетов, 132 вертолета, 1329 беспилотных летательных аппаратов, 349 зенитных ракетных комплексов, 3750 танков и других боевых бронированных машин, 647 боевых машин реактивной системы залпового огня, 2088 орудий полевой артиллерии и минометов, а также 3818 единиц специальной военной автомобильной техники.",
    "url": "https://z.mil.ru/spec_mil_oper/brief/briefings/more.htm?id=12426216@egNews",
    "destroyed": {
      "САМОЛЕТЫ": 211,
      "ВЕРТОЛЕТЫ": 132,
      "БЕСПИЛОТНИКИ": 1329,
      "ЗЕНИТКИ": 349,
      "ТАНКИ И БМ": 3750,
      "РСЗО": 647,
      "АРТИЛЛЕРИЯ И МИНОМЕТЫ": 2088,
      "АВТОМОБИЛЬНАЯ ТЕХНИКА": 3818
    }
  },
  "24.06.2022": {
    "date": "24.06.2022",
    "message": "В результате успешных наступательных действий группировки российских войск на Луганском направлении за пять дней освобождены населенные пункты Лоскутовка, Подлесное, Мирная Долина, Щебкарьер, Врубовка, Нырково, Николаевка, Новоивановка, Устиновка и Рай-Александровка.\n\nВ районе населенных пунктов Горское и Золотое полностью блокирована группировка украинских войск.\n\nВ очередном, теперь уже «Горском» котле, окружено четыре батальона: 3-й механизированный батальон 24-й механизированной бригады, 15-й горно-штурмовой батальон 128-й горно-штурмовой бригады, 42-й мотопехотный батальон 57-й мотопехотной бригады, 70-й батальон 101-й бригады территориальной обороны, а также бригадная артиллерийская группа 57-й мотопехотной бригады, формирование нацистов «Правого сектора» и отряд иностранных наемников.\n\nВсего в «Горском котле» сейчас заблокировано до двух тысяч человек: около 1800 военнослужащих, 120 нацистов «Правого сектора», до 80 иностранных наемников; а также более 40 единиц боевых бронированных машин и около 80 орудий и минометов.\n\nТолько за последние сутки в данном районе отказались от сопротивления и добровольно сдались в плен 41 военнослужащий.\n\nПо словам пленных, окруженная украинская группировка истощена. Укомплектованность подразделений личным составом составляет менее 40%. Управление подразделениями со стороны вышестоящего украинского командования потеряно. Снабжение оружием, боеприпасами, горючим и другими материальными средствами полностью прекращено.\n\nРоссийские войска сжимают кольцо «Горского котла», нанося противнику непрерывное огневое поражение. В течение вчерашнего дня взята под контроль половина населенного пункта Золотое.\n\nПротивник несет значительные потери и на других направлениях.\n\nВ результате ударов высокоточным оружием ВКС России по трем пунктам дислокации иностранных наемников в Николаеве, Голицино Николаевской области, а также Олешки Харьковской области уничтожено более 200 «солдат удачи» и до 100 украинских националистов.\n\nСлучаи дезертирства и отказа от участия в боевых действиях принимают в ВСУ массовый характер. Так, в районе населенного пункта Александрополь Донецкой Народной Республики, более 30-ти украинских военнослужащих одного из батальонов 25-й воздушно-десантной бригады, бросив личное оружие, самовольно оставили позиции.\n\nУкраинское командование для восполнения потерь в живой силе на Донецком и Луганском направлениях вынужденно формируют в каждой области отдельные стрелковые батальоны из необученных, призванных по мобилизации, граждан.\n\nВооруженные Силы Российской Федерации продолжают специальную военную операцию на Украине.\n\nОперативно-тактической и армейской авиацией, ракетными войсками и артиллерией поражена живая сила и военная техника ВСУ в 367-ми районах. Уничтожено пять складов боеприпасов, ракетно-артиллерийского вооружения и материальных средств в районах Привольное Луганской Народной Республики и города Николаев, а также артиллерийские и минометные подразделения в 62-х районах, в том числе – артиллерийская батарея гаубиц М777 в районе Олешки Харьковской области.\n\nБереговым ракетным комплексом «Бастион» нанесен удар по стартовой позиции зенитного ракетного комплекса С-300 в районе Одессы. Цель уничтожена.\n\nВсего за сутки в результате ударов авиации, ракетных войск и артиллерии уничтожено более 620 националистов, 19 танков и других боевых бронированных машин, а также 17 специальных автомобилей.\n\nРоссийскими средствами противовоздушной обороны за сутки уничтожены два самолета Су-25 в районах Долгенькое Харьковской области и Высокополье Николаевской области.\n\nСбиты в воздухе пять украинских беспилотных летательных аппаратов в районах населенных пунктов Попасная и Капитаново Луганской Народной Республики, Вербовка, Донецкое Харьковской области, а также пять тактических ракет «Точка-У» в районах населенных пунктов Стаханов, Луганск и Изюм.\n\nВсего с начала проведения специальной военной операции уничтожены: 213 самолетов, 132 вертолета, 1334 беспилотных летательных аппаратов, 350 зенитных ракетных комплексов, 3769 танков и других боевых бронированных машин, 659 боевых машин реактивной системы залпового огня, 3002 орудия полевой артиллерии и минометов, а также 3835 единиц специальной военной автомобильной техники.",
    "url": "https://z.mil.ru/spec_mil_oper/brief/briefings/more.htm?id=12426344@egNews",
    "destroyed": {
      "САМОЛЕТЫ": 213,
      "ВЕРТОЛЕТЫ": 132,
      "БЕСПИЛОТНИКИ": 1334,
      "ЗЕНИТКИ": 350,
      "ТАНКИ И БМ": 3769,
      "РСЗО": 659,
      "АРТИЛЛЕРИЯ И МИНОМЕТЫ": 3002,
      "АВТОМОБИЛЬНАЯ ТЕХНИКА": 3835
    }
  },
  "25.06.2022": {
    "date": "25.06.2022",
    "message": "Противник продолжает нести значительные потери.\n\nВ результате ударов высокоточным оружием ВКС России по корпусам цинкового завода «Мегатекс» в населенном пункте Константиновка Донецкой Народной Республики уничтожено до 80 польских наемников, 20 боевых бронированных машин и восемь установок реактивных систем залпового огня «Град».\n\nВ районе Николаева за сутки уничтожено более 300 украинских военнослужащих и иностранных наемников, 35 единиц тяжелого вооружения.\n\nВ подразделениях украинской армии и территориальной обороны продолжаются отказы от выполнения поставленных задач.\n\nЛичный состав 64-го батальона 103-й бригады территориальной обороны, дислоцированной во Львове, отказался убывать в район боевых действий на Донбассе из-за укомплектования необученными резервистами и отсутствию тяжелого вооружения.\n\nВооруженные Силы Российской Федерации продолжают специальную военную операцию на Украине.\n\nОперативно-тактической и армейской авиацией, ракетными войсками и артиллерией поражены живая сила и военная техника в 284-х районах, два склада боеприпасов и ракетно-артиллерийского вооружения в районе Волчеяровка Луганской Народной Республики, а также артиллерийские и минометные подразделения в 43-х районах.\n\nВ рамках контрбатарейной борьбы высокоточным оружием ВКС России на Донецком направлении поражено: восемь артиллерийских взводов РСЗО «Ураган» в районах Курахово, Украинск, Новоселовка Вторая, Воздвиженка и два артиллерийских взвода в районах Украинск, Яснобродовка, которые обстреливали город Донецк и другие населенные пункты Донецкой Народной Республики.\n\nВ результате ударов авиации, ракетных войск и артиллерии уничтожено более 780 националистов, восемь танков и других боевых бронированных машин, три боевые машины РСЗО «Ураган», 10 орудий полевой артиллерии и минометов, 13 специальных автомобилей.\n\nРоссийскими средствами противовоздушной обороны за сутки уничтожен 21 украинский беспилотный летательный аппарат в районах населенных пунктов: Попасная, Капитаново Луганской Народной Республики, Андреевка, Барвенково, Большие Проходы, Великая Камышеваха, Вербовка, Донецкое, Долгенькое, Изюм, Малые Проходы, Малая Камышеваха, Ольховатка, Червоный Шахтер Харьковской области, Пятихатка Днепропетровской области, Бобровый Кут, Малая Сейдеминуха, Молодежное Херсонской области и в районе острова Змеиный.\n\nТакже перехвачена баллистическая ракета «Точка-У» в районе населенного пункта Молодежное Херсонской области и 16 реактивных снарядов системы залпового огня в районах населенных пунктов Бражковка, Глинское, Долгенькое Харьковской области, Авдеевка Донецкой Народной Республики и в районе острова Змеиный.\n\nВсего с начала проведения специальной военной операции уничтожены: 213 самолетов, 132 вертолета, 1355 беспилотных летательных аппаратов, 350 зенитных ракетных комплексов, 3797 танков и других боевых бронированных машин, 670 боевых машин реактивной системы залпового огня, 3012 орудий полевой артиллерии и минометов, а также 3848 единиц специальной военной автомобильной техники.",
    "url": "https://z.mil.ru/spec_mil_oper/brief/briefings/more.htm?id=12426663@egNews",
    "destroyed": {
      "САМОЛЕТЫ": 213,
      "ВЕРТОЛЕТЫ": 132,
      "БЕСПИЛОТНИКИ": 1355,
      "ЗЕНИТКИ": 350,
      "ТАНКИ И БМ": 3797,
      "РСЗО": 670,
      "АРТИЛЛЕРИЯ И МИНОМЕТЫ": 3012,
      "АВТОМОБИЛЬНАЯ ТЕХНИКА": 3848
    }
  },
  "27.06.2022": {
    "date": "27.06.2022",
    "message": "Вооруженные Силы Российской Федерации продолжают специальную военную операцию на Украине.\n\n26 июня Воздушно-космическими силами России нанесен удар четырьмя высокоточными ракетами воздушного базирования по цехам ракетно-строительной корпорации «Артем» в Шевченковском районе города Киева. На данном предприятии производились боеприпасы для украинских реактивных систем залпового огня.\n\nПо данным объективного контроля, все четыре ракеты достигли цели. Объект поражен. Гражданская инфраструктура города Киева, в результате применения высокоточного оружия, не пострадала.\n\nКиевским режимом предпринимались попытки перехвата российских высокоточных ракет зенитными средствами, размещенными в городе. Украинскими расчетами зенитных ракетных комплексов С-300 и «Бук-М1» было применено более 10 зенитных ракет.\n\nИз-за отсутствия сопряжения расположенных в городских кварталах пусковых установок комплексов ПВО и радиотехнических средств, две зенитные ракеты С-300 были сбиты в воздухе украинскими «Буками». Предположительно одна из сбитых зенитных ракет упала на жилой дом.\n\nНа фоне успехов российской армии по освобождению территории Донбасса украинское командование пытается остановить хаотичное бегство военнослужащих украинских подразделений в районе Лисичанска.\n\nТак, для удержания на позициях личного состава первого батальона 72-й механизированной бригады ВСУ в район населенного пункта Волчеяровка был направлен «заградотряд» нацистского формирования «Правый сектор». Российской артиллерией данное подразделение уничтожено.\n\nУправление украинскими войсками на лисичанском направлении потеряно. Так, командир 115-й отдельной механизированной бригады ВСУ, разместивший свой командный пункт в тыловой зоне, утратил управление своими подразделениями, что привело к безвозвратной потере в ходе боевых действий 80 процентов личного состава и около 70 процентов техники 138-го батальона этой бригады.\n\n26 июня в ходе боев в трех километрах от Лисичанского нефтеперерабатывающего завода Луганской Народной Республики российскими подразделениями уничтожены две диверсионно-разведывательные группы наемников общей численностью 14 боевиков.\n\nПервая группа была «интернациональной» и состояла из граждан различных европейских государств. Вторая – включала в себя только наемников из Грузии, входивших в так называемый «грузинский легион». В рядах данного бандформирования воюют преимущественно уголовники. Уничтоженные грузинские боевики причастны к зверским истязаниям и убийствам российских военнослужащих под Киевом в марте этого года.\n\nМинобороны России обладает информацией по каждому наемнику, причастному к издевательствам и убийствам наших военнослужащих. Мы их нашли и покарали.\n\nВооруженные Силы Российской Федерации продолжают наносить удары по военным объектам на территории Украины.\n\nВысокоточным оружием ВКС России нанесено поражение пункту дислокации 106-го батальона 63-й мотопехотной бригады ВСУ в районе населенного пункта Висунск Николаевской области. Уничтожено более 40 украинских военнослужащих и 12 единиц военной техники.\n\nКроме того, уничтожена живая сила и военная техника ВСУ в 27 районах, в том числе нацистских формирований «Правый сектор» в районе Лисичанска, а также «Азов» и «Кракен» в районе Харькова.\n\nТакже поражено пять пунктов управления ВСУ и три склада с боеприпасами и ракетно-артиллерийским вооружением в районах населенных пунктов Березнеговатое Николаевской области, Новодружеск Луганской Народной Республики.\n\nОперативно-тактической и армейской авиацией, ракетными войсками и артиллерией поражено: 24 пункта управления, артиллерийские и минометные подразделения в 58 районах, а также живая сила и военная техника в 304 районах.\n\nВ рамках контрбатарейной борьбы высокоточным оружием ВКС России на Донецком направлении поражено: три взвода реактивных систем залпового огня «Град» в районах Авдеевка, Дзержинск, взвод 155-мм гаубиц М-777 в районе Константиновки, два артиллерийских взвода 152-мм гаубиц «Гиацинт» в районах Калинов и Артемово, а также два взвода самоходных артиллерийских установок 2С1 «Гвоздика» в районах Очеретино и Новолуганск, осуществлявших обстрел Донецка и других городов Донецкой Народной Республики.\n\nРоссийскими средствами противовоздушной обороны уничтожены 10 украинских беспилотных летательных аппаратов в районах населенных пунктов Новый Бурлук, Аркушино, Курулька, Семеновка, Червоный Шахтер, Терновая Харьковской области, Чернобаевка Херсонской области, Щербаково Запорожской области и Петровеньки Луганской Народной Республики.\n\nТакже перехвачены две тактические ракеты «Точка-У» в районе населенного пункта Каховка Херсонской области и реактивный снаряд системы залпового огня в районе острова Змеиный.\n\nВсего с начала проведения специальной военной операции уничтожены: 215 самолетов, 132 вертолета, 1373 беспилотных летательных аппарата, 350 зенитных ракетных комплексов, 3830 танков и других боевых бронированных машин, 684 боевые машины реактивной системы залпового огня, 3025 орудий полевой артиллерии и минометов, а также 3870 единиц специальной военной автомобильной техники.",
    "url": "https://z.mil.ru/spec_mil_oper/brief/briefings/more.htm?id=12426875@egNews",
    "destroyed": {
      "САМОЛЕТЫ": 215,
      "ВЕРТОЛЕТЫ": 132,
      "БЕСПИЛОТНИКИ": 1373,
      "ЗЕНИТКИ": 350,
      "ТАНКИ И БМ": 3830,
      "РСЗО": 684,
      "АРТИЛЛЕРИЯ И МИНОМЕТЫ": 3025,
      "АВТОМОБИЛЬНАЯ ТЕХНИКА": 3870
    }
  },
  "28.06.2022": {
    "date": "28.06.2022",
    "message": "Вооруженные Силы Российской Федерации продолжают специальную военную операцию на Украине. Успешные совместные действия российских войск, подразделений народных милиций Донецкой и Луганской народных республик наносят критические потери ВСУ.\n\nВ результате ударов ВКС России по пункту дислокации нацистского формирования «Азов» в Харькове и одного из батальонов 92-й мотопехотной бригады у населенного пункта Покотиловка Харьковской области уничтожено более 100 украинских военнослужащих, иностранных наемников и до 15 единиц бронетанковой и автомобильной техники.\n\nСлабая обученность мобилизованных для участия в боевых действиях украинских граждан, а также низкий уровень подготовки иностранных наемников все чаще становятся причиной «дружественного огня». Так, минометному обстрелу со стороны своих сослуживцев подверглись новобранцы, прибывшие на доукомплектование 97-го батальона 60-й пехотной бригады. Похожий случай произошел в 28-й механизированной бригаде ВСУ, где иностранные наемники открыли огонь на поражение по разведывательной группе этого соединения. В результате – четыре военнослужащих погибли на месте, трое получили ранения.\n\nВооруженные Силы Российской Федерации продолжают наносить удары по военным объектам на территории Украины. 27 июня в городе Кременчуг Полтавской области ВКС России нанесен удар высокоточным оружием воздушного базирования по ангарам с поступившим от США и европейских стран вооружением и боеприпасами, в районе Кременчугского завода дорожных машин. В результате высокоточного удара, оружие и боеприпасы западного производства, сосредоточенные на складской территории для дальнейшей отправки украинской группировке войск на Донбассе, поражены. Детонация хранившихся боеприпасов к западному оружию, вызвала пожар в расположенном рядом с территорией завода не функционировавшем торговом центре.\n\nТакже ВКС России за сутки уничтожены два пункта управления в районе Спорное Донецкой Народной Республики, живая сила и военная техника ВСУ в 28 районах на Луганском и Донецком направлениях.\n\nВ рамках контрбатарейной борьбы высокоточным оружием ВКС России поражены четыре украинских взвода реактивных систем залпового огня «Град» в районах Ленинское, Селидово, Дзержинск, обстреливавших населенные пункты Донецкой Народной Республики, а также два артиллерийских взвода в районах Кирово Донецкой Народной Республики и Зайчевское Николаевской области.\n\nОперативно-тактической и армейской авиацией, ракетными войсками и артиллерией поражены: 24 пункта управления, артиллерийские и минометные подразделения в 58 районах, а также живая сила и военная техника в 304 районах.\n\nРоссийскими средствами противовоздушной обороны за сутки сбиты три самолета Су-25 и один вертолет Ми-8 воздушных сил Украины в районе населенного пункта Первомайское Николаевской области. Также уничтожены девять украинских беспилотных летательных аппаратов в районах населенных пунктов Дибровное, Шевченково, Дементиевка, Дмитровка Харьковской области, Еленовка, Луганское, Троицкое Донецкой Народной Республики, Лоскутовка Луганской Народной Республики. Кроме того, перехвачено: семь украинских баллистических х ракет «Точка-У» в районах Стаханов, Алчевск, Лозовский Луганской Народной Республики и десять реактивных снарядов системы залпового огня в районах Сухая Каменка, Терновая Харьковской области, Донецк, Ясиноватая, Троицкое и западные окраины Авдеевки Донецкой Народной Республики.\n\nВсего с начала проведения специальной военной операции уничтожены: 218 самолетов, 133 вертолета, 1382 беспилотных летательных аппарата, 350 зенитных ракетных комплексов, 3837 танков и других боевых бронированных машин, 690 боевых машин реактивной системы залпового огня, 3037 орудий полевой артиллерии и минометов, а также 3889 единиц специальной военной автомобильной техники.",
    "url": "https://z.mil.ru/spec_mil_oper/brief/briefings/more.htm?id=12426998@egNews",
    "destroyed": {
      "САМОЛЕТЫ": 218,
      "ВЕРТОЛЕТЫ": 133,
      "БЕСПИЛОТНИКИ": 1382,
      "ЗЕНИТКИ": 350,
      "ТАНКИ И БМ": 3837,
      "РСЗО": 690,
      "АРТИЛЛЕРИЯ И МИНОМЕТЫ": 3037,
      "АВТОМОБИЛЬНАЯ ТЕХНИКА": 3889
    }
  },
  "29.06.2022": {
    "date": "29.06.2022",
    "message": "Вооруженные Силы Российской Федерации продолжают специальную военную операцию на Украине.\n\nПротивник несет значительные потери.\n\nВ ходе наступательных действий в районе Лисичанского нефтеперерабатывающего завода большие потери нанесены 10-й горно-штурмовой бригаде ВСУ. По словам пленных военнослужащих данной бригады, 108-й батальон разгромлен полностью. Из 350 человек этого подразделении осталось только 30 военнослужащих.\n\nВ действующих на Лисичанском направлении подразделениях 115-й механизированной, 79-й десантно-штурмовой и 25-й воздушно-десантной бригад ВСУ критическая ситуация с продовольствием. Из-за голода фиксируются многочисленные случаи оставления позиций и дезертирства военнослужащих.\n\nВ районе населенного пункта Питомник Харьковской области в результате удара российской артиллерии уничтожены до 100 боевиков нацистского формирования «Кракен» и около 10 единиц боевой техники. Командование боевиков приняло решение оставить позиции и отвести остатки подразделения в город Харьков.\n\n* * *\n\nВооруженные Силы Российской Федерации продолжают наносить удары по военным объектам на территории Украины.\n\nВысокоточным оружием ВКС России за сутки уничтожены четыре пункта управления, в том числе батальонов территориальной обороны «Харьков-1» и «Харьков-2» в районе Харькова и база подготовки иностранных наемников в районе города Николаев.\n\nТакже поражены: живая сила и военная техника ВСУ в 32х районах, база ремонта техники ВСУ в районе Лисичанска, восемь складов боеприпасов и вооружения в районах Шевченково Херсонской области, Спорное Донецкой Народной Республики, Николаев и Очаково Николаевской области, а также база горючего в районе Кульбакино Николаевской области.\n\nВ рамках контрбатарейной борьбы высокоточным оружием ВКС России поражено два украинских взвода реактивных систем залпового огня «Град» в районах Калинов, Александрово-Калиновск, а также два артиллерийских взвода в районе Авдеевки, обстреливавших населенные пункты Донецкой Народной Республики.\n\nОперативно-тактической и армейской авиацией, ракетными войсками и артиллерией за сутки поражено 39 пунктов управления, шесть складов с боеприпасами, артиллерийские и минометные подразделения в 68 районах, в том числе подразделение самоходных артиллерийских установок «Цезарь» французского производства на острове Кубанский, а также живая сила и военная техника в 216 районах.\n\nОперативно-тактической авиацией ВКС России в районе Баштанки Николаевской области сбит в воздухе самолет МиГ-29 воздушных сил Украины.\n\nКроме того, в районе Троицкое Одесской области на огневой позиции уничтожена самоходная огневая установка зенитного ракетного комплекса «Бук-М1».\n\nРоссийскими средствами противовоздушной обороны за сутки сбиты два самолета Су-25 в районе Курулька Харьковской области, Квитневое Херсонской области и вертолет Ми-8 воздушных сил Украины в районе Архангельское Николаевской области.\n\nТакже сбиты девять украинских беспилотных летательных аппаратов в районах населенных пунктов Веселое, Ильичевка, Шестаково, Питомник, Липцы, Терновая, Сулиновка Харьковской области, Томина Балка Херсонской области, Стаханов и Кантемировка Донецкой Народной Республики.\n\nКроме того, перехвачено семь украинских баллистических ракет «Точка-У» в районах Пески-Радьковские, Капитоловка, Червоный Оскол Харьковской области, Тягинка, Новокондаково Херсонской области и восемь реактивных снарядов системы залпового огня в районах Каменка, Бражковка Харьковской области, Крымки, Новоселовка, Яровая Донецкой Народной Республики и над островом Змеиный.\n\nВсего с начала проведения специальной военной операции уничтожены: 221 самолет, 134 вертолета, 1391 беспилотный летательный аппарат, 351 зенитный ракетный комплекс, 3853 танка и других боевых бронированных машин, 692 боевые машины реактивной системы залпового огня, 3052 орудия полевой артиллерии и минометов, а также 3907 единиц специальной военной автомобильной техники.",
    "url": "https://z.mil.ru/spec_mil_oper/brief/briefings/more.htm?id=12427174@egNews",
    "destroyed": {
      "САМОЛЕТЫ": 221,
      "ВЕРТОЛЕТЫ": 134,
      "БЕСПИЛОТНИКИ": 1391,
      "ЗЕНИТКИ": 351,
      "ТАНКИ И БМ": 3853,
      "РСЗО": 692,
      "АРТИЛЛЕРИЯ И МИНОМЕТЫ": 3052,
      "АВТОМОБИЛЬНАЯ ТЕХНИКА": 3907
    }
  },
  "01.07.2022": {
    "date": "01.07.2022",
    "message": "Вооруженные Силы Российской Федерации продолжают успешное наступление в районе Лисичанска. За прошедшие трое суток взяты под контроль Лисичанский нефтеперерабатывающий завод, шахта Матросская, Желатиновый завод, населенный пункт Тополевка. Союзные силы вышли непосредственно к Лисичанску.\n\nУкраинская армия в данном районе несет большие потери. Только в населенном пункте Верхнекаменка противник за сутки потерял более 120 человек убитыми, и в Верхнекаменском – 70.\n\nНеудачи ВСУ на поле боя провоцируют рост количества дезертиров и уклоняющихся от участия в боевых действиях. Отмечается неорганизованный отход отдельных подразделений ВСУ из Лисичанска.\n\nКомандование всячески скрывает факты неукомплектованности подразделений. Так, в одном из батальонов 17-й танковой бригады, действующем в районе населенного пункта Новая Полтавка Донецкой Народной Республики, осталось в строю не более 20% личного состава от штатной численности.\n\nОдновременно киевский режим нашло «крайних» за военные провалы ВСУ в очередном «котле» на Донбассе. Так, вторым отделом управления Государственного бюро расследований Украины по городу Краматорск в отношении командования и 171 бойца 42-го батальона 57-й мотопехотной бригады, оборонявшихся в «Горском котле», возбуждены уголовные дела.\n\nДанные военнослужащие задержаны и помещены в изолятор временного содержания города Краматорска.\n\nВооруженные Силы Российской Федерации продолжают наносить удары по военным объектам на территории Украины.\n\nВысокоточным оружием ВКС России за сутки уничтожены два пункта управления, пять складов с боеприпасами в районах населённых пунктов Ивано-Дарьевка, Северск Донецкой Народной Республики, Белогоровка Луганской Народной Республики, Николаев, Лепетиха Николаевской области, а также живая сила и военная техника ВСУ в 26 районах.\n\nВ ходе контрбатарейной борьбы высокоточным оружием ВКС России поражены два взвода реактивных систем залпового огня и два артиллерийских взвода в районе Лесовка, Селидово и Нетайлово, обстреливавших населенные пункты Донецкой Народной Республики.\n\nОперативно-тактической и армейской авиацией, ракетными войсками и артиллерией поражены: 32 пункта управления ВСУ, радиолокационная станция обнаружения воздушных целей в районе Катранка Одесской области, три склада боеприпасов в районе Спорное Донецкой Народной Республики, а также живая сила и военная техника в 297 районах.\n\nРоссийскими средствами противовоздушной обороны сбиты два самолета Су-25 воздушных сил Украины в районах населенных пунктов Барвенково и Курулька Харьковской области.\n\nТакже сбито 11 украинских беспилотных летательных аппаратов в районах Петровеньки, Берестовое Донецкой Народной Республики, Бражковка, Великие Хутора, Староверовка, Веселое, Байрак, Гетмановка, Иванчуковка, Перемога Харьковской области, Переможная Запорожской области,\n\nПерехвачено восемь реактивных снарядов системы залпового огня в районах: Никольское Харьковской области, Стаханов Луганской Народной Республики и Первомайск Донецкой Народной Республики.\n\nВсего с начала проведения специальной военной операции уничтожены: 226 самолетов, 134 вертолета, 1411 беспилотных летательных аппаратов, 353 зенитных ракетных комплекса,\n\n3873 танка и других боевых бронированных машин, 699 боевых машин реактивной системы залпового огня, 3067 орудий полевой артиллерии и минометов, а также 3948 единиц специальной военной автомобильной техники.",
    "url": "https://z.mil.ru/spec_mil_oper/brief/briefings/more.htm?id=12427516@egNews",
    "destroyed": {
      "САМОЛЕТЫ": 226,
      "ВЕРТОЛЕТЫ": 134,
      "БЕСПИЛОТНИКИ": 1411,
      "ЗЕНИТКИ": 353,
      "ТАНКИ И БМ": 3873,
      "РСЗО": 699,
      "АРТИЛЛЕРИЯ И МИНОМЕТЫ": 3067,
      "АВТОМОБИЛЬНАЯ ТЕХНИКА": 3948
    }
  },
  "02.07.2022": {
    "date": "02.07.2022",
    "message": "Вооруженные Силы Российской Федерации продолжают специальную военную операцию на Украине.\n\nПротивник несет значительные потери на всех направлениях.\n\nВ районах населенных пунктов Верхнекаменка и Золотаревка три батальона 10-й горно-штурмовой и 72-й механизированной бригад, только за сутки боев потеряли более 50 процентов личного состава.\n\nВ районе населенного пункта Артемовск высокоточным оружием Воздушно-космических сил нанесен удар по пункту временного размещения 1-го батальона 30-й механизированной бригады. Уничтожено до 120-ти украинских военнослужащих и около 15-ти единиц военной техники.\n\nКроме того, ударами российской авиации поражена база временного хранения вооружения и военной техники 10-й горно-штурмовой бригады, располагавшаяся на территории тракторного завода г. Харьков. Уничтожены до 30-ти человек личного состава и 10 единиц бронетанковой и автомобильной техники.\n\nВооруженные Силы Российской Федерации продолжают наносить удары по военным объектам на территории Украины.\n\nВысокоточным оружием ВКС России за сутки уничтожены пять пунктов управления ВСУ в районах Артемовск и Часов Яр Донецкой Народной Республики, Первомайское, Зеленый Гай и Бармашово Николаевской области, три склада с боеприпасами в районах населенных пунктов Шевченково и Новогригоровка Запорожской области, а также живая сила и военная техника ВСУ в 32-х районах.\n\nВ рамках контрбатарейной борьбы высокоточным оружием ВКС России поражено четыре взвода реактивных систем залпового огня в районах Новолуганское, Желанное, Бердычи и Воздвиженка с которых ВСУ обстреливали населенные пункты Донецкой Народной Республики.\n\nОперативно-тактической и армейской авиацией, ракетными войсками и артиллерией поражено: 39 пунктов управления ВСУ, два склада боеприпасов в районе города Николаев, а также живая сила и военная техника в 302-х районах.\n\nРоссийскими средствами противовоздушной обороны сбит в воздухе самолет МиГ-29 воздушных сил Украины в районе населенного пункта Явкино Николаевской области.\n\nТакже сбиты 19 украинских беспилотных летательных аппаратов в районах населенных пунктов Воскресеновка, Глинское, Питомник, Жовтневое, Рубежное, Петровка Харьковской области, Работино, Новоданиловка Запорожской области, Петровское, Попасная, Кременная Луганской Народной Республики, Снежное, Высокое, Ясиноватая, Донецк, Макеевка, Докучаевск, Комсомольское Донецкой Народной Республики.\n\nПерехвачены четыре реактивных снаряда залпового огня в районах населенных пунктов Ясиноватая, Минеральное Донецкой Народной Республики и Чернобаевка Херсонской области.\n\nВсего с начала проведения специальной военной операции уничтожены: 227 самолетов, 134 вертолета, 1430 беспилотных летательных аппаратов, 353 зенитных ракетных комплекса,3886 танков и других боевых бронированных машин, 702 боевые машины реактивной системы залпового огня, 3073 орудия полевой артиллерии и минометов, а также 3954 единиц специальной военной автомобильной техники.",
    "url": "https://z.mil.ru/spec_mil_oper/brief/briefings/more.htm?id=12427621@egNews",
    "destroyed": {
      "САМОЛЕТЫ": 227,
      "ВЕРТОЛЕТЫ": 134,
      "БЕСПИЛОТНИКИ": 1430,
      "ЗЕНИТКИ": 353,
      "ТАНКИ И БМ": 3886,
      "РСЗО": 702,
      "АРТИЛЛЕРИЯ И МИНОМЕТЫ": 3073,
      "АВТОМОБИЛЬНАЯ ТЕХНИКА": 3954
    }
  },
  "03.07.2022": {
    "date": "03.07.2022",
    "message": "Вооруженные Силы Российской Федерации продолжают специальную военную операцию на Украине.\n\nВ результате успешных наступательных действий, войска группировки «Центр» под командованием генерал-полковника Александра Лапина овладели населенными пунктами Верхнекаменка, Золотаревка, Белогоровка, вышли к реке Северский Донец и совместно с Южной группировкой войск под командованием генерала армии Сергея Суровикина замкнули кольцо окружения вокруг Лисичанска.\n\nВ очередном «котле» полностью заблокирована украинская группировка войск.\n\nТолько за последние двое суток в данном районе сдались в плен 38 украинских военнослужащих, большую часть которых составляют местные жители, насильно мобилизованные в ряды ВСУ.\n\nРоссийские войска и подразделения Луганской Народной Республики ведут бои внутри Лисичанска, завершая разгром окруженного противника. В течение вчерашнего дня в окрестностях Лисичанска освобождены населенные пункты Новодружеск, Малорязанцево и Белая Гора.\n\nПротивник несет значительные потери на всех направлениях.\n\nВ районе населенного пункта Марьинка Донецкой Народной Республики 54-я механизированная бригада ВСУ за несколько суток боев потеряла более 60 процентов личного состава и техники. Оставшийся личный состав деморализован и отказывается выполнять боевые задачи.\n\nВ восточной части города Харьков ударом высокоточного оружия Воздушно-космических сил ликвидирован пункт временной дислокации 127-й отдельной бригады территориальной обороны.\n\nВ результате удара уничтожено более 100 украинских военнослужащих и 15 единиц военной техники.\n\nУдаром ВКС России по базе иностранных наемников на северной окраине города Николаев уничтожено до 120 «солдат удачи».\n\nВ районе населенного пункта Спорное Донецкой Народной Республики уничтожено подразделение 5-го отдельного штурмового полка 1-й отдельной бригады президента Украины имени гетмана Б.Хмельницкого. В результате огневого поражения 18 украинских боевиков уничтожено, двое сдались в плен, остальные разбежались.\n\nВооруженные Силы Российской Федерации продолжают наносить удары по военным объектам на территории Украины.\n\nВысокоточным Оружием ВКС России За Сутки Уничтожены Десять Пунктов Управления В Районах Спорное Донецкой Народной Республики, Лепетиха Николаевской Области, Зеленодольск Днепропетровской Области, Семь Складов С Боеприпасами В Районах Населенных Пунктов Константиновка, Бахмут Донецкой Народной Республики, Малая Шестерня Херсонской Области, Висунск, Николаевка И Поляна Николаевской Области, Живая Сила И Военная Техника ВСУ В 15-Ти Районах.\n\nВ рамках контрбатарейной борьбы высокоточным оружием ВКС России поражено три артиллерийских и пять минометных взводов в районах населенных пунктов Верхнекаменское Донецкой Народной Республики, Белогоровка, Малорязанцево, Золотаревка Луганской Народной Республики.\n\nОперативно-тактической и армейской авиацией, ракетными войсками и артиллерией поражены: 32 пункта управления ВСУ, склад боеприпасов, а также живая сила и военная техника в 287-ми районах.\n\nРоссийскими средствами противовоздушной обороны сбиты два Су-25 воздушных сил Украины в районах населенных пунктов Дибровное Харьковской области и Квитнево Николаевской области.\n\nТакже сбиты десять украинских беспилотных летательных аппаратов в районах Новое Запорожской области, Волноваха, Донецк Донецкой Народной Республики, Дмитровка, Изюм, Березовка и Купянск Харьковской области.\n\nПерехвачено восемь снарядов РСЗО, в том числе четыре – реактивных снаряда системы залпового огня «Химарс» в районе Стаханов Луганской Народной Республики и четыре реактивных снаряда «Ураган» в районах населенных пунктов Попасная Луганской Народной Республики и Каменка Харьковской области и города Донецк.\n\nВсего с начала проведения специальной военной операции уничтожены: 229 самолетов, 134 вертолета, 1440 беспилотных летательных аппаратов, 353 зенитных ракетных комплексов, 3893 танка и других боевых бронированных машин, 704 боевые машины реактивной системы залпового огня, 3078 орудий полевой артиллерии и минометов, а также 3979 единиц специальной военной автомобильной техники.\n\nСегодня ночью с трех часов до трех тридцати московского времени киевским режимом был совершен преднамеренный удар баллистическими ракетами «Точка-У» с кассетными боеприпасами и беспилотниками Ту-143 «Рейс» по жилым кварталам Белгорода и Курска, где нет никаких военных объектов.\n\nХочу подчеркнуть, данный ракетный удар целенаправленно планировался и был осуществлен против мирного гражданского населения российских городов.\n\nРоссийскими средствами ПВО все три запущенные украинскими националистами по Белгороду баллистические ракеты «Точка-У» с кассетными головными частями уничтожены в воздухе. В результате поражения украинских ракет, обломки одной из них упали на жилой дом в городе.\n\nТакже российскими средствами ПВО на подлете к Курску были уничтожены два начиненных взрывчаткой украинских реактивных беспилотных летательных аппарата Ту-143 «Рейс».",
    "url": "https://z.mil.ru/spec_mil_oper/brief/briefings/more.htm?id=12427692@egNews",
    "destroyed": {
      "САМОЛЕТЫ": 229,
      "ВЕРТОЛЕТЫ": 134,
      "БЕСПИЛОТНИКИ": 1440,
      "ЗЕНИТКИ": 353,
      "ТАНКИ И БМ": 3893,
      "РСЗО": 704,
      "АРТИЛЛЕРИЯ И МИНОМЕТЫ": 3078,
      "АВТОМОБИЛЬНАЯ ТЕХНИКА": 3979
    }
  },
  "04.07.2022": {
    "date": "04.07.2022",
    "message": "В результате успешных наступательных действий российских Вооруженных Сил в Луганской Народной Республике украинским командованием потеряно управление отступающими подразделениями 10-й горно-штурмовой, 72-й и 115-й механизированных бригад ВСУ, а также 118-й бригады территориальной обороны.\n\nПротивник несет значительные потери на всех направлениях.\n\nЗа прошедшие сутки высокоточным оружием ВКС России поражены пункты временной дислокации 92-й механизированной и 40-й артиллерийской бригад ВСУ в городе Харьков, где находилось около 200 украинских военнослужащих и до 19 единиц военной техники.\n\nВооруженными Силами Российской Федерации продолжается проведение специальной военной операции на Украине.\n\nВысокоточным оружием ВКС России за сутки уничтожены семь пунктов управления, в том числе 25-й воздушно-десантной бригады в районе Северска Донецкой Народной Республики, два склада с боеприпасами и ракетно-артиллерийским вооружением в Ивано-Дарьевке и Артемовске Донецкой Народной Республики, батарея реактивных систем залпового огня «Град» в районе перезарядки, а также живая сила и военная техника ВСУ в 16-и районах.\n\nВ ходе контрбатарейной борьбы высокоточным оружием ВКС России поражено четыре украинских взвода реактивных систем залпового огня в районах населенных пунктов Тарасовка, Новая Полтавка, Ульяновка Донецкой Народной Республики.\n\nОперативно-тактической и армейской авиацией, ракетными войсками и артиллерией за сутки поражены: два пункта управления подразделений ВСУ, три склада боеприпасов в районе Спорное Донецкой Народной Республики, а также живая сила и военная техника ВСУ в 61-м районе.\n\nВ ходе воздушного боя в районе Ясная Поляна Донецкой Народной Республики российским истребителем сбит Су-25 воздушных сил Украины.\n\nРоссийскими средствами противовоздушной обороны за сутки сбито восемь украинских беспилотных летательных аппаратов в районах Константиновка, Авдеевка Донецкой Народной Республики, Корнауховка, Кочубеевка, ИванчуковкА Харьковской области, Шевченково Запорожской области и Томина Балка Херсонской области.\n\nТакже перехвачено 11 снарядов РСЗО «Ураган» в районах населенных пунктов Сухая Каменка, Долгенькое Харьковской области, Авдеевка, Ясиноватая Донецкой Народной Республики, Попасная Луганской Народной Республики.\n\nВсего с начала проведения специальной военной операции уничтожены: 230 самолетов, 134 вертолета, 1448 беспилотных летательных аппарата, 353 зенитных ракетных комплекса, 3904 танка и других боевых бронированных машин, 706 боевых машин реактивной системы залпового огня, 3084 орудия полевой артиллерии и миномета, а также 4002 единицы специальной военной автомобильной техники.",
    "url": "https://z.mil.ru/spec_mil_oper/brief/briefings/more.htm?id=12427751@egNews",
    "destroyed": {
      "САМОЛЕТЫ": 230,
      "ВЕРТОЛЕТЫ": 134,
      "БЕСПИЛОТНИКИ": 1448,
      "ЗЕНИТКИ": 353,
      "ТАНКИ И БМ": 3904,
      "РСЗО": 706,
      "АРТИЛЛЕРИЯ И МИНОМЕТЫ": 3084,
      "АВТОМОБИЛЬНАЯ ТЕХНИКА": 4002
    }
  },
  "06.07.2022": {
    "date": "06.07.2022",
    "message": "Вооруженные Силы Российской Федерации продолжают наносить удары по военным объектам на территории Украины.\n\nУдаром ВКС России по пункту временной дислокации 22-го мотопехотного батальона 92-й механизированной бригады, расположенному в Харькове, уничтожено до 100 украинских националистов и четыре единицы военной техники.\n\nВ районе населенного пункта Малотарановка Донецкой Народной Республики высокоточными ракетами воздушного базирования уничтожены две пусковые установки системы залпового огня HIMARS производства США и два склада боеприпасов к ним.\n\nВ районе Широколановки Николаевской области высокоточным оружием уничтожена радиолокационная станция наведения зенитной ракетной системы С-300, а также пункт временной дислокации подразделений иностранных наемников в районе населенного пункта Лиманы Николаевской области.\n\nНа восточной окраине населенного пункта Соледар авиацией ВКС России уничтожен склад ракетно-артиллерийского вооружения 57-й механизированной бригады, на котором хранилось 1,5 тыс. снарядов различного калибра и более 100 противотанковых ракетных комплексов иностранного производства.\n\nКроме того, ВКС России за сутки уничтожено: шесть пунктов управления, в том числе оперативной группы войск «Юг», 79-й десантно-штурмовой и 57-й механизированной бригад ВСУ в районах населенных пунктов Баштанка, Николаев и Соледар; шесть складов с вооружением и боеприпасами в районах населенных пунктов Баштанка Николаевской области, Ивано-Дарьевка, Зайцево, Звановка, Артемовск Донецкой Народной Республики и Харьков, а также живая сила и военная техника ВСУ в 27 районах.\n\nВ рамках контрбатарейной борьбы уничтожен взвод реактивных систем залпового огня «Ураган», поражены три артиллерийских взвода на огневых позициях в районах Дзержинска и Ленинское Донецкой Народной Республики, а также взвод реактивных систем залпового огня «Град» в районе населенного пункта Воскресенское Николаевской области.\n\nОперативно-тактической и армейской авиацией, ракетными войсками и артиллерией поражена живая сила и военная техника ВСУ в 77 районах. Российским истребителем Су-35 в ходе одного воздушного боя в районе населенных пунктов Николаевка и Снегиревка Николаевской области сбиты два вертолета Ми-24 и один самолет Су-25 воздушных сил Украины.\n\nКроме того, российскими средствами противовоздушной обороны в районе населенного пункта Первомайское Николаевской области сбит один вертолет Ми-8 воздушных сил Украины.\n\nТакже сбиты 11 украинских беспилотных летательных аппаратов в районах населенных пунктов Зеленый Гай Николаевской области, Вернополье, Долгенькое, Малые Проходы, Топольское, Червоная, Грушовка Харьковской области, Чернобаевка, Грозовое, Нововладимировка Херсонской области и Александрополье Луганской Народной Республики.\n\nПерехвачено девять украинских баллистических ракет «Точка-У» в районах Чернобаевки Херсонской области, Первомайска Донецкой Народной Республики, Хорошего, Славяносербска, Калиново, Троицкого и Стаханова Луганской Народной Республики и восемь реактивных снарядов систем залпового огня в районах населенных пунктов Долгенькое Харьковской области, Чернобаевка Херсонской области и Луганска.\n\nВсего с начала проведения специальной военной операции уничтожены: 232 самолета, 137 вертолетов, 1462 беспилотных летательных аппарата, 353 зенитных ракетных комплекса, 3915 танков и других боевых бронированных машин, 720 боевых машин реактивной системы залпового огня, 3096 орудий полевой артиллерии и минометов, а также 4043 единицы специальной военной автомобильной техники.",
    "url": "https://z.mil.ru/spec_mil_oper/brief/briefings/more.htm?id=12428063@egNews",
    "destroyed": {
      "САМОЛЕТЫ": 232,
      "ВЕРТОЛЕТЫ": 137,
      "БЕСПИЛОТНИКИ": 1462,
      "ЗЕНИТКИ": 353,
      "ТАНКИ И БМ": 3915,
      "РСЗО": 720,
      "АРТИЛЛЕРИЯ И МИНОМЕТЫ": 3096,
      "АВТОМОБИЛЬНАЯ ТЕХНИКА": 4043
    }
  }
}